Sheet: Sheet1
A1: 2.8610000000000002 | B1: 1.7100000000000001E-2 | C1: =RC[-2]-R1C1 -> 0 | D1: =RC[-2]-R1C2 -> 0
A2: 2.97 | B2: 1.7100000000000001E-2 | C2: =RC[-2]-R1C1 -> 0.10899999999999999 | D2: =RC[-2]-R1C2 -> 0
A3: 3.077 | B3: 9.5200000000000007E-2 | C3: =RC[-2]-R1C1 -> 0.21599999999999975 | D3: =RC[-2]-R1C2 -> 7.8100000000000003E-2
A4: 3.1859999999999999 | B4: 9.5200000000000007E-2 | C4: =RC[-2]-R1C1 -> 0.32499999999999973 | D4: =RC[-2]-R1C2 -> 7.8100000000000003E-2
A5: 3.2949999999999999 | B5: 0.1709 | C5: =RC[-2]-R1C1 -> 0.43399999999999972 | D5: =RC[-2]-R1C2 -> 0.15379999999999999
A6: 3.4039999999999999 | B6: 0.1734 | C6: =RC[-2]-R1C1 -> 0.54299999999999971 | D6: =RC[-2]-R1C2 -> 0.15629999999999999
A7: 3.5129999999999999 | B7: 0.2442 | C7: =RC[-2]-R1C1 -> 0.65199999999999969 | D7: =RC[-2]-R1C2 -> 0.2271
A8: 3.62 | B8: 0.2442 | C8: =RC[-2]-R1C1 -> 0.7589999999999999 | D8: =RC[-2]-R1C2 -> 0.2271
A9: 3.7280000000000002 | B9: 0.31259999999999999 | C9: =RC[-2]-R1C1 -> 0.86699999999999999 | D9: =RC[-2]-R1C2 -> 0.29549999999999998
A10: 3.8370000000000002 | B10: 0.31259999999999999 | C10: =RC[-2]-R1C1 -> 0.97599999999999998 | D10: =RC[-2]-R1C2 -> 0.29549999999999998
A11: 3.9449999999999998 | B11: 0.3785 | C11: =RC[-2]-R1C1 -> 1.0839999999999996 | D11: =RC[-2]-R1C2 -> 0.3614
A12: 4.0529999999999999 | B12: 0.38100000000000001 | C12: =RC[-2]-R1C1 -> 1.1919999999999997 | D12: =RC[-2]-R1C2 -> 0.3639
A13: 4.16 | B13: 0.44690000000000002 | C13: =RC[-2]-R1C1 -> 1.2989999999999999 | D13: =RC[-2]-R1C2 -> 0.42980000000000002
A14: 4.2690000000000001 | B14: 0.44690000000000002 | C14: =RC[-2]-R1C1 -> 1.4079999999999999 | D14: =RC[-2]-R1C2 -> 0.42980000000000002
A15: 4.3780000000000001 | B15: 0.51039999999999996 | C15: =RC[-2]-R1C1 -> 1.5169999999999999 | D15: =RC[-2]-R1C2 -> 0.49329999999999996
A16: 4.4870000000000001 | B16: 0.51039999999999996 | C16: =RC[-2]-R1C1 -> 1.6259999999999999 | D16: =RC[-2]-R1C2 -> 0.49329999999999996
A17: 4.5949999999999998 | B17: 0.57140000000000002 | C17: =RC[-2]-R1C1 -> 1.7339999999999995 | D17: =RC[-2]-R1C2 -> 0.55430000000000001
A18: 4.7030000000000003 | B18: 0.57389999999999997 | C18: =RC[-2]-R1C1 -> 1.8420000000000001 | D18: =RC[-2]-R1C2 -> 0.55679999999999996
A19: 4.8109999999999999 | B19: 0.63249999999999995 | C19: =RC[-2]-R1C1 -> 1.9499999999999997 | D19: =RC[-2]-R1C2 -> 0.61539999999999995
A20: 4.92 | B20: 0.63490000000000002 | C20: =RC[-2]-R1C1 -> 2.0589999999999997 | D20: =RC[-2]-R1C2 -> 0.61780000000000002
A21: 5.0279999999999996 | B21: 0.69110000000000005 | C21: =RC[-2]-R1C1 -> 2.1669999999999994 | D21: =RC[-2]-R1C2 -> 0.67400000000000004
A22: 5.1369999999999996 | B22: 0.69110000000000005 | C22: =RC[-2]-R1C1 -> 2.2759999999999994 | D22: =RC[-2]-R1C2 -> 0.67400000000000004
A23: 5.2439999999999998 | B23: 0.74970000000000003 | C23: =RC[-2]-R1C1 -> 2.3829999999999996 | D23: =RC[-2]-R1C2 -> 0.73260000000000003
A24: 5.3529999999999998 | B24: 0.74970000000000003 | C24: =RC[-2]-R1C1 -> 2.4919999999999995 | D24: =RC[-2]-R1C2 -> 0.73260000000000003
A25: 5.4619999999999997 | B25: 0.80589999999999995 | C25: =RC[-2]-R1C1 -> 2.6009999999999995 | D25: =RC[-2]-R1C2 -> 0.78879999999999995
A26: 5.5709999999999997 | B26: 0.80589999999999995 | C26: =RC[-2]-R1C1 -> 2.7099999999999995 | D26: =RC[-2]-R1C2 -> 0.78879999999999995
A27: 5.68 | B27: 0.85960000000000003 | C27: =RC[-2]-R1C1 -> 2.8189999999999995 | D27: =RC[-2]-R1C2 -> 0.84250000000000003
A28: 5.7880000000000003 | B28: 0.86199999999999999 | C28: =RC[-2]-R1C1 -> 2.927 | D28: =RC[-2]-R1C2 -> 0.84489999999999998
A29: 5.8959999999999999 | B29: 0.91090000000000004 | C29: =RC[-2]-R1C1 -> 3.0349999999999997 | D29: =RC[-2]-R1C2 -> 0.89380000000000004
A30: 6.0049999999999999 | B30: 0.9133 | C30: =RC[-2]-R1C1 -> 3.1439999999999997 | D30: =RC[-2]-R1C2 -> 0.8962
A31: 6.1130000000000004 | B31: 0.96460000000000001 | C31: =RC[-2]-R1C1 -> 3.2520000000000002 | D31: =RC[-2]-R1C2 -> 0.94750000000000001
A32: 6.2220000000000004 | B32: 0.96460000000000001 | C32: =RC[-2]-R1C1 -> 3.3610000000000002 | D32: =RC[-2]-R1C2 -> 0.94750000000000001
A33: 6.3289999999999997 | B33: 1.0134000000000001 | C33: =RC[-2]-R1C1 -> 3.4679999999999995 | D33: =RC[-2]-R1C2 -> 0.99630000000000007
A34: 6.4379999999999997 | B34: 1.0134000000000001 | C34: =RC[-2]-R1C1 -> 3.5769999999999995 | D34: =RC[-2]-R1C2 -> 0.99630000000000007
A35: 6.5469999999999997 | B35: 1.0623 | C35: =RC[-2]-R1C1 -> 3.6859999999999995 | D35: =RC[-2]-R1C2 -> 1.0452000000000001
A36: 6.6559999999999997 | B36: 1.0623 | C36: =RC[-2]-R1C1 -> 3.7949999999999995 | D36: =RC[-2]-R1C2 -> 1.0452000000000001
A37: 6.7649999999999997 | B37: 1.1111 | C37: =RC[-2]-R1C1 -> 3.9039999999999995 | D37: =RC[-2]-R1C2 -> 1.0940000000000001
A38: 6.8730000000000002 | B38: 1.1111 | C38: =RC[-2]-R1C1 -> 4.0120000000000005 | D38: =RC[-2]-R1C2 -> 1.0940000000000001
A39: 6.9809999999999999 | B39: 1.1575 | C39: =RC[-2]-R1C1 -> 4.1199999999999992 | D39: =RC[-2]-R1C2 -> 1.1404000000000001
A40: 7.09 | B40: 1.1575 | C40: =RC[-2]-R1C1 -> 4.2289999999999992 | D40: =RC[-2]-R1C2 -> 1.1404000000000001
A41: 7.1980000000000004 | B41: 1.2015 | C41: =RC[-2]-R1C1 -> 4.3369999999999997 | D41: =RC[-2]-R1C2 -> 1.1844000000000001
A42: 7.3070000000000004 | B42: 1.2015 | C42: =RC[-2]-R1C1 -> 4.4459999999999997 | D42: =RC[-2]-R1C2 -> 1.1844000000000001
A43: 7.4139999999999997 | B43: 1.2454000000000001 | C43: =RC[-2]-R1C1 -> 4.552999999999999 | D43: =RC[-2]-R1C2 -> 1.2283000000000002
A44: 7.5229999999999997 | B44: 1.2479 | C44: =RC[-2]-R1C1 -> 4.661999999999999 | D44: =RC[-2]-R1C2 -> 1.2308000000000001
A45: 7.6319999999999997 | B45: 1.2894000000000001 | C45: =RC[-2]-R1C1 -> 4.770999999999999 | D45: =RC[-2]-R1C2 -> 1.2723000000000002
A46: 7.7409999999999997 | B46: 1.2918000000000001 | C46: =RC[-2]-R1C1 -> 4.879999999999999 | D46: =RC[-2]-R1C2 -> 1.2747000000000002
A47: 7.85 | B47: 1.3309 | C47: =RC[-2]-R1C1 -> 4.988999999999999 | D47: =RC[-2]-R1C2 -> 1.3138000000000001
A48: 7.9569999999999999 | B48: 1.3309 | C48: =RC[-2]-R1C1 -> 5.0960000000000001 | D48: =RC[-2]-R1C2 -> 1.3138000000000001
A49: 8.0649999999999995 | B49: 1.37 | C49: =RC[-2]-R1C1 -> 5.2039999999999988 | D49: =RC[-2]-R1C2 -> 1.3529000000000002
A50: 8.1739999999999995 | B50: 1.37 | C50: =RC[-2]-R1C1 -> 5.3129999999999988 | D50: =RC[-2]-R1C2 -> 1.3529000000000002
A51: 8.282 | B51: 1.4115 | C51: =RC[-2]-R1C1 -> 5.4209999999999994 | D51: =RC[-2]-R1C2 -> 1.3944000000000001
A52: 8.391 | B52: 1.4138999999999999 | C52: =RC[-2]-R1C1 -> 5.5299999999999994 | D52: =RC[-2]-R1C2 -> 1.3968
A53: 8.4979999999999993 | B53: 1.4480999999999999 | C53: =RC[-2]-R1C1 -> 5.6369999999999987 | D53: =RC[-2]-R1C2 -> 1.431
A54: 8.6069999999999993 | B54: 1.4504999999999999 | C54: =RC[-2]-R1C1 -> 5.7459999999999987 | D54: =RC[-2]-R1C2 -> 1.4334
A55: 8.7159999999999993 | B55: 1.4872000000000001 | C55: =RC[-2]-R1C1 -> 5.8549999999999986 | D55: =RC[-2]-R1C2 -> 1.4701000000000002
A56: 8.8249999999999993 | B56: 1.4872000000000001 | C56: =RC[-2]-R1C1 -> 5.9639999999999986 | D56: =RC[-2]-R1C2 -> 1.4701000000000002
A57: 8.9339999999999993 | B57: 1.5238 | C57: =RC[-2]-R1C1 -> 6.0729999999999986 | D57: =RC[-2]-R1C2 -> 1.5067000000000002
A58: 9.0410000000000004 | B58: 1.5238 | C58: =RC[-2]-R1C1 -> 6.18 | D58: =RC[-2]-R1C2 -> 1.5067000000000002
A59: 9.1489999999999991 | B59: 1.5604 | C59: =RC[-2]-R1C1 -> 6.2879999999999985 | D59: =RC[-2]-R1C2 -> 1.5433000000000001
A60: 9.2579999999999991 | B60: 1.5604 | C60: =RC[-2]-R1C1 -> 6.3969999999999985 | D60: =RC[-2]-R1C2 -> 1.5433000000000001
A61: 9.3659999999999997 | B61: 1.5946 | C61: =RC[-2]-R1C1 -> 6.504999999999999 | D61: =RC[-2]-R1C2 -> 1.5775000000000001
A62: 9.4749999999999996 | B62: 1.5946 | C62: =RC[-2]-R1C1 -> 6.613999999999999 | D62: =RC[-2]-R1C2 -> 1.5775000000000001
A63: 9.5820000000000007 | B63: 1.6288 | C63: =RC[-2]-R1C1 -> 6.7210000000000001 | D63: =RC[-2]-R1C2 -> 1.6117000000000001
A64: 9.6910000000000007 | B64: 1.6288 | C64: =RC[-2]-R1C1 -> 6.83 | D64: =RC[-2]-R1C2 -> 1.6117000000000001
A65: 9.8 | B65: 1.663 | C65: =RC[-2]-R1C1 -> 6.9390000000000001 | D65: =RC[-2]-R1C2 -> 1.6459000000000001
A66: 9.9090000000000007 | B66: 1.663 | C66: =RC[-2]-R1C1 -> 7.048 | D66: =RC[-2]-R1C2 -> 1.6459000000000001
A67: 10.018000000000001 | B67: 1.6947000000000001 | C67: =RC[-2]-R1C1 -> 7.157 | D67: =RC[-2]-R1C2 -> 1.6776000000000002
A68: 10.127000000000001 | B68: 1.6947000000000001 | C68: =RC[-2]-R1C1 -> 7.266 | D68: =RC[-2]-R1C2 -> 1.6776000000000002
A69: 10.234999999999999 | B69: 1.7241 | C69: =RC[-2]-R1C1 -> 7.3739999999999988 | D69: =RC[-2]-R1C2 -> 1.7070000000000001
A70: 10.343999999999999 | B70: 1.7264999999999999 | C70: =RC[-2]-R1C1 -> 7.4829999999999988 | D70: =RC[-2]-R1C2 -> 1.7094
A71: 10.451000000000001 | B71: 1.7582 | C71: =RC[-2]-R1C1 -> 7.59 | D71: =RC[-2]-R1C2 -> 1.7411000000000001
A72: 10.56 | B72: 1.7582 | C72: =RC[-2]-R1C1 -> 7.6989999999999998 | D72: =RC[-2]-R1C2 -> 1.7411000000000001
A73: 10.669 | B73: 1.7850999999999999 | C73: =RC[-2]-R1C1 -> 7.8079999999999998 | D73: =RC[-2]-R1C2 -> 1.768
A74: 10.776999999999999 | B74: 1.7875000000000001 | C74: =RC[-2]-R1C1 -> 7.9159999999999986 | D74: =RC[-2]-R1C2 -> 1.7704000000000002
A75: 10.885999999999999 | B75: 1.8144 | C75: =RC[-2]-R1C1 -> 8.0249999999999986 | D75: =RC[-2]-R1C2 -> 1.7973000000000001
A76: 10.994 | B76: 1.8144 | C76: =RC[-2]-R1C1 -> 8.1329999999999991 | D76: =RC[-2]-R1C2 -> 1.7973000000000001
A77: 11.102 | B77: 1.8436999999999999 | C77: =RC[-2]-R1C1 -> 8.2409999999999997 | D77: =RC[-2]-R1C2 -> 1.8266
A78: 11.211 | B78: 1.8436999999999999 | C78: =RC[-2]-R1C1 -> 8.35 | D78: =RC[-2]-R1C2 -> 1.8266
A79: 11.319000000000001 | B79: 1.873 | C79: =RC[-2]-R1C1 -> 8.4580000000000002 | D79: =RC[-2]-R1C2 -> 1.8559000000000001
A80: 11.427 | B80: 1.873 | C80: =RC[-2]-R1C1 -> 8.5659999999999989 | D80: =RC[-2]-R1C2 -> 1.8559000000000001
A81: 11.534000000000001 | B81: 1.8974 | C81: =RC[-2]-R1C1 -> 8.673 | D81: =RC[-2]-R1C2 -> 1.8803000000000001
A82: 11.641999999999999 | B82: 1.8998999999999999 | C82: =RC[-2]-R1C1 -> 8.7809999999999988 | D82: =RC[-2]-R1C2 -> 1.8828
A83: 11.749000000000001 | B83: 1.9242999999999999 | C83: =RC[-2]-R1C1 -> 8.8879999999999999 | D83: =RC[-2]-R1C2 -> 1.9072
A84: 11.856999999999999 | B84: 1.9267000000000001 | C84: =RC[-2]-R1C1 -> 8.9959999999999987 | D84: =RC[-2]-R1C2 -> 1.9096000000000002
A85: 11.965999999999999 | B85: 1.9512 | C85: =RC[-2]-R1C1 -> 9.1049999999999986 | D85: =RC[-2]-R1C2 -> 1.9341000000000002
A86: 12.074 | B86: 1.9512 | C86: =RC[-2]-R1C1 -> 9.2129999999999992 | D86: =RC[-2]-R1C2 -> 1.9341000000000002
A87: 12.182 | B87: 1.9756 | C87: =RC[-2]-R1C1 -> 9.3209999999999997 | D87: =RC[-2]-R1C2 -> 1.9585000000000001
A88: 12.289 | B88: 1.9756 | C88: =RC[-2]-R1C1 -> 9.427999999999999 | D88: =RC[-2]-R1C2 -> 1.9585000000000001
A89: 12.397 | B89: 2 | C89: =RC[-2]-R1C1 -> 9.5359999999999996 | D89: =RC[-2]-R1C2 -> 1.9829000000000001
A90: 12.506 | B90: 2 | C90: =RC[-2]-R1C1 -> 9.6449999999999996 | D90: =RC[-2]-R1C2 -> 1.9829000000000001
A91: 12.614000000000001 | B91: 2.0244 | C91: =RC[-2]-R1C1 -> 9.7530000000000001 | D91: =RC[-2]-R1C2 -> 2.0072999999999999
A92: 12.722 | B92: 2.0244 | C92: =RC[-2]-R1C1 -> 9.8609999999999989 | D92: =RC[-2]-R1C2 -> 2.0072999999999999
A93: 12.829000000000001 | B93: 2.0464000000000002 | C93: =RC[-2]-R1C1 -> 9.968 | D93: =RC[-2]-R1C2 -> 2.0293000000000001
A94: 12.936999999999999 | B94: 2.0488 | C94: =RC[-2]-R1C1 -> 10.075999999999999 | D94: =RC[-2]-R1C2 -> 2.0316999999999998
A95: 13.045999999999999 | B95: 2.0684 | C95: =RC[-2]-R1C1 -> 10.184999999999999 | D95: =RC[-2]-R1C2 -> 2.0512999999999999
A96: 13.154 | B96: 2.0684 | C96: =RC[-2]-R1C1 -> 10.292999999999999 | D96: =RC[-2]-R1C2 -> 2.0512999999999999
A97: 13.262 | B97: 2.0928 | C97: =RC[-2]-R1C1 -> 10.401 | D97: =RC[-2]-R1C2 -> 2.0756999999999999
A98: 13.369 | B98: 2.0928 | C98: =RC[-2]-R1C1 -> 10.507999999999999 | D98: =RC[-2]-R1C2 -> 2.0756999999999999
A99: 13.477 | B99: 2.1147999999999998 | C99: =RC[-2]-R1C1 -> 10.616 | D99: =RC[-2]-R1C2 -> 2.0976999999999997
A100: 13.586 | B100: 2.1122999999999998 | C100: =RC[-2]-R1C1 -> 10.725 | D100: =RC[-2]-R1C2 -> 2.0951999999999997
A101: 13.694000000000001 | B101: 2.1343000000000001 | C101: =RC[-2]-R1C1 -> 10.833 | D101: =RC[-2]-R1C2 -> 2.1172
A102: 13.802 | B102: 2.1343000000000001 | C102: =RC[-2]-R1C1 -> 10.940999999999999 | D102: =RC[-2]-R1C2 -> 2.1172
A103: 13.909000000000001 | B103: 2.1562999999999999 | C103: =RC[-2]-R1C1 -> 11.048 | D103: =RC[-2]-R1C2 -> 2.1391999999999998
A104: 14.016999999999999 | B104: 2.1537999999999999 | C104: =RC[-2]-R1C1 -> 11.155999999999999 | D104: =RC[-2]-R1C2 -> 2.1366999999999998
A105: 14.124000000000001 | B105: 2.1758000000000002 | C105: =RC[-2]-R1C1 -> 11.263 | D105: =RC[-2]-R1C2 -> 2.1587000000000001
A106: 14.231999999999999 | B106: 2.1734 | C106: =RC[-2]-R1C1 -> 11.370999999999999 | D106: =RC[-2]-R1C2 -> 2.1562999999999999
A107: 14.340999999999999 | B107: 2.1928999999999998 | C107: =RC[-2]-R1C1 -> 11.479999999999999 | D107: =RC[-2]-R1C2 -> 2.1757999999999997
A108: 14.449 | B108: 2.1928999999999998 | C108: =RC[-2]-R1C1 -> 11.587999999999999 | D108: =RC[-2]-R1C2 -> 2.1757999999999997
A109: 14.557 | B109: 2.2124999999999999 | C109: =RC[-2]-R1C1 -> 11.696 | D109: =RC[-2]-R1C2 -> 2.1953999999999998
A110: 14.664 | B110: 2.2124999999999999 | C110: =RC[-2]-R1C1 -> 11.802999999999999 | D110: =RC[-2]-R1C2 -> 2.1953999999999998
A111: 14.772 | B111: 2.2294999999999998 | C111: =RC[-2]-R1C1 -> 11.911 | D111: =RC[-2]-R1C2 -> 2.2123999999999997
A112: 14.881 | B112: 2.2294999999999998 | C112: =RC[-2]-R1C1 -> 12.02 | D112: =RC[-2]-R1C2 -> 2.2123999999999997
A113: 14.989000000000001 | B113: 2.2490999999999999 | C113: =RC[-2]-R1C1 -> 12.128 | D113: =RC[-2]-R1C2 -> 2.2319999999999998
A114: 15.097 | B114: 2.2490999999999999 | C114: =RC[-2]-R1C1 -> 12.235999999999999 | D114: =RC[-2]-R1C2 -> 2.2319999999999998
A115: 15.204000000000001 | B115: 2.2662 | C115: =RC[-2]-R1C1 -> 12.343 | D115: =RC[-2]-R1C2 -> 2.2490999999999999
A116: 15.311999999999999 | B116: 2.2662 | C116: =RC[-2]-R1C1 -> 12.450999999999999 | D116: =RC[-2]-R1C2 -> 2.2490999999999999
A117: 15.420999999999999 | B117: 2.2833000000000001 | C117: =RC[-2]-R1C1 -> 12.559999999999999 | D117: =RC[-2]-R1C2 -> 2.2662
A118: 15.529 | B118: 2.2833000000000001 | C118: =RC[-2]-R1C1 -> 12.667999999999999 | D118: =RC[-2]-R1C2 -> 2.2662
A119: 15.637 | B119: 2.3003999999999998 | C119: =RC[-2]-R1C1 -> 12.776 | D119: =RC[-2]-R1C2 -> 2.2832999999999997
A120: 15.744 | B120: 2.3003999999999998 | C120: =RC[-2]-R1C1 -> 12.882999999999999 | D120: =RC[-2]-R1C2 -> 2.2832999999999997
A121: 15.852 | B121: 2.3149999999999999 | C121: =RC[-2]-R1C1 -> 12.991 | D121: =RC[-2]-R1C2 -> 2.2978999999999998
A122: 15.961 | B122: 2.3174999999999999 | C122: =RC[-2]-R1C1 -> 13.1 | D122: =RC[-2]-R1C2 -> 2.3003999999999998
A123: 16.068999999999999 | B123: 2.3321000000000001 | C123: =RC[-2]-R1C1 -> 13.207999999999998 | D123: =RC[-2]-R1C2 -> 2.3149999999999999
A124: 16.177 | B124: 2.3321000000000001 | C124: =RC[-2]-R1C1 -> 13.315999999999999 | D124: =RC[-2]-R1C2 -> 2.3149999999999999
A125: 16.283999999999999 | B125: 2.3492000000000002 | C125: =RC[-2]-R1C1 -> 13.422999999999998 | D125: =RC[-2]-R1C2 -> 2.3321000000000001
A126: 16.391999999999999 | B126: 2.3468 | C126: =RC[-2]-R1C1 -> 13.530999999999999 | D126: =RC[-2]-R1C2 -> 2.3296999999999999
A127: 16.498999999999999 | B127: 2.3639000000000001 | C127: =RC[-2]-R1C1 -> 13.637999999999998 | D127: =RC[-2]-R1C2 -> 2.3468
A128: 16.606999999999999 | B128: 2.3614000000000002 | C128: =RC[-2]-R1C1 -> 13.745999999999999 | D128: =RC[-2]-R1C2 -> 2.3443000000000001
A129: 16.716000000000001 | B129: 2.3784999999999998 | C129: =RC[-2]-R1C1 -> 13.855 | D129: =RC[-2]-R1C2 -> 2.3613999999999997
A130: 16.824000000000002 | B130: 2.3784999999999998 | C130: =RC[-2]-R1C1 -> 13.963000000000001 | D130: =RC[-2]-R1C2 -> 2.3613999999999997
A131: 16.931999999999999 | B131: 2.3932000000000002 | C131: =RC[-2]-R1C1 -> 14.070999999999998 | D131: =RC[-2]-R1C2 -> 2.3761000000000001
A132: 17.039000000000001 | B132: 2.3932000000000002 | C132: =RC[-2]-R1C1 -> 14.178000000000001 | D132: =RC[-2]-R1C2 -> 2.3761000000000001
A133: 17.146999999999998 | B133: 2.4054000000000002 | C133: =RC[-2]-R1C1 -> 14.285999999999998 | D133: =RC[-2]-R1C2 -> 2.3883000000000001
A134: 17.256 | B134: 2.4077999999999999 | C134: =RC[-2]-R1C1 -> 14.395 | D134: =RC[-2]-R1C2 -> 2.3906999999999998
A135: 17.364000000000001 | B135: 2.42 | C135: =RC[-2]-R1C1 -> 14.503 | D135: =RC[-2]-R1C2 -> 2.4028999999999998
A136: 17.472000000000001 | B136: 2.42 | C136: =RC[-2]-R1C1 -> 14.611000000000001 | D136: =RC[-2]-R1C2 -> 2.4028999999999998
A137: 17.579000000000001 | B137: 2.4346999999999999 | C137: =RC[-2]-R1C1 -> 14.718 | D137: =RC[-2]-R1C2 -> 2.4175999999999997
A138: 17.687000000000001 | B138: 2.4346999999999999 | C138: =RC[-2]-R1C1 -> 14.826000000000001 | D138: =RC[-2]-R1C2 -> 2.4175999999999997
A139: 17.795999999999999 | B139: 2.4493 | C139: =RC[-2]-R1C1 -> 14.934999999999999 | D139: =RC[-2]-R1C2 -> 2.4321999999999999
A140: 17.904 | B140: 2.4493 | C140: =RC[-2]-R1C1 -> 15.042999999999999 | D140: =RC[-2]-R1C2 -> 2.4321999999999999
A141: 18.012 | B141: 2.4590999999999998 | C141: =RC[-2]-R1C1 -> 15.151 | D141: =RC[-2]-R1C2 -> 2.4419999999999997
A142: 18.119 | B142: 2.4590999999999998 | C142: =RC[-2]-R1C1 -> 15.257999999999999 | D142: =RC[-2]-R1C2 -> 2.4419999999999997
A143: 18.227 | B143: 2.4712999999999998 | C143: =RC[-2]-R1C1 -> 15.366 | D143: =RC[-2]-R1C2 -> 2.4541999999999997
A144: 18.335999999999999 | B144: 2.4712999999999998 | C144: =RC[-2]-R1C1 -> 15.474999999999998 | D144: =RC[-2]-R1C2 -> 2.4541999999999997
A145: 18.443999999999999 | B145: 2.4834999999999998 | C145: =RC[-2]-R1C1 -> 15.582999999999998 | D145: =RC[-2]-R1C2 -> 2.4663999999999997
A146: 18.552 | B146: 2.4834999999999998 | C146: =RC[-2]-R1C1 -> 15.690999999999999 | D146: =RC[-2]-R1C2 -> 2.4663999999999997
A147: 18.658999999999999 | B147: 2.4982000000000002 | C147: =RC[-2]-R1C1 -> 15.797999999999998 | D147: =RC[-2]-R1C2 -> 2.4811000000000001
A148: 18.766999999999999 | B148: 2.4956999999999998 | C148: =RC[-2]-R1C1 -> 15.905999999999999 | D148: =RC[-2]-R1C2 -> 2.4785999999999997
A149: 18.873999999999999 | B149: 2.5078999999999998 | C149: =RC[-2]-R1C1 -> 16.012999999999998 | D149: =RC[-2]-R1C2 -> 2.4907999999999997
A150: 18.981999999999999 | B150: 2.5078999999999998 | C150: =RC[-2]-R1C1 -> 16.120999999999999 | D150: =RC[-2]-R1C2 -> 2.4907999999999997
A151: 19.091000000000001 | B151: 2.5177 | C151: =RC[-2]-R1C1 -> 16.23 | D151: =RC[-2]-R1C2 -> 2.5005999999999999
A152: 19.199000000000002 | B152: 2.5177 | C152: =RC[-2]-R1C1 -> 16.338000000000001 | D152: =RC[-2]-R1C2 -> 2.5005999999999999
A153: 19.306999999999999 | B153: 2.5299 | C153: =RC[-2]-R1C1 -> 16.445999999999998 | D153: =RC[-2]-R1C2 -> 2.5127999999999999
A154: 19.414000000000001 | B154: 2.5274999999999999 | C154: =RC[-2]-R1C1 -> 16.553000000000001 | D154: =RC[-2]-R1C2 -> 2.5103999999999997
A155: 19.521999999999998 | B155: 2.5421 | C155: =RC[-2]-R1C1 -> 16.660999999999998 | D155: =RC[-2]-R1C2 -> 2.5249999999999999
A156: 19.631 | B156: 2.5421 | C156: =RC[-2]-R1C1 -> 16.77 | D156: =RC[-2]-R1C2 -> 2.5249999999999999
A157: 19.739000000000001 | B157: 2.5518999999999998 | C157: =RC[-2]-R1C1 -> 16.878 | D157: =RC[-2]-R1C2 -> 2.5347999999999997
A158: 19.847000000000001 | B158: 2.5518999999999998 | C158: =RC[-2]-R1C1 -> 16.986000000000001 | D158: =RC[-2]-R1C2 -> 2.5347999999999997
A159: 19.954000000000001 | B159: 2.5617000000000001 | C159: =RC[-2]-R1C1 -> 17.093 | D159: =RC[-2]-R1C2 -> 2.5446
A160: 20.062000000000001 | B160: 2.5617000000000001 | C160: =RC[-2]-R1C1 -> 17.201000000000001 | D160: =RC[-2]-R1C2 -> 2.5446
A161: 20.170999999999999 | B161: 2.5714000000000001 | C161: =RC[-2]-R1C1 -> 17.31 | D161: =RC[-2]-R1C2 -> 2.5543
A162: 20.279 | B162: 2.5739000000000001 | C162: =RC[-2]-R1C1 -> 17.417999999999999 | D162: =RC[-2]-R1C2 -> 2.5568
A163: 20.387 | B163: 2.5811999999999999 | C163: =RC[-2]-R1C1 -> 17.526 | D163: =RC[-2]-R1C2 -> 2.5640999999999998
A164: 20.494 | B164: 2.5811999999999999 | C164: =RC[-2]-R1C1 -> 17.632999999999999 | D164: =RC[-2]-R1C2 -> 2.5640999999999998
A165: 20.602 | B165: 2.5910000000000002 | C165: =RC[-2]-R1C1 -> 17.741 | D165: =RC[-2]-R1C2 -> 2.5739000000000001
A166: 20.710999999999999 | B166: 2.5910000000000002 | C166: =RC[-2]-R1C1 -> 17.849999999999998 | D166: =RC[-2]-R1C2 -> 2.5739000000000001
A167: 20.818999999999999 | B167: 2.6006999999999998 | C167: =RC[-2]-R1C1 -> 17.957999999999998 | D167: =RC[-2]-R1C2 -> 2.5835999999999997
A168: 20.927 | B168: 2.6006999999999998 | C168: =RC[-2]-R1C1 -> 18.065999999999999 | D168: =RC[-2]-R1C2 -> 2.5835999999999997
A169: 21.033999999999999 | B169: 2.6080999999999999 | C169: =RC[-2]-R1C1 -> 18.172999999999998 | D169: =RC[-2]-R1C2 -> 2.5909999999999997
A170: 21.141999999999999 | B170: 2.6105 | C170: =RC[-2]-R1C1 -> 18.280999999999999 | D170: =RC[-2]-R1C2 -> 2.5933999999999999
A171: 21.248999999999999 | B171: 2.6177999999999999 | C171: =RC[-2]-R1C1 -> 18.387999999999998 | D171: =RC[-2]-R1C2 -> 2.6006999999999998
A172: 21.356999999999999 | B172: 2.6177999999999999 | C172: =RC[-2]-R1C1 -> 18.495999999999999 | D172: =RC[-2]-R1C2 -> 2.6006999999999998
A173: 21.466000000000001 | B173: 2.6252 | C173: =RC[-2]-R1C1 -> 18.605 | D173: =RC[-2]-R1C2 -> 2.6080999999999999
A174: 21.574000000000002 | B174: 2.6252 | C174: =RC[-2]-R1C1 -> 18.713000000000001 | D174: =RC[-2]-R1C2 -> 2.6080999999999999
A175: 21.681999999999999 | B175: 2.6349 | C175: =RC[-2]-R1C1 -> 18.820999999999998 | D175: =RC[-2]-R1C2 -> 2.6177999999999999
A176: 21.789000000000001 | B176: 2.6349 | C176: =RC[-2]-R1C1 -> 18.928000000000001 | D176: =RC[-2]-R1C2 -> 2.6177999999999999
A177: 21.896999999999998 | B177: 2.6421999999999999 | C177: =RC[-2]-R1C1 -> 19.035999999999998 | D177: =RC[-2]-R1C2 -> 2.6250999999999998
A178: 22.006 | B178: 2.6446999999999998 | C178: =RC[-2]-R1C1 -> 19.145 | D178: =RC[-2]-R1C2 -> 2.6275999999999997
A179: 22.114000000000001 | B179: 2.6496 | C179: =RC[-2]-R1C1 -> 19.253 | D179: =RC[-2]-R1C2 -> 2.6324999999999998
A180: 22.222000000000001 | B180: 2.6496 | C180: =RC[-2]-R1C1 -> 19.361000000000001 | D180: =RC[-2]-R1C2 -> 2.6324999999999998
A181: 22.329000000000001 | B181: 2.6593 | C181: =RC[-2]-R1C1 -> 19.468 | D181: =RC[-2]-R1C2 -> 2.6421999999999999
A182: 22.437000000000001 | B182: 2.6568999999999998 | C182: =RC[-2]-R1C1 -> 19.576000000000001 | D182: =RC[-2]-R1C2 -> 2.6397999999999997
A183: 22.545999999999999 | B183: 2.6667000000000001 | C183: =RC[-2]-R1C1 -> 19.684999999999999 | D183: =RC[-2]-R1C2 -> 2.6496
A184: 22.654 | B184: 2.6667000000000001 | C184: =RC[-2]-R1C1 -> 19.792999999999999 | D184: =RC[-2]-R1C2 -> 2.6496
A185: 22.762 | B185: 2.6739999999999999 | C185: =RC[-2]-R1C1 -> 19.901 | D185: =RC[-2]-R1C2 -> 2.6568999999999998
A186: 22.869 | B186: 2.6739999999999999 | C186: =RC[-2]-R1C1 -> 20.007999999999999 | D186: =RC[-2]-R1C2 -> 2.6568999999999998
A187: 22.977 | B187: 2.6812999999999998 | C187: =RC[-2]-R1C1 -> 20.116 | D187: =RC[-2]-R1C2 -> 2.6641999999999997
A188: 23.085999999999999 | B188: 2.6812999999999998 | C188: =RC[-2]-R1C1 -> 20.224999999999998 | D188: =RC[-2]-R1C2 -> 2.6641999999999997
A189: 23.193999999999999 | B189: 2.6886000000000001 | C189: =RC[-2]-R1C1 -> 20.332999999999998 | D189: =RC[-2]-R1C2 -> 2.6715
A190: 23.302 | B190: 2.6886000000000001 | C190: =RC[-2]-R1C1 -> 20.440999999999999 | D190: =RC[-2]-R1C2 -> 2.6715
A191: 23.408999999999999 | B191: 2.6934999999999998 | C191: =RC[-2]-R1C1 -> 20.547999999999998 | D191: =RC[-2]-R1C2 -> 2.6763999999999997
A192: 23.516999999999999 | B192: 2.6934999999999998 | C192: =RC[-2]-R1C1 -> 20.655999999999999 | D192: =RC[-2]-R1C2 -> 2.6763999999999997
A193: 23.623999999999999 | B193: 2.7008999999999999 | C193: =RC[-2]-R1C1 -> 20.762999999999998 | D193: =RC[-2]-R1C2 -> 2.6837999999999997
A194: 23.731999999999999 | B194: 2.7008999999999999 | C194: =RC[-2]-R1C1 -> 20.870999999999999 | D194: =RC[-2]-R1C2 -> 2.6837999999999997
A195: 23.841000000000001 | B195: 2.7082000000000002 | C195: =RC[-2]-R1C1 -> 20.98 | D195: =RC[-2]-R1C2 -> 2.6911
A196: 23.949000000000002 | B196: 2.7082000000000002 | C196: =RC[-2]-R1C1 -> 21.088000000000001 | D196: =RC[-2]-R1C2 -> 2.6911
A197: 24.056999999999999 | B197: 2.7155 | C197: =RC[-2]-R1C1 -> 21.195999999999998 | D197: =RC[-2]-R1C2 -> 2.6983999999999999
A198: 24.164000000000001 | B198: 2.7155 | C198: =RC[-2]-R1C1 -> 21.303000000000001 | D198: =RC[-2]-R1C2 -> 2.6983999999999999
A199: 24.271999999999998 | B199: 2.7204000000000002 | C199: =RC[-2]-R1C1 -> 21.410999999999998 | D199: =RC[-2]-R1C2 -> 2.7033
A200: 24.381 | B200: 2.7204000000000002 | C200: =RC[-2]-R1C1 -> 21.52 | D200: =RC[-2]-R1C2 -> 2.7033
A201: 24.489000000000001 | B201: 2.7277 | C201: =RC[-2]-R1C1 -> 21.628 | D201: =RC[-2]-R1C2 -> 2.7105999999999999
A202: 24.597000000000001 | B202: 2.7277 | C202: =RC[-2]-R1C1 -> 21.736000000000001 | D202: =RC[-2]-R1C2 -> 2.7105999999999999
A203: 24.704000000000001 | B203: 2.7326000000000001 | C203: =RC[-2]-R1C1 -> 21.843 | D203: =RC[-2]-R1C2 -> 2.7155
A204: 24.812000000000001 | B204: 2.7326000000000001 | C204: =RC[-2]-R1C1 -> 21.951000000000001 | D204: =RC[-2]-R1C2 -> 2.7155
A205: 24.920999999999999 | B205: 2.7374999999999998 | C205: =RC[-2]-R1C1 -> 22.06 | D205: =RC[-2]-R1C2 -> 2.7203999999999997
A206: 25.029 | B206: 2.7374999999999998 | C206: =RC[-2]-R1C1 -> 22.167999999999999 | D206: =RC[-2]-R1C2 -> 2.7203999999999997
A207: 25.137 | B207: 2.7448000000000001 | C207: =RC[-2]-R1C1 -> 22.276 | D207: =RC[-2]-R1C2 -> 2.7277
A208: 25.244 | B208: 2.7448000000000001 | C208: =RC[-2]-R1C1 -> 22.382999999999999 | D208: =RC[-2]-R1C2 -> 2.7277
A209: 25.352 | B209: 2.7496999999999998 | C209: =RC[-2]-R1C1 -> 22.491 | D209: =RC[-2]-R1C2 -> 2.7325999999999997
A210: 25.460999999999999 | B210: 2.7496999999999998 | C210: =RC[-2]-R1C1 -> 22.599999999999998 | D210: =RC[-2]-R1C2 -> 2.7325999999999997
A211: 25.568999999999999 | B211: 2.7545999999999999 | C211: =RC[-2]-R1C1 -> 22.707999999999998 | D211: =RC[-2]-R1C2 -> 2.7374999999999998
A212: 25.677 | B212: 2.7545999999999999 | C212: =RC[-2]-R1C1 -> 22.815999999999999 | D212: =RC[-2]-R1C2 -> 2.7374999999999998
A213: 25.783999999999999 | B213: 2.7595000000000001 | C213: =RC[-2]-R1C1 -> 22.922999999999998 | D213: =RC[-2]-R1C2 -> 2.7423999999999999
A214: 25.891999999999999 | B214: 2.7595000000000001 | C214: =RC[-2]-R1C1 -> 23.030999999999999 | D214: =RC[-2]-R1C2 -> 2.7423999999999999
A215: 25.998999999999999 | B215: 2.7667999999999999 | C215: =RC[-2]-R1C1 -> 23.137999999999998 | D215: =RC[-2]-R1C2 -> 2.7496999999999998
A216: 26.106999999999999 | B216: 2.7667999999999999 | C216: =RC[-2]-R1C1 -> 23.245999999999999 | D216: =RC[-2]-R1C2 -> 2.7496999999999998
A217: 26.216000000000001 | B217: 2.7717000000000001 | C217: =RC[-2]-R1C1 -> 23.355 | D217: =RC[-2]-R1C2 -> 2.7545999999999999
A218: 26.324000000000002 | B218: 2.7717000000000001 | C218: =RC[-2]-R1C1 -> 23.463000000000001 | D218: =RC[-2]-R1C2 -> 2.7545999999999999
A219: 26.431999999999999 | B219: 2.7766000000000002 | C219: =RC[-2]-R1C1 -> 23.570999999999998 | D219: =RC[-2]-R1C2 -> 2.7595000000000001
A220: 26.539000000000001 | B220: 2.7766000000000002 | C220: =RC[-2]-R1C1 -> 23.678000000000001 | D220: =RC[-2]-R1C2 -> 2.7595000000000001
A221: 26.646999999999998 | B221: 2.7789999999999999 | C221: =RC[-2]-R1C1 -> 23.785999999999998 | D221: =RC[-2]-R1C2 -> 2.7618999999999998
A222: 26.756 | B222: 2.7814000000000001 | C222: =RC[-2]-R1C1 -> 23.895 | D222: =RC[-2]-R1C2 -> 2.7643
A223: 26.864000000000001 | B223: 2.7863000000000002 | C223: =RC[-2]-R1C1 -> 24.003 | D223: =RC[-2]-R1C2 -> 2.7692000000000001
A224: 26.972000000000001 | B224: 2.7839 | C224: =RC[-2]-R1C1 -> 24.111000000000001 | D224: =RC[-2]-R1C2 -> 2.7667999999999999
A225: 27.079000000000001 | B225: 2.7888000000000002 | C225: =RC[-2]-R1C1 -> 24.218 | D225: =RC[-2]-R1C2 -> 2.7717000000000001
A226: 27.187000000000001 | B226: 2.7911999999999999 | C226: =RC[-2]-R1C1 -> 24.326000000000001 | D226: =RC[-2]-R1C2 -> 2.7740999999999998
A227: 27.295999999999999 | B227: 2.7936999999999999 | C227: =RC[-2]-R1C1 -> 24.434999999999999 | D227: =RC[-2]-R1C2 -> 2.7765999999999997
A228: 27.404 | B228: 2.7961 | C228: =RC[-2]-R1C1 -> 24.542999999999999 | D228: =RC[-2]-R1C2 -> 2.7789999999999999
A229: 27.512 | B229: 2.7985000000000002 | C229: =RC[-2]-R1C1 -> 24.651 | D229: =RC[-2]-R1C2 -> 2.7814000000000001
A230: 27.619 | B230: 2.7985000000000002 | C230: =RC[-2]-R1C1 -> 24.757999999999999 | D230: =RC[-2]-R1C2 -> 2.7814000000000001
A231: 27.727 | B231: 2.8033999999999999 | C231: =RC[-2]-R1C1 -> 24.866 | D231: =RC[-2]-R1C2 -> 2.7862999999999998
A232: 27.835999999999999 | B232: 2.8033999999999999 | C232: =RC[-2]-R1C1 -> 24.974999999999998 | D232: =RC[-2]-R1C2 -> 2.7862999999999998
A233: 27.943999999999999 | B233: 2.8058999999999998 | C233: =RC[-2]-R1C1 -> 25.082999999999998 | D233: =RC[-2]-R1C2 -> 2.7887999999999997
A234: 28.052 | B234: 2.8083 | C234: =RC[-2]-R1C1 -> 25.190999999999999 | D234: =RC[-2]-R1C2 -> 2.7911999999999999
A235: 28.158999999999999 | B235: 2.8107000000000002 | C235: =RC[-2]-R1C1 -> 25.297999999999998 | D235: =RC[-2]-R1C2 -> 2.7936000000000001
A236: 28.266999999999999 | B236: 2.8107000000000002 | C236: =RC[-2]-R1C1 -> 25.405999999999999 | D236: =RC[-2]-R1C2 -> 2.7936000000000001
A237: 28.373999999999999 | B237: 2.8155999999999999 | C237: =RC[-2]-R1C1 -> 25.512999999999998 | D237: =RC[-2]-R1C2 -> 2.7984999999999998
A238: 28.481999999999999 | B238: 2.8155999999999999 | C238: =RC[-2]-R1C1 -> 25.620999999999999 | D238: =RC[-2]-R1C2 -> 2.7984999999999998
A239: 28.591000000000001 | B239: 2.8180999999999998 | C239: =RC[-2]-R1C1 -> 25.73 | D239: =RC[-2]-R1C2 -> 2.8009999999999997
A240: 28.699000000000002 | B240: 2.8205 | C240: =RC[-2]-R1C1 -> 25.838000000000001 | D240: =RC[-2]-R1C2 -> 2.8033999999999999
A241: 28.806999999999999 | B241: 2.8205 | C241: =RC[-2]-R1C1 -> 25.945999999999998 | D241: =RC[-2]-R1C2 -> 2.8033999999999999
A242: 28.914000000000001 | B242: 2.8205 | C242: =RC[-2]-R1C1 -> 26.053000000000001 | D242: =RC[-2]-R1C2 -> 2.8033999999999999
A243: 29.021999999999998 | B243: 2.8254000000000001 | C243: =RC[-2]-R1C1 -> 26.160999999999998 | D243: =RC[-2]-R1C2 -> 2.8083
A244: 29.131 | B244: 2.8277999999999999 | C244: =RC[-2]-R1C1 -> 26.27 | D244: =RC[-2]-R1C2 -> 2.8106999999999998
A245: 29.239000000000001 | B245: 2.8302999999999998 | C245: =RC[-2]-R1C1 -> 26.378 | D245: =RC[-2]-R1C2 -> 2.8131999999999997
A246: 29.347000000000001 | B246: 2.8302999999999998 | C246: =RC[-2]-R1C1 -> 26.486000000000001 | D246: =RC[-2]-R1C2 -> 2.8131999999999997
A247: 29.454000000000001 | B247: 2.8327 | C247: =RC[-2]-R1C1 -> 26.593 | D247: =RC[-2]-R1C2 -> 2.8155999999999999
A248: 29.562000000000001 | B248: 2.8327 | C248: =RC[-2]-R1C1 -> 26.701000000000001 | D248: =RC[-2]-R1C2 -> 2.8155999999999999
A249: 29.670999999999999 | B249: 2.8376000000000001 | C249: =RC[-2]-R1C1 -> 26.81 | D249: =RC[-2]-R1C2 -> 2.8205
A250: 29.779 | B250: 2.8376000000000001 | C250: =RC[-2]-R1C1 -> 26.917999999999999 | D250: =RC[-2]-R1C2 -> 2.8205
A251: 29.887 | B251: 2.84 | C251: =RC[-2]-R1C1 -> 27.026 | D251: =RC[-2]-R1C2 -> 2.8228999999999997
A252: 29.994 | B252: 2.84 | C252: =RC[-2]-R1C1 -> 27.132999999999999 | D252: =RC[-2]-R1C2 -> 2.8228999999999997
A253: 30.102 | B253: 2.8424999999999998 | C253: =RC[-2]-R1C1 -> 27.241 | D253: =RC[-2]-R1C2 -> 2.8253999999999997
A254: 30.210999999999999 | B254: 2.8449 | C254: =RC[-2]-R1C1 -> 27.349999999999998 | D254: =RC[-2]-R1C2 -> 2.8277999999999999
A255: 30.318999999999999 | B255: 2.8449 | C255: =RC[-2]-R1C1 -> 27.457999999999998 | D255: =RC[-2]-R1C2 -> 2.8277999999999999
A256: 30.427 | B256: 2.8449 | C256: =RC[-2]-R1C1 -> 27.565999999999999 | D256: =RC[-2]-R1C2 -> 2.8277999999999999
A257: 30.533999999999999 | B257: 2.8498000000000001 | C257: =RC[-2]-R1C1 -> 27.672999999999998 | D257: =RC[-2]-R1C2 -> 2.8327
A258: 30.641999999999999 | B258: 2.8498000000000001 | C258: =RC[-2]-R1C1 -> 27.780999999999999 | D258: =RC[-2]-R1C2 -> 2.8327
A259: 30.748999999999999 | B259: 2.8546999999999998 | C259: =RC[-2]-R1C1 -> 27.887999999999998 | D259: =RC[-2]-R1C2 -> 2.8375999999999997
A260: 30.856999999999999 | B260: 2.8498000000000001 | C260: =RC[-2]-R1C1 -> 27.995999999999999 | D260: =RC[-2]-R1C2 -> 2.8327
A261: 30.966000000000001 | B261: 2.8546999999999998 | C261: =RC[-2]-R1C1 -> 28.105 | D261: =RC[-2]-R1C2 -> 2.8375999999999997
A262: 31.074000000000002 | B262: 2.8546999999999998 | C262: =RC[-2]-R1C1 -> 28.213000000000001 | D262: =RC[-2]-R1C2 -> 2.8375999999999997
A263: 31.181999999999999 | B263: 2.8595999999999999 | C263: =RC[-2]-R1C1 -> 28.320999999999998 | D263: =RC[-2]-R1C2 -> 2.8424999999999998
A264: 31.289000000000001 | B264: 2.8595999999999999 | C264: =RC[-2]-R1C1 -> 28.428000000000001 | D264: =RC[-2]-R1C2 -> 2.8424999999999998
A265: 31.396999999999998 | B265: 2.8645 | C265: =RC[-2]-R1C1 -> 28.535999999999998 | D265: =RC[-2]-R1C2 -> 2.8473999999999999
A266: 31.506 | B266: 2.8595999999999999 | C266: =RC[-2]-R1C1 -> 28.645 | D266: =RC[-2]-R1C2 -> 2.8424999999999998
A267: 31.614000000000001 | B267: 2.8645 | C267: =RC[-2]-R1C1 -> 28.753 | D267: =RC[-2]-R1C2 -> 2.8473999999999999
A268: 31.722000000000001 | B268: 2.8645 | C268: =RC[-2]-R1C1 -> 28.861000000000001 | D268: =RC[-2]-R1C2 -> 2.8473999999999999
A269: 31.829000000000001 | B269: 2.8668999999999998 | C269: =RC[-2]-R1C1 -> 28.968 | D269: =RC[-2]-R1C2 -> 2.8497999999999997
A270: 31.937000000000001 | B270: 2.8668999999999998 | C270: =RC[-2]-R1C1 -> 29.076000000000001 | D270: =RC[-2]-R1C2 -> 2.8497999999999997
A271: 32.045999999999999 | B271: 2.8694000000000002 | C271: =RC[-2]-R1C1 -> 29.184999999999999 | D271: =RC[-2]-R1C2 -> 2.8523000000000001
A272: 32.154000000000003 | B272: 2.8694000000000002 | C272: =RC[-2]-R1C1 -> 29.293000000000003 | D272: =RC[-2]-R1C2 -> 2.8523000000000001
A273: 32.262 | B273: 2.8717999999999999 | C273: =RC[-2]-R1C1 -> 29.401 | D273: =RC[-2]-R1C2 -> 2.8546999999999998
A274: 32.369 | B274: 2.8717999999999999 | C274: =RC[-2]-R1C1 -> 29.507999999999999 | D274: =RC[-2]-R1C2 -> 2.8546999999999998
A275: 32.476999999999997 | B275: 2.8742000000000001 | C275: =RC[-2]-R1C1 -> 29.615999999999996 | D275: =RC[-2]-R1C2 -> 2.8571
A276: 32.585999999999999 | B276: 2.8742000000000001 | C276: =RC[-2]-R1C1 -> 29.724999999999998 | D276: =RC[-2]-R1C2 -> 2.8571
A277: 32.694000000000003 | B277: 2.8791000000000002 | C277: =RC[-2]-R1C1 -> 29.833000000000002 | D277: =RC[-2]-R1C2 -> 2.8620000000000001
A278: 32.802 | B278: 2.8767 | C278: =RC[-2]-R1C1 -> 29.940999999999999 | D278: =RC[-2]-R1C2 -> 2.8595999999999999
A279: 32.908999999999999 | B279: 2.8791000000000002 | C279: =RC[-2]-R1C1 -> 30.047999999999998 | D279: =RC[-2]-R1C2 -> 2.8620000000000001
A280: 33.017000000000003 | B280: 2.8791000000000002 | C280: =RC[-2]-R1C1 -> 30.156000000000002 | D280: =RC[-2]-R1C2 -> 2.8620000000000001
A281: 33.124000000000002 | B281: 2.8816000000000002 | C281: =RC[-2]-R1C1 -> 30.263000000000002 | D281: =RC[-2]-R1C2 -> 2.8645
A282: 33.231999999999999 | B282: 2.8816000000000002 | C282: =RC[-2]-R1C1 -> 30.370999999999999 | D282: =RC[-2]-R1C2 -> 2.8645
A283: 33.341000000000001 | B283: 2.8839999999999999 | C283: =RC[-2]-R1C1 -> 30.48 | D283: =RC[-2]-R1C2 -> 2.8668999999999998
A284: 33.448999999999998 | B284: 2.8839999999999999 | C284: =RC[-2]-R1C1 -> 30.587999999999997 | D284: =RC[-2]-R1C2 -> 2.8668999999999998
A285: 33.557000000000002 | B285: 2.8864000000000001 | C285: =RC[-2]-R1C1 -> 30.696000000000002 | D285: =RC[-2]-R1C2 -> 2.8693
A286: 33.664000000000001 | B286: 2.8864000000000001 | C286: =RC[-2]-R1C1 -> 30.803000000000001 | D286: =RC[-2]-R1C2 -> 2.8693
A287: 33.771999999999998 | B287: 2.8889 | C287: =RC[-2]-R1C1 -> 30.910999999999998 | D287: =RC[-2]-R1C2 -> 2.8717999999999999
A288: 33.881 | B288: 2.8889 | C288: =RC[-2]-R1C1 -> 31.02 | D288: =RC[-2]-R1C2 -> 2.8717999999999999
A289: 33.988999999999997 | B289: 2.8889 | C289: =RC[-2]-R1C1 -> 31.127999999999997 | D289: =RC[-2]-R1C2 -> 2.8717999999999999
A290: 34.097000000000001 | B290: 2.8889 | C290: =RC[-2]-R1C1 -> 31.236000000000001 | D290: =RC[-2]-R1C2 -> 2.8717999999999999
A291: 34.204000000000001 | B291: 2.8938000000000001 | C291: =RC[-2]-R1C1 -> 31.343 | D291: =RC[-2]-R1C2 -> 2.8767
A292: 34.311999999999998 | B292: 2.8913000000000002 | C292: =RC[-2]-R1C1 -> 31.450999999999997 | D292: =RC[-2]-R1C2 -> 2.8742000000000001
A293: 34.420999999999999 | B293: 2.8938000000000001 | C293: =RC[-2]-R1C1 -> 31.56 | D293: =RC[-2]-R1C2 -> 2.8767
A294: 34.529000000000003 | B294: 2.8961999999999999 | C294: =RC[-2]-R1C1 -> 31.668000000000003 | D294: =RC[-2]-R1C2 -> 2.8790999999999998
A295: 34.637 | B295: 2.8961999999999999 | C295: =RC[-2]-R1C1 -> 31.776 | D295: =RC[-2]-R1C2 -> 2.8790999999999998
A296: 34.744 | B296: 2.8961999999999999 | C296: =RC[-2]-R1C1 -> 31.882999999999999 | D296: =RC[-2]-R1C2 -> 2.8790999999999998
A297: 34.851999999999997 | B297: 2.8986999999999998 | C297: =RC[-2]-R1C1 -> 31.990999999999996 | D297: =RC[-2]-R1C2 -> 2.8815999999999997
A298: 34.960999999999999 | B298: 2.8986999999999998 | C298: =RC[-2]-R1C1 -> 32.1 | D298: =RC[-2]-R1C2 -> 2.8815999999999997
A299: 35.069000000000003 | B299: 2.9011 | C299: =RC[-2]-R1C1 -> 32.208000000000006 | D299: =RC[-2]-R1C2 -> 2.8839999999999999
A300: 35.177 | B300: 2.8986999999999998 | C300: =RC[-2]-R1C1 -> 32.316000000000003 | D300: =RC[-2]-R1C2 -> 2.8815999999999997
A301: 35.283999999999999 | B301: 2.9011 | C301: =RC[-2]-R1C1 -> 32.423000000000002 | D301: =RC[-2]-R1C2 -> 2.8839999999999999
A302: 35.392000000000003 | B302: 2.9035000000000002 | C302: =RC[-2]-R1C1 -> 32.531000000000006 | D302: =RC[-2]-R1C2 -> 2.8864000000000001
A303: 35.499000000000002 | B303: 2.9035000000000002 | C303: =RC[-2]-R1C1 -> 32.638000000000005 | D303: =RC[-2]-R1C2 -> 2.8864000000000001
A304: 35.606999999999999 | B304: 2.9035000000000002 | C304: =RC[-2]-R1C1 -> 32.746000000000002 | D304: =RC[-2]-R1C2 -> 2.8864000000000001
A305: 35.716000000000001 | B305: 2.9060000000000001 | C305: =RC[-2]-R1C1 -> 32.855000000000004 | D305: =RC[-2]-R1C2 -> 2.8889
A306: 35.823999999999998 | B306: 2.9060000000000001 | C306: =RC[-2]-R1C1 -> 32.963000000000001 | D306: =RC[-2]-R1C2 -> 2.8889
A307: 35.932000000000002 | B307: 2.9083999999999999 | C307: =RC[-2]-R1C1 -> 33.071000000000005 | D307: =RC[-2]-R1C2 -> 2.8912999999999998
A308: 36.039000000000001 | B308: 2.9083999999999999 | C308: =RC[-2]-R1C1 -> 33.178000000000004 | D308: =RC[-2]-R1C2 -> 2.8912999999999998
A309: 36.146999999999998 | B309: 2.9083999999999999 | C309: =RC[-2]-R1C1 -> 33.286000000000001 | D309: =RC[-2]-R1C2 -> 2.8912999999999998
A310: 36.256 | B310: 2.9083999999999999 | C310: =RC[-2]-R1C1 -> 33.395000000000003 | D310: =RC[-2]-R1C2 -> 2.8912999999999998
A311: 36.363999999999997 | B311: 2.9108999999999998 | C311: =RC[-2]-R1C1 -> 33.503 | D311: =RC[-2]-R1C2 -> 2.8937999999999997
A312: 36.472000000000001 | B312: 2.9108999999999998 | C312: =RC[-2]-R1C1 -> 33.611000000000004 | D312: =RC[-2]-R1C2 -> 2.8937999999999997
A313: 36.579000000000001 | B313: 2.9133 | C313: =RC[-2]-R1C1 -> 33.718000000000004 | D313: =RC[-2]-R1C2 -> 2.8961999999999999
A314: 36.686999999999998 | B314: 2.9133 | C314: =RC[-2]-R1C1 -> 33.826000000000001 | D314: =RC[-2]-R1C2 -> 2.8961999999999999
A315: 36.795999999999999 | B315: 2.9133 | C315: =RC[-2]-R1C1 -> 33.935000000000002 | D315: =RC[-2]-R1C2 -> 2.8961999999999999
A316: 36.904000000000003 | B316: 2.9133 | C316: =RC[-2]-R1C1 -> 34.043000000000006 | D316: =RC[-2]-R1C2 -> 2.8961999999999999
A317: 37.012 | B317: 2.9157999999999999 | C317: =RC[-2]-R1C1 -> 34.151000000000003 | D317: =RC[-2]-R1C2 -> 2.8986999999999998
A318: 37.119 | B318: 2.9157999999999999 | C318: =RC[-2]-R1C1 -> 34.258000000000003 | D318: =RC[-2]-R1C2 -> 2.8986999999999998
A319: 37.226999999999997 | B319: 2.9182000000000001 | C319: =RC[-2]-R1C1 -> 34.366 | D319: =RC[-2]-R1C2 -> 2.9011
A320: 37.335999999999999 | B320: 2.9182000000000001 | C320: =RC[-2]-R1C1 -> 34.475000000000001 | D320: =RC[-2]-R1C2 -> 2.9011
A321: 37.444000000000003 | B321: 2.9182000000000001 | C321: =RC[-2]-R1C1 -> 34.583000000000006 | D321: =RC[-2]-R1C2 -> 2.9011
A322: 37.552 | B322: 2.9205999999999999 | C322: =RC[-2]-R1C1 -> 34.691000000000003 | D322: =RC[-2]-R1C2 -> 2.9034999999999997
A323: 37.658999999999999 | B323: 2.9205999999999999 | C323: =RC[-2]-R1C1 -> 34.798000000000002 | D323: =RC[-2]-R1C2 -> 2.9034999999999997
A324: 37.767000000000003 | B324: 2.9182000000000001 | C324: =RC[-2]-R1C1 -> 34.906000000000006 | D324: =RC[-2]-R1C2 -> 2.9011
A325: 37.874000000000002 | B325: 2.9205999999999999 | C325: =RC[-2]-R1C1 -> 35.013000000000005 | D325: =RC[-2]-R1C2 -> 2.9034999999999997
A326: 37.981999999999999 | B326: 2.9205999999999999 | C326: =RC[-2]-R1C1 -> 35.121000000000002 | D326: =RC[-2]-R1C2 -> 2.9034999999999997
A327: 38.091000000000001 | B327: 2.9230999999999998 | C327: =RC[-2]-R1C1 -> 35.230000000000004 | D327: =RC[-2]-R1C2 -> 2.9059999999999997
A328: 38.198999999999998 | B328: 2.9230999999999998 | C328: =RC[-2]-R1C1 -> 35.338000000000001 | D328: =RC[-2]-R1C2 -> 2.9059999999999997
A329: 38.307000000000002 | B329: 2.9230999999999998 | C329: =RC[-2]-R1C1 -> 35.446000000000005 | D329: =RC[-2]-R1C2 -> 2.9059999999999997
A330: 38.414000000000001 | B330: 2.9255 | C330: =RC[-2]-R1C1 -> 35.553000000000004 | D330: =RC[-2]-R1C2 -> 2.9083999999999999
A331: 38.521999999999998 | B331: 2.9255 | C331: =RC[-2]-R1C1 -> 35.661000000000001 | D331: =RC[-2]-R1C2 -> 2.9083999999999999
A332: 38.631 | B332: 2.9255 | C332: =RC[-2]-R1C1 -> 35.77 | D332: =RC[-2]-R1C2 -> 2.9083999999999999
A333: 38.738999999999997 | B333: 2.9279999999999999 | C333: =RC[-2]-R1C1 -> 35.878 | D333: =RC[-2]-R1C2 -> 2.9108999999999998
A334: 38.847000000000001 | B334: 2.9279999999999999 | C334: =RC[-2]-R1C1 -> 35.986000000000004 | D334: =RC[-2]-R1C2 -> 2.9108999999999998
A335: 38.954000000000001 | B335: 2.9279999999999999 | C335: =RC[-2]-R1C1 -> 36.093000000000004 | D335: =RC[-2]-R1C2 -> 2.9108999999999998
A336: 39.061999999999998 | B336: 2.9279999999999999 | C336: =RC[-2]-R1C1 -> 36.201000000000001 | D336: =RC[-2]-R1C2 -> 2.9108999999999998
A337: 39.170999999999999 | B337: 2.9279999999999999 | C337: =RC[-2]-R1C1 -> 36.31 | D337: =RC[-2]-R1C2 -> 2.9108999999999998
A338: 39.279000000000003 | B338: 2.9279999999999999 | C338: =RC[-2]-R1C1 -> 36.418000000000006 | D338: =RC[-2]-R1C2 -> 2.9108999999999998
A339: 39.387 | B339: 2.9304000000000001 | C339: =RC[-2]-R1C1 -> 36.526000000000003 | D339: =RC[-2]-R1C2 -> 2.9133
A340: 39.494 | B340: 2.9304000000000001 | C340: =RC[-2]-R1C1 -> 36.633000000000003 | D340: =RC[-2]-R1C2 -> 2.9133
A341: 39.601999999999997 | B341: 2.9304000000000001 | C341: =RC[-2]-R1C1 -> 36.741 | D341: =RC[-2]-R1C2 -> 2.9133
A342: 39.710999999999999 | B342: 2.9304000000000001 | C342: =RC[-2]-R1C1 -> 36.85 | D342: =RC[-2]-R1C2 -> 2.9133
A343: 39.819000000000003 | B343: 2.9327999999999999 | C343: =RC[-2]-R1C1 -> 36.958000000000006 | D343: =RC[-2]-R1C2 -> 2.9156999999999997
A344: 39.927 | B344: 2.9327999999999999 | C344: =RC[-2]-R1C1 -> 37.066000000000003 | D344: =RC[-2]-R1C2 -> 2.9156999999999997
A345: 40.033999999999999 | B345: 2.9327999999999999 | C345: =RC[-2]-R1C1 -> 37.173000000000002 | D345: =RC[-2]-R1C2 -> 2.9156999999999997
A346: 40.142000000000003 | B346: 2.9327999999999999 | C346: =RC[-2]-R1C1 -> 37.281000000000006 | D346: =RC[-2]-R1C2 -> 2.9156999999999997
A347: 40.249000000000002 | B347: 2.9327999999999999 | C347: =RC[-2]-R1C1 -> 37.388000000000005 | D347: =RC[-2]-R1C2 -> 2.9156999999999997
A348: 40.356999999999999 | B348: 2.9327999999999999 | C348: =RC[-2]-R1C1 -> 37.496000000000002 | D348: =RC[-2]-R1C2 -> 2.9156999999999997
A349: 40.466000000000001 | B349: 2.9377 | C349: =RC[-2]-R1C1 -> 37.605000000000004 | D349: =RC[-2]-R1C2 -> 2.9205999999999999
A350: 40.573999999999998 | B350: 2.9352999999999998 | C350: =RC[-2]-R1C1 -> 37.713000000000001 | D350: =RC[-2]-R1C2 -> 2.9181999999999997
A351: 40.682000000000002 | B351: 2.9377 | C351: =RC[-2]-R1C1 -> 37.821000000000005 | D351: =RC[-2]-R1C2 -> 2.9205999999999999
A352: 40.789000000000001 | B352: 2.9377 | C352: =RC[-2]-R1C1 -> 37.928000000000004 | D352: =RC[-2]-R1C2 -> 2.9205999999999999
A353: 40.896999999999998 | B353: 2.9377 | C353: =RC[-2]-R1C1 -> 38.036000000000001 | D353: =RC[-2]-R1C2 -> 2.9205999999999999
A354: 41.006 | B354: 2.9377 | C354: =RC[-2]-R1C1 -> 38.145000000000003 | D354: =RC[-2]-R1C2 -> 2.9205999999999999
A355: 41.113999999999997 | B355: 2.9377 | C355: =RC[-2]-R1C1 -> 38.253 | D355: =RC[-2]-R1C2 -> 2.9205999999999999
A356: 41.222000000000001 | B356: 2.9377 | C356: =RC[-2]-R1C1 -> 38.361000000000004 | D356: =RC[-2]-R1C2 -> 2.9205999999999999
A357: 41.329000000000001 | B357: 2.9426000000000001 | C357: =RC[-2]-R1C1 -> 38.468000000000004 | D357: =RC[-2]-R1C2 -> 2.9255
A358: 41.436999999999998 | B358: 2.9401999999999999 | C358: =RC[-2]-R1C1 -> 38.576000000000001 | D358: =RC[-2]-R1C2 -> 2.9230999999999998
A359: 41.545999999999999 | B359: 2.9426000000000001 | C359: =RC[-2]-R1C1 -> 38.685000000000002 | D359: =RC[-2]-R1C2 -> 2.9255
A360: 41.654000000000003 | B360: 2.9401999999999999 | C360: =RC[-2]-R1C1 -> 38.793000000000006 | D360: =RC[-2]-R1C2 -> 2.9230999999999998
A361: 41.762 | B361: 2.9426000000000001 | C361: =RC[-2]-R1C1 -> 38.901000000000003 | D361: =RC[-2]-R1C2 -> 2.9255
A362: 41.869 | B362: 2.9426000000000001 | C362: =RC[-2]-R1C1 -> 39.008000000000003 | D362: =RC[-2]-R1C2 -> 2.9255
A363: 41.976999999999997 | B363: 2.9426000000000001 | C363: =RC[-2]-R1C1 -> 39.116 | D363: =RC[-2]-R1C2 -> 2.9255
A364: 42.085999999999999 | B364: 2.9426000000000001 | C364: =RC[-2]-R1C1 -> 39.225000000000001 | D364: =RC[-2]-R1C2 -> 2.9255
A365: 42.194000000000003 | B365: 2.9426000000000001 | C365: =RC[-2]-R1C1 -> 39.333000000000006 | D365: =RC[-2]-R1C2 -> 2.9255
A366: 42.302 | B366: 2.9426000000000001 | C366: =RC[-2]-R1C1 -> 39.441000000000003 | D366: =RC[-2]-R1C2 -> 2.9255
A367: 42.408999999999999 | B367: 2.9426000000000001 | C367: =RC[-2]-R1C1 -> 39.548000000000002 | D367: =RC[-2]-R1C2 -> 2.9255
A368: 42.517000000000003 | B368: 2.9426000000000001 | C368: =RC[-2]-R1C1 -> 39.656000000000006 | D368: =RC[-2]-R1C2 -> 2.9255
A369: 42.624000000000002 | B369: 2.9451000000000001 | C369: =RC[-2]-R1C1 -> 39.763000000000005 | D369: =RC[-2]-R1C2 -> 2.9279999999999999
A370: 42.731999999999999 | B370: 2.9451000000000001 | C370: =RC[-2]-R1C1 -> 39.871000000000002 | D370: =RC[-2]-R1C2 -> 2.9279999999999999
A371: 42.841000000000001 | B371: 2.9474999999999998 | C371: =RC[-2]-R1C1 -> 39.980000000000004 | D371: =RC[-2]-R1C2 -> 2.9303999999999997
A372: 42.948999999999998 | B372: 2.9474999999999998 | C372: =RC[-2]-R1C1 -> 40.088000000000001 | D372: =RC[-2]-R1C2 -> 2.9303999999999997
A373: 43.057000000000002 | B373: 2.9474999999999998 | C373: =RC[-2]-R1C1 -> 40.196000000000005 | D373: =RC[-2]-R1C2 -> 2.9303999999999997
A374: 43.164000000000001 | B374: 2.9474999999999998 | C374: =RC[-2]-R1C1 -> 40.303000000000004 | D374: =RC[-2]-R1C2 -> 2.9303999999999997
A375: 43.271999999999998 | B375: 2.9474999999999998 | C375: =RC[-2]-R1C1 -> 40.411000000000001 | D375: =RC[-2]-R1C2 -> 2.9303999999999997
A376: 43.381 | B376: 2.9474999999999998 | C376: =RC[-2]-R1C1 -> 40.52 | D376: =RC[-2]-R1C2 -> 2.9303999999999997
A377: 43.488999999999997 | B377: 2.9474999999999998 | C377: =RC[-2]-R1C1 -> 40.628 | D377: =RC[-2]-R1C2 -> 2.9303999999999997
A378: 43.597000000000001 | B378: 2.9499 | C378: =RC[-2]-R1C1 -> 40.736000000000004 | D378: =RC[-2]-R1C2 -> 2.9327999999999999
A379: 43.704000000000001 | B379: 2.9474999999999998 | C379: =RC[-2]-R1C1 -> 40.843000000000004 | D379: =RC[-2]-R1C2 -> 2.9303999999999997
A380: 43.811999999999998 | B380: 2.9499 | C380: =RC[-2]-R1C1 -> 40.951000000000001 | D380: =RC[-2]-R1C2 -> 2.9327999999999999
A381: 43.920999999999999 | B381: 2.9499 | C381: =RC[-2]-R1C1 -> 41.06 | D381: =RC[-2]-R1C2 -> 2.9327999999999999
A382: 44.029000000000003 | B382: 2.9523999999999999 | C382: =RC[-2]-R1C1 -> 41.168000000000006 | D382: =RC[-2]-R1C2 -> 2.9352999999999998
A383: 44.137 | B383: 2.9499 | C383: =RC[-2]-R1C1 -> 41.276000000000003 | D383: =RC[-2]-R1C2 -> 2.9327999999999999
A384: 44.244 | B384: 2.9523999999999999 | C384: =RC[-2]-R1C1 -> 41.383000000000003 | D384: =RC[-2]-R1C2 -> 2.9352999999999998
A385: 44.351999999999997 | B385: 2.9523999999999999 | C385: =RC[-2]-R1C1 -> 41.491 | D385: =RC[-2]-R1C2 -> 2.9352999999999998
A386: 44.460999999999999 | B386: 2.9523999999999999 | C386: =RC[-2]-R1C1 -> 41.6 | D386: =RC[-2]-R1C2 -> 2.9352999999999998
A387: 44.569000000000003 | B387: 2.9523999999999999 | C387: =RC[-2]-R1C1 -> 41.708000000000006 | D387: =RC[-2]-R1C2 -> 2.9352999999999998
A388: 44.677 | B388: 2.9523999999999999 | C388: =RC[-2]-R1C1 -> 41.816000000000003 | D388: =RC[-2]-R1C2 -> 2.9352999999999998
A389: 44.783999999999999 | B389: 2.9523999999999999 | C389: =RC[-2]-R1C1 -> 41.923000000000002 | D389: =RC[-2]-R1C2 -> 2.9352999999999998
A390: 44.892000000000003 | B390: 2.9523999999999999 | C390: =RC[-2]-R1C1 -> 42.031000000000006 | D390: =RC[-2]-R1C2 -> 2.9352999999999998
A391: 44.999000000000002 | B391: 2.9523999999999999 | C391: =RC[-2]-R1C1 -> 42.138000000000005 | D391: =RC[-2]-R1C2 -> 2.9352999999999998
A392: 45.106999999999999 | B392: 2.9523999999999999 | C392: =RC[-2]-R1C1 -> 42.246000000000002 | D392: =RC[-2]-R1C2 -> 2.9352999999999998
A393: 45.216000000000001 | B393: 2.9523999999999999 | C393: =RC[-2]-R1C1 -> 42.355000000000004 | D393: =RC[-2]-R1C2 -> 2.9352999999999998
A394: 45.323999999999998 | B394: 2.9548000000000001 | C394: =RC[-2]-R1C1 -> 42.463000000000001 | D394: =RC[-2]-R1C2 -> 2.9377
A395: 45.432000000000002 | B395: 2.9548000000000001 | C395: =RC[-2]-R1C1 -> 42.571000000000005 | D395: =RC[-2]-R1C2 -> 2.9377
A396: 45.539000000000001 | B396: 2.9523999999999999 | C396: =RC[-2]-R1C1 -> 42.678000000000004 | D396: =RC[-2]-R1C2 -> 2.9352999999999998
A397: 45.646999999999998 | B397: 2.9548000000000001 | C397: =RC[-2]-R1C1 -> 42.786000000000001 | D397: =RC[-2]-R1C2 -> 2.9377
A398: 45.756 | B398: 2.9548000000000001 | C398: =RC[-2]-R1C1 -> 42.895000000000003 | D398: =RC[-2]-R1C2 -> 2.9377
A399: 45.863999999999997 | B399: 2.9573 | C399: =RC[-2]-R1C1 -> 43.003 | D399: =RC[-2]-R1C2 -> 2.9401999999999999
A400: 45.972000000000001 | B400: 2.9548000000000001 | C400: =RC[-2]-R1C1 -> 43.111000000000004 | D400: =RC[-2]-R1C2 -> 2.9377
A401: 46.079000000000001 | B401: 2.9573 | C401: =RC[-2]-R1C1 -> 43.218000000000004 | D401: =RC[-2]-R1C2 -> 2.9401999999999999
A402: 46.186999999999998 | B402: 2.9548000000000001 | C402: =RC[-2]-R1C1 -> 43.326000000000001 | D402: =RC[-2]-R1C2 -> 2.9377
A403: 46.295999999999999 | B403: 2.9573 | C403: =RC[-2]-R1C1 -> 43.435000000000002 | D403: =RC[-2]-R1C2 -> 2.9401999999999999
A404: 46.404000000000003 | B404: 2.9573 | C404: =RC[-2]-R1C1 -> 43.543000000000006 | D404: =RC[-2]-R1C2 -> 2.9401999999999999
A405: 46.512 | B405: 2.9597000000000002 | C405: =RC[-2]-R1C1 -> 43.651000000000003 | D405: =RC[-2]-R1C2 -> 2.9426000000000001
A406: 46.619 | B406: 2.9573 | C406: =RC[-2]-R1C1 -> 43.758000000000003 | D406: =RC[-2]-R1C2 -> 2.9401999999999999
A407: 46.726999999999997 | B407: 2.9573 | C407: =RC[-2]-R1C1 -> 43.866 | D407: =RC[-2]-R1C2 -> 2.9401999999999999
A408: 46.835999999999999 | B408: 2.9573 | C408: =RC[-2]-R1C1 -> 43.975000000000001 | D408: =RC[-2]-R1C2 -> 2.9401999999999999
A409: 46.944000000000003 | B409: 2.9573 | C409: =RC[-2]-R1C1 -> 44.083000000000006 | D409: =RC[-2]-R1C2 -> 2.9401999999999999
A410: 47.052 | B410: 2.9597000000000002 | C410: =RC[-2]-R1C1 -> 44.191000000000003 | D410: =RC[-2]-R1C2 -> 2.9426000000000001
A411: 47.158999999999999 | B411: 2.9573 | C411: =RC[-2]-R1C1 -> 44.298000000000002 | D411: =RC[-2]-R1C2 -> 2.9401999999999999
A412: 47.267000000000003 | B412: 2.9573 | C412: =RC[-2]-R1C1 -> 44.406000000000006 | D412: =RC[-2]-R1C2 -> 2.9401999999999999
A413: 47.374000000000002 | B413: 2.9597000000000002 | C413: =RC[-2]-R1C1 -> 44.513000000000005 | D413: =RC[-2]-R1C2 -> 2.9426000000000001
A414: 47.481999999999999 | B414: 2.9597000000000002 | C414: =RC[-2]-R1C1 -> 44.621000000000002 | D414: =RC[-2]-R1C2 -> 2.9426000000000001
A415: 47.591000000000001 | B415: 2.9597000000000002 | C415: =RC[-2]-R1C1 -> 44.730000000000004 | D415: =RC[-2]-R1C2 -> 2.9426000000000001
A416: 47.698999999999998 | B416: 2.9621 | C416: =RC[-2]-R1C1 -> 44.838000000000001 | D416: =RC[-2]-R1C2 -> 2.9449999999999998
A417: 47.807000000000002 | B417: 2.9621 | C417: =RC[-2]-R1C1 -> 44.946000000000005 | D417: =RC[-2]-R1C2 -> 2.9449999999999998
A418: 47.914000000000001 | B418: 2.9597000000000002 | C418: =RC[-2]-R1C1 -> 45.053000000000004 | D418: =RC[-2]-R1C2 -> 2.9426000000000001
A419: 48.021999999999998 | B419: 2.9621 | C419: =RC[-2]-R1C1 -> 45.161000000000001 | D419: =RC[-2]-R1C2 -> 2.9449999999999998
A420: 48.131 | B420: 2.9597000000000002 | C420: =RC[-2]-R1C1 -> 45.27 | D420: =RC[-2]-R1C2 -> 2.9426000000000001
A421: 48.238999999999997 | B421: 2.9621 | C421: =RC[-2]-R1C1 -> 45.378 | D421: =RC[-2]-R1C2 -> 2.9449999999999998
A422: 48.347000000000001 | B422: 2.9621 | C422: =RC[-2]-R1C1 -> 45.486000000000004 | D422: =RC[-2]-R1C2 -> 2.9449999999999998
A423: 48.454000000000001 | B423: 2.9621 | C423: =RC[-2]-R1C1 -> 45.593000000000004 | D423: =RC[-2]-R1C2 -> 2.9449999999999998
A424: 48.561999999999998 | B424: 2.9621 | C424: =RC[-2]-R1C1 -> 45.701000000000001 | D424: =RC[-2]-R1C2 -> 2.9449999999999998
A425: 48.670999999999999 | B425: 2.9621 | C425: =RC[-2]-R1C1 -> 45.81 | D425: =RC[-2]-R1C2 -> 2.9449999999999998
A426: 48.779000000000003 | B426: 2.9621 | C426: =RC[-2]-R1C1 -> 45.918000000000006 | D426: =RC[-2]-R1C2 -> 2.9449999999999998
A427: 48.887 | B427: 2.9645999999999999 | C427: =RC[-2]-R1C1 -> 46.026000000000003 | D427: =RC[-2]-R1C2 -> 2.9474999999999998
A428: 48.994 | B428: 2.9645999999999999 | C428: =RC[-2]-R1C1 -> 46.133000000000003 | D428: =RC[-2]-R1C2 -> 2.9474999999999998
A429: 49.101999999999997 | B429: 2.9621 | C429: =RC[-2]-R1C1 -> 46.241 | D429: =RC[-2]-R1C2 -> 2.9449999999999998
A430: 49.210999999999999 | B430: 2.9645999999999999 | C430: =RC[-2]-R1C1 -> 46.35 | D430: =RC[-2]-R1C2 -> 2.9474999999999998
A431: 49.319000000000003 | B431: 2.9645999999999999 | C431: =RC[-2]-R1C1 -> 46.458000000000006 | D431: =RC[-2]-R1C2 -> 2.9474999999999998
A432: 49.427 | B432: 2.9621 | C432: =RC[-2]-R1C1 -> 46.566000000000003 | D432: =RC[-2]-R1C2 -> 2.9449999999999998
A433: 49.533999999999999 | B433: 2.9645999999999999 | C433: =RC[-2]-R1C1 -> 46.673000000000002 | D433: =RC[-2]-R1C2 -> 2.9474999999999998
A434: 49.642000000000003 | B434: 2.9645999999999999 | C434: =RC[-2]-R1C1 -> 46.781000000000006 | D434: =RC[-2]-R1C2 -> 2.9474999999999998
A435: 49.749000000000002 | B435: 2.9645999999999999 | C435: =RC[-2]-R1C1 -> 46.888000000000005 | D435: =RC[-2]-R1C2 -> 2.9474999999999998
A436: 49.856999999999999 | B436: 2.9645999999999999 | C436: =RC[-2]-R1C1 -> 46.996000000000002 | D436: =RC[-2]-R1C2 -> 2.9474999999999998
A437: 49.966000000000001 | B437: 2.9645999999999999 | C437: =RC[-2]-R1C1 -> 47.105000000000004 | D437: =RC[-2]-R1C2 -> 2.9474999999999998
A438: 50.073999999999998 | B438: 2.9645999999999999 | C438: =RC[-2]-R1C1 -> 47.213000000000001 | D438: =RC[-2]-R1C2 -> 2.9474999999999998
A439: 50.182000000000002 | B439: 2.9645999999999999 | C439: =RC[-2]-R1C1 -> 47.321000000000005 | D439: =RC[-2]-R1C2 -> 2.9474999999999998
A440: 50.289000000000001 | B440: 2.9645999999999999 | C440: =RC[-2]-R1C1 -> 47.428000000000004 | D440: =RC[-2]-R1C2 -> 2.9474999999999998
A441: 50.396999999999998 | B441: 2.9645999999999999 | C441: =RC[-2]-R1C1 -> 47.536000000000001 | D441: =RC[-2]-R1C2 -> 2.9474999999999998
A442: 50.506 | B442: 2.9670000000000001 | C442: =RC[-2]-R1C1 -> 47.645000000000003 | D442: =RC[-2]-R1C2 -> 2.9499
A443: 50.613999999999997 | B443: 2.9670000000000001 | C443: =RC[-2]-R1C1 -> 47.753 | D443: =RC[-2]-R1C2 -> 2.9499
A444: 50.722000000000001 | B444: 2.9645999999999999 | C444: =RC[-2]-R1C1 -> 47.861000000000004 | D444: =RC[-2]-R1C2 -> 2.9474999999999998
A445: 50.829000000000001 | B445: 2.9670000000000001 | C445: =RC[-2]-R1C1 -> 47.968000000000004 | D445: =RC[-2]-R1C2 -> 2.9499
A446: 50.936999999999998 | B446: 2.9670000000000001 | C446: =RC[-2]-R1C1 -> 48.076000000000001 | D446: =RC[-2]-R1C2 -> 2.9499
A447: 51.045999999999999 | B447: 2.9670000000000001 | C447: =RC[-2]-R1C1 -> 48.185000000000002 | D447: =RC[-2]-R1C2 -> 2.9499
A448: 51.154000000000003 | B448: 2.9670000000000001 | C448: =RC[-2]-R1C1 -> 48.293000000000006 | D448: =RC[-2]-R1C2 -> 2.9499
A449: 51.262 | B449: 2.9670000000000001 | C449: =RC[-2]-R1C1 -> 48.401000000000003 | D449: =RC[-2]-R1C2 -> 2.9499
A450: 51.369 | B450: 2.9670000000000001 | C450: =RC[-2]-R1C1 -> 48.508000000000003 | D450: =RC[-2]-R1C2 -> 2.9499
A451: 51.476999999999997 | B451: 2.9670000000000001 | C451: =RC[-2]-R1C1 -> 48.616 | D451: =RC[-2]-R1C2 -> 2.9499
A452: 51.585999999999999 | B452: 2.9670000000000001 | C452: =RC[-2]-R1C1 -> 48.725000000000001 | D452: =RC[-2]-R1C2 -> 2.9499
A453: 51.694000000000003 | B453: 2.9670000000000001 | C453: =RC[-2]-R1C1 -> 48.833000000000006 | D453: =RC[-2]-R1C2 -> 2.9499
A454: 51.802 | B454: 2.9695 | C454: =RC[-2]-R1C1 -> 48.941000000000003 | D454: =RC[-2]-R1C2 -> 2.9523999999999999
A455: 51.908999999999999 | B455: 2.9670000000000001 | C455: =RC[-2]-R1C1 -> 49.048000000000002 | D455: =RC[-2]-R1C2 -> 2.9499
A456: 52.017000000000003 | B456: 2.9695 | C456: =RC[-2]-R1C1 -> 49.156000000000006 | D456: =RC[-2]-R1C2 -> 2.9523999999999999
A457: 52.124000000000002 | B457: 2.9670000000000001 | C457: =RC[-2]-R1C1 -> 49.263000000000005 | D457: =RC[-2]-R1C2 -> 2.9499
A458: 52.231999999999999 | B458: 2.9670000000000001 | C458: =RC[-2]-R1C1 -> 49.371000000000002 | D458: =RC[-2]-R1C2 -> 2.9499
A459: 52.341000000000001 | B459: 2.9670000000000001 | C459: =RC[-2]-R1C1 -> 49.480000000000004 | D459: =RC[-2]-R1C2 -> 2.9499
A460: 52.448999999999998 | B460: 2.9695 | C460: =RC[-2]-R1C1 -> 49.588000000000001 | D460: =RC[-2]-R1C2 -> 2.9523999999999999
A461: 52.557000000000002 | B461: 2.9695 | C461: =RC[-2]-R1C1 -> 49.696000000000005 | D461: =RC[-2]-R1C2 -> 2.9523999999999999
A462: 52.664000000000001 | B462: 2.9695 | C462: =RC[-2]-R1C1 -> 49.803000000000004 | D462: =RC[-2]-R1C2 -> 2.9523999999999999
A463: 52.771999999999998 | B463: 2.9695 | C463: =RC[-2]-R1C1 -> 49.911000000000001 | D463: =RC[-2]-R1C2 -> 2.9523999999999999
A464: 52.881 | B464: 2.9695 | C464: =RC[-2]-R1C1 -> 50.02 | D464: =RC[-2]-R1C2 -> 2.9523999999999999
A465: 52.988999999999997 | B465: 2.9695 | C465: =RC[-2]-R1C1 -> 50.128 | D465: =RC[-2]-R1C2 -> 2.9523999999999999
A466: 53.097000000000001 | B466: 2.9719000000000002 | C466: =RC[-2]-R1C1 -> 50.236000000000004 | D466: =RC[-2]-R1C2 -> 2.9548000000000001
A467: 53.204000000000001 | B467: 2.9719000000000002 | C467: =RC[-2]-R1C1 -> 50.343000000000004 | D467: =RC[-2]-R1C2 -> 2.9548000000000001
A468: 53.311999999999998 | B468: 2.9695 | C468: =RC[-2]-R1C1 -> 50.451000000000001 | D468: =RC[-2]-R1C2 -> 2.9523999999999999
A469: 53.420999999999999 | B469: 2.9695 | C469: =RC[-2]-R1C1 -> 50.56 | D469: =RC[-2]-R1C2 -> 2.9523999999999999
A470: 53.529000000000003 | B470: 2.9695 | C470: =RC[-2]-R1C1 -> 50.668000000000006 | D470: =RC[-2]-R1C2 -> 2.9523999999999999
A471: 53.637 | B471: 2.9695 | C471: =RC[-2]-R1C1 -> 50.776000000000003 | D471: =RC[-2]-R1C2 -> 2.9523999999999999
A472: 53.744 | B472: 2.9695 | C472: =RC[-2]-R1C1 -> 50.883000000000003 | D472: =RC[-2]-R1C2 -> 2.9523999999999999
A473: 53.851999999999997 | B473: 2.9719000000000002 | C473: =RC[-2]-R1C1 -> 50.991 | D473: =RC[-2]-R1C2 -> 2.9548000000000001
A474: 53.960999999999999 | B474: 2.9719000000000002 | C474: =RC[-2]-R1C1 -> 51.1 | D474: =RC[-2]-R1C2 -> 2.9548000000000001
A475: 54.069000000000003 | B475: 2.9719000000000002 | C475: =RC[-2]-R1C1 -> 51.208000000000006 | D475: =RC[-2]-R1C2 -> 2.9548000000000001
A476: 54.177 | B476: 2.9719000000000002 | C476: =RC[-2]-R1C1 -> 51.316000000000003 | D476: =RC[-2]-R1C2 -> 2.9548000000000001
A477: 54.283999999999999 | B477: 2.9719000000000002 | C477: =RC[-2]-R1C1 -> 51.423000000000002 | D477: =RC[-2]-R1C2 -> 2.9548000000000001
A478: 54.392000000000003 | B478: 2.9719000000000002 | C478: =RC[-2]-R1C1 -> 51.531000000000006 | D478: =RC[-2]-R1C2 -> 2.9548000000000001
A479: 54.499000000000002 | B479: 2.9719000000000002 | C479: =RC[-2]-R1C1 -> 51.638000000000005 | D479: =RC[-2]-R1C2 -> 2.9548000000000001
A480: 54.606999999999999 | B480: 2.9719000000000002 | C480: =RC[-2]-R1C1 -> 51.746000000000002 | D480: =RC[-2]-R1C2 -> 2.9548000000000001
A481: 54.716000000000001 | B481: 2.9719000000000002 | C481: =RC[-2]-R1C1 -> 51.855000000000004 | D481: =RC[-2]-R1C2 -> 2.9548000000000001
A482: 54.823999999999998 | B482: 2.9719000000000002 | C482: =RC[-2]-R1C1 -> 51.963000000000001 | D482: =RC[-2]-R1C2 -> 2.9548000000000001
A483: 54.932000000000002 | B483: 2.9719000000000002 | C483: =RC[-2]-R1C1 -> 52.071000000000005 | D483: =RC[-2]-R1C2 -> 2.9548000000000001
A484: 55.039000000000001 | B484: 2.9719000000000002 | C484: =RC[-2]-R1C1 -> 52.178000000000004 | D484: =RC[-2]-R1C2 -> 2.9548000000000001
A485: 55.146999999999998 | B485: 2.9719000000000002 | C485: =RC[-2]-R1C1 -> 52.286000000000001 | D485: =RC[-2]-R1C2 -> 2.9548000000000001
A486: 55.256 | B486: 2.9719000000000002 | C486: =RC[-2]-R1C1 -> 52.395000000000003 | D486: =RC[-2]-R1C2 -> 2.9548000000000001
A487: 55.363999999999997 | B487: 2.9719000000000002 | C487: =RC[-2]-R1C1 -> 52.503 | D487: =RC[-2]-R1C2 -> 2.9548000000000001
A488: 55.472000000000001 | B488: 2.9719000000000002 | C488: =RC[-2]-R1C1 -> 52.611000000000004 | D488: =RC[-2]-R1C2 -> 2.9548000000000001
A489: 55.579000000000001 | B489: 2.9719000000000002 | C489: =RC[-2]-R1C1 -> 52.718000000000004 | D489: =RC[-2]-R1C2 -> 2.9548000000000001
A490: 55.686999999999998 | B490: 2.9719000000000002 | C490: =RC[-2]-R1C1 -> 52.826000000000001 | D490: =RC[-2]-R1C2 -> 2.9548000000000001
A491: 55.795999999999999 | B491: 2.9719000000000002 | C491: =RC[-2]-R1C1 -> 52.935000000000002 | D491: =RC[-2]-R1C2 -> 2.9548000000000001
A492: 55.904000000000003 | B492: 2.9719000000000002 | C492: =RC[-2]-R1C1 -> 53.043000000000006 | D492: =RC[-2]-R1C2 -> 2.9548000000000001
A493: 56.012 | B493: 2.9719000000000002 | C493: =RC[-2]-R1C1 -> 53.151000000000003 | D493: =RC[-2]-R1C2 -> 2.9548000000000001
A494: 56.119 | B494: 2.9744000000000002 | C494: =RC[-2]-R1C1 -> 53.258000000000003 | D494: =RC[-2]-R1C2 -> 2.9573
A495: 56.226999999999997 | B495: 2.9744000000000002 | C495: =RC[-2]-R1C1 -> 53.366 | D495: =RC[-2]-R1C2 -> 2.9573
A496: 56.335999999999999 | B496: 2.9719000000000002 | C496: =RC[-2]-R1C1 -> 53.475000000000001 | D496: =RC[-2]-R1C2 -> 2.9548000000000001
A497: 56.444000000000003 | B497: 2.9744000000000002 | C497: =RC[-2]-R1C1 -> 53.583000000000006 | D497: =RC[-2]-R1C2 -> 2.9573
A498: 56.552 | B498: 2.9744000000000002 | C498: =RC[-2]-R1C1 -> 53.691000000000003 | D498: =RC[-2]-R1C2 -> 2.9573
A499: 56.658999999999999 | B499: 2.9744000000000002 | C499: =RC[-2]-R1C1 -> 53.798000000000002 | D499: =RC[-2]-R1C2 -> 2.9573
A500: 56.767000000000003 | B500: 2.9744000000000002 | C500: =RC[-2]-R1C1 -> 53.906000000000006 | D500: =RC[-2]-R1C2 -> 2.9573
A501: 56.874000000000002 | B501: 2.9744000000000002 | C501: =RC[-2]-R1C1 -> 54.013000000000005 | D501: =RC[-2]-R1C2 -> 2.9573
A502: 56.981999999999999 | B502: 2.9744000000000002 | C502: =RC[-2]-R1C1 -> 54.121000000000002 | D502: =RC[-2]-R1C2 -> 2.9573
A503: 57.091000000000001 | B503: 2.9744000000000002 | C503: =RC[-2]-R1C1 -> 54.230000000000004 | D503: =RC[-2]-R1C2 -> 2.9573
A504: 57.198999999999998 | B504: 2.9744000000000002 | C504: =RC[-2]-R1C1 -> 54.338000000000001 | D504: =RC[-2]-R1C2 -> 2.9573
A505: 57.307000000000002 | B505: 2.9744000000000002 | C505: =RC[-2]-R1C1 -> 54.446000000000005 | D505: =RC[-2]-R1C2 -> 2.9573
A506: 57.414000000000001 | B506: 2.9744000000000002 | C506: =RC[-2]-R1C1 -> 54.553000000000004 | D506: =RC[-2]-R1C2 -> 2.9573
A507: 57.521999999999998 | B507: 2.9744000000000002 | C507: =RC[-2]-R1C1 -> 54.661000000000001 | D507: =RC[-2]-R1C2 -> 2.9573
A508: 57.631 | B508: 2.9744000000000002 | C508: =RC[-2]-R1C1 -> 54.77 | D508: =RC[-2]-R1C2 -> 2.9573
A509: 57.738999999999997 | B509: 2.9744000000000002 | C509: =RC[-2]-R1C1 -> 54.878 | D509: =RC[-2]-R1C2 -> 2.9573
A510: 57.847000000000001 | B510: 2.9744000000000002 | C510: =RC[-2]-R1C1 -> 54.986000000000004 | D510: =RC[-2]-R1C2 -> 2.9573
A511: 57.954000000000001 | B511: 2.9767999999999999 | C511: =RC[-2]-R1C1 -> 55.093000000000004 | D511: =RC[-2]-R1C2 -> 2.9596999999999998
A512: 58.061999999999998 | B512: 2.9767999999999999 | C512: =RC[-2]-R1C1 -> 55.201000000000001 | D512: =RC[-2]-R1C2 -> 2.9596999999999998
A513: 58.170999999999999 | B513: 2.9744000000000002 | C513: =RC[-2]-R1C1 -> 55.31 | D513: =RC[-2]-R1C2 -> 2.9573
A514: 58.279000000000003 | B514: 2.9744000000000002 | C514: =RC[-2]-R1C1 -> 55.418000000000006 | D514: =RC[-2]-R1C2 -> 2.9573
A515: 58.387 | B515: 2.9744000000000002 | C515: =RC[-2]-R1C1 -> 55.526000000000003 | D515: =RC[-2]-R1C2 -> 2.9573
A516: 58.494 | B516: 2.9744000000000002 | C516: =RC[-2]-R1C1 -> 55.633000000000003 | D516: =RC[-2]-R1C2 -> 2.9573
A517: 58.601999999999997 | B517: 2.9767999999999999 | C517: =RC[-2]-R1C1 -> 55.741 | D517: =RC[-2]-R1C2 -> 2.9596999999999998
A518: 58.710999999999999 | B518: 2.9744000000000002 | C518: =RC[-2]-R1C1 -> 55.85 | D518: =RC[-2]-R1C2 -> 2.9573
A519: 58.819000000000003 | B519: 2.9767999999999999 | C519: =RC[-2]-R1C1 -> 55.958000000000006 | D519: =RC[-2]-R1C2 -> 2.9596999999999998
A520: 58.927 | B520: 2.9767999999999999 | C520: =RC[-2]-R1C1 -> 56.066000000000003 | D520: =RC[-2]-R1C2 -> 2.9596999999999998
A521: 59.033999999999999 | B521: 2.9767999999999999 | C521: =RC[-2]-R1C1 -> 56.173000000000002 | D521: =RC[-2]-R1C2 -> 2.9596999999999998
A522: 59.142000000000003 | B522: 2.9767999999999999 | C522: =RC[-2]-R1C1 -> 56.281000000000006 | D522: =RC[-2]-R1C2 -> 2.9596999999999998
A523: 59.249000000000002 | B523: 2.9767999999999999 | C523: =RC[-2]-R1C1 -> 56.388000000000005 | D523: =RC[-2]-R1C2 -> 2.9596999999999998
A524: 59.356999999999999 | B524: 2.9767999999999999 | C524: =RC[-2]-R1C1 -> 56.496000000000002 | D524: =RC[-2]-R1C2 -> 2.9596999999999998
A525: 59.466000000000001 | B525: 2.9767999999999999 | C525: =RC[-2]-R1C1 -> 56.605000000000004 | D525: =RC[-2]-R1C2 -> 2.9596999999999998
A526: 59.573999999999998 | B526: 2.9767999999999999 | C526: =RC[-2]-R1C1 -> 56.713000000000001 | D526: =RC[-2]-R1C2 -> 2.9596999999999998
A527: 59.682000000000002 | B527: 2.9767999999999999 | C527: =RC[-2]-R1C1 -> 56.821000000000005 | D527: =RC[-2]-R1C2 -> 2.9596999999999998
A528: 59.789000000000001 | B528: 2.9767999999999999 | C528: =RC[-2]-R1C1 -> 56.928000000000004 | D528: =RC[-2]-R1C2 -> 2.9596999999999998
A529: 59.896999999999998 | B529: 2.9035000000000002 | C529: =RC[-2]-R1C1 -> 57.036000000000001 | D529: =RC[-2]-R1C2 -> 2.8864000000000001
A530: 60.006 | B530: 2.9035000000000002 | C530: =RC[-2]-R1C1 -> 57.145000000000003 | D530: =RC[-2]-R1C2 -> 2.8864000000000001
A531: 60.113999999999997 | B531: 2.8277999999999999 | C531: =RC[-2]-R1C1 -> 57.253 | D531: =RC[-2]-R1C2 -> 2.8106999999999998
A532: 60.222000000000001 | B532: 2.8302999999999998 | C532: =RC[-2]-R1C1 -> 57.361000000000004 | D532: =RC[-2]-R1C2 -> 2.8131999999999997
A533: 60.329000000000001 | B533: 2.7570000000000001 | C533: =RC[-2]-R1C1 -> 57.468000000000004 | D533: =RC[-2]-R1C2 -> 2.7399
A534: 60.436999999999998 | B534: 2.7570000000000001 | C534: =RC[-2]-R1C1 -> 57.576000000000001 | D534: =RC[-2]-R1C2 -> 2.7399
A535: 60.545999999999999 | B535: 2.6861999999999999 | C535: =RC[-2]-R1C1 -> 57.685000000000002 | D535: =RC[-2]-R1C2 -> 2.6690999999999998
A536: 60.654000000000003 | B536: 2.6861999999999999 | C536: =RC[-2]-R1C1 -> 57.793000000000006 | D536: =RC[-2]-R1C2 -> 2.6690999999999998
A537: 60.762 | B537: 2.6177999999999999 | C537: =RC[-2]-R1C1 -> 57.901000000000003 | D537: =RC[-2]-R1C2 -> 2.6006999999999998
A538: 60.869 | B538: 2.6177999999999999 | C538: =RC[-2]-R1C1 -> 58.008000000000003 | D538: =RC[-2]-R1C2 -> 2.6006999999999998
A539: 60.976999999999997 | B539: 2.5518999999999998 | C539: =RC[-2]-R1C1 -> 58.116 | D539: =RC[-2]-R1C2 -> 2.5347999999999997
A540: 61.085999999999999 | B540: 2.5518999999999998 | C540: =RC[-2]-R1C1 -> 58.225000000000001 | D540: =RC[-2]-R1C2 -> 2.5347999999999997
A541: 61.194000000000003 | B541: 2.4883999999999999 | C541: =RC[-2]-R1C1 -> 58.333000000000006 | D541: =RC[-2]-R1C2 -> 2.4712999999999998
A542: 61.302 | B542: 2.4883999999999999 | C542: =RC[-2]-R1C1 -> 58.441000000000003 | D542: =RC[-2]-R1C2 -> 2.4712999999999998
A543: 61.408999999999999 | B543: 2.4274 | C543: =RC[-2]-R1C1 -> 58.548000000000002 | D543: =RC[-2]-R1C2 -> 2.4102999999999999
A544: 61.517000000000003 | B544: 2.4274 | C544: =RC[-2]-R1C1 -> 58.656000000000006 | D544: =RC[-2]-R1C2 -> 2.4102999999999999
A545: 61.624000000000002 | B545: 2.3687 | C545: =RC[-2]-R1C1 -> 58.763000000000005 | D545: =RC[-2]-R1C2 -> 2.3515999999999999
A546: 61.731999999999999 | B546: 2.3687 | C546: =RC[-2]-R1C1 -> 58.871000000000002 | D546: =RC[-2]-R1C2 -> 2.3515999999999999
A547: 61.841000000000001 | B547: 2.3077000000000001 | C547: =RC[-2]-R1C1 -> 58.980000000000004 | D547: =RC[-2]-R1C2 -> 2.2906
A548: 61.948999999999998 | B548: 2.3077000000000001 | C548: =RC[-2]-R1C1 -> 59.088000000000001 | D548: =RC[-2]-R1C2 -> 2.2906
A549: 62.057000000000002 | B549: 2.2515000000000001 | C549: =RC[-2]-R1C1 -> 59.196000000000005 | D549: =RC[-2]-R1C2 -> 2.2343999999999999
A550: 62.164000000000001 | B550: 2.2515000000000001 | C550: =RC[-2]-R1C1 -> 59.303000000000004 | D550: =RC[-2]-R1C2 -> 2.2343999999999999
A551: 62.271999999999998 | B551: 2.1953999999999998 | C551: =RC[-2]-R1C1 -> 59.411000000000001 | D551: =RC[-2]-R1C2 -> 2.1782999999999997
A552: 62.381 | B552: 2.1953999999999998 | C552: =RC[-2]-R1C1 -> 59.52 | D552: =RC[-2]-R1C2 -> 2.1782999999999997
A553: 62.488999999999997 | B553: 2.1415999999999999 | C553: =RC[-2]-R1C1 -> 59.628 | D553: =RC[-2]-R1C2 -> 2.1244999999999998
A554: 62.597000000000001 | B554: 2.1415999999999999 | C554: =RC[-2]-R1C1 -> 59.736000000000004 | D554: =RC[-2]-R1C2 -> 2.1244999999999998
A555: 62.704000000000001 | B555: 2.0903999999999998 | C555: =RC[-2]-R1C1 -> 59.843000000000004 | D555: =RC[-2]-R1C2 -> 2.0732999999999997
A556: 62.811999999999998 | B556: 2.0878999999999999 | C556: =RC[-2]-R1C1 -> 59.951000000000001 | D556: =RC[-2]-R1C2 -> 2.0707999999999998
A557: 62.920999999999999 | B557: 2.0366 | C557: =RC[-2]-R1C1 -> 60.06 | D557: =RC[-2]-R1C2 -> 2.0194999999999999
A558: 63.029000000000003 | B558: 2.0366 | C558: =RC[-2]-R1C1 -> 60.168000000000006 | D558: =RC[-2]-R1C2 -> 2.0194999999999999
A559: 63.137 | B559: 1.9878 | C559: =RC[-2]-R1C1 -> 60.276000000000003 | D559: =RC[-2]-R1C2 -> 1.9707000000000001
A560: 63.244 | B560: 1.9853000000000001 | C560: =RC[-2]-R1C1 -> 60.383000000000003 | D560: =RC[-2]-R1C2 -> 1.9682000000000002
A561: 63.351999999999997 | B561: 1.9390000000000001 | C561: =RC[-2]-R1C1 -> 60.491 | D561: =RC[-2]-R1C2 -> 1.9219000000000002
A562: 63.460999999999999 | B562: 1.9390000000000001 | C562: =RC[-2]-R1C1 -> 60.6 | D562: =RC[-2]-R1C2 -> 1.9219000000000002
A563: 63.569000000000003 | B563: 1.8926000000000001 | C563: =RC[-2]-R1C1 -> 60.708000000000006 | D563: =RC[-2]-R1C2 -> 1.8755000000000002
A564: 63.677 | B564: 1.8926000000000001 | C564: =RC[-2]-R1C1 -> 60.816000000000003 | D564: =RC[-2]-R1C2 -> 1.8755000000000002
A565: 63.783999999999999 | B565: 1.8462000000000001 | C565: =RC[-2]-R1C1 -> 60.923000000000002 | D565: =RC[-2]-R1C2 -> 1.8291000000000002
A566: 63.892000000000003 | B566: 1.8436999999999999 | C566: =RC[-2]-R1C1 -> 61.031000000000006 | D566: =RC[-2]-R1C2 -> 1.8266
A567: 63.999000000000002 | B567: 1.7998000000000001 | C567: =RC[-2]-R1C1 -> 61.138000000000005 | D567: =RC[-2]-R1C2 -> 1.7827000000000002
A568: 64.106999999999999 | B568: 1.7998000000000001 | C568: =RC[-2]-R1C1 -> 61.246000000000002 | D568: =RC[-2]-R1C2 -> 1.7827000000000002
A569: 64.215999999999994 | B569: 1.7558 | C569: =RC[-2]-R1C1 -> 61.354999999999997 | D569: =RC[-2]-R1C2 -> 1.7387000000000001
A570: 64.323999999999998 | B570: 1.7558 | C570: =RC[-2]-R1C1 -> 61.463000000000001 | D570: =RC[-2]-R1C2 -> 1.7387000000000001
A571: 64.432000000000002 | B571: 1.7118 | C571: =RC[-2]-R1C1 -> 61.571000000000005 | D571: =RC[-2]-R1C2 -> 1.6947000000000001
A572: 64.539000000000001 | B572: 1.7118 | C572: =RC[-2]-R1C1 -> 61.678000000000004 | D572: =RC[-2]-R1C2 -> 1.6947000000000001
A573: 64.647000000000006 | B573: 1.6702999999999999 | C573: =RC[-2]-R1C1 -> 61.786000000000008 | D573: =RC[-2]-R1C2 -> 1.6532
A574: 64.756 | B574: 1.6702999999999999 | C574: =RC[-2]-R1C1 -> 61.895000000000003 | D574: =RC[-2]-R1C2 -> 1.6532
A575: 64.864000000000004 | B575: 1.6288 | C575: =RC[-2]-R1C1 -> 62.003000000000007 | D575: =RC[-2]-R1C2 -> 1.6117000000000001
A576: 64.971999999999994 | B576: 1.6313 | C576: =RC[-2]-R1C1 -> 62.110999999999997 | D576: =RC[-2]-R1C2 -> 1.6142000000000001
A577: 65.078999999999994 | B577: 1.5896999999999999 | C577: =RC[-2]-R1C1 -> 62.217999999999996 | D577: =RC[-2]-R1C2 -> 1.5726
A578: 65.186999999999998 | B578: 1.5896999999999999 | C578: =RC[-2]-R1C1 -> 62.326000000000001 | D578: =RC[-2]-R1C2 -> 1.5726
A579: 65.296000000000006 | B579: 1.5530999999999999 | C579: =RC[-2]-R1C1 -> 62.435000000000009 | D579: =RC[-2]-R1C2 -> 1.536
A580: 65.403999999999996 | B580: 1.5507 | C580: =RC[-2]-R1C1 -> 62.542999999999999 | D580: =RC[-2]-R1C2 -> 1.5336000000000001
A581: 65.512 | B581: 1.5165 | C581: =RC[-2]-R1C1 -> 62.651000000000003 | D581: =RC[-2]-R1C2 -> 1.4994000000000001
A582: 65.619 | B582: 1.514 | C582: =RC[-2]-R1C1 -> 62.758000000000003 | D582: =RC[-2]-R1C2 -> 1.4969000000000001
A583: 65.727000000000004 | B583: 1.4774 | C583: =RC[-2]-R1C1 -> 62.866000000000007 | D583: =RC[-2]-R1C2 -> 1.4603000000000002
A584: 65.835999999999999 | B584: 1.4774 | C584: =RC[-2]-R1C1 -> 62.975000000000001 | D584: =RC[-2]-R1C2 -> 1.4603000000000002
A585: 65.944000000000003 | B585: 1.4432 | C585: =RC[-2]-R1C1 -> 63.083000000000006 | D585: =RC[-2]-R1C2 -> 1.4261000000000001
A586: 66.052000000000007 | B586: 1.4432 | C586: =RC[-2]-R1C1 -> 63.19100000000001 | D586: =RC[-2]-R1C2 -> 1.4261000000000001
A587: 66.159000000000006 | B587: 1.409 | C587: =RC[-2]-R1C1 -> 63.298000000000009 | D587: =RC[-2]-R1C2 -> 1.3919000000000001
A588: 66.266999999999996 | B588: 1.4066000000000001 | C588: =RC[-2]-R1C1 -> 63.405999999999999 | D588: =RC[-2]-R1C2 -> 1.3895000000000002
A589: 66.373999999999995 | B589: 1.3748 | C589: =RC[-2]-R1C1 -> 63.512999999999998 | D589: =RC[-2]-R1C2 -> 1.3577000000000001
A590: 66.481999999999999 | B590: 1.3748 | C590: =RC[-2]-R1C1 -> 63.621000000000002 | D590: =RC[-2]-R1C2 -> 1.3577000000000001
A591: 66.590999999999994 | B591: 1.3407 | C591: =RC[-2]-R1C1 -> 63.73 | D591: =RC[-2]-R1C2 -> 1.3236000000000001
A592: 66.698999999999998 | B592: 1.3407 | C592: =RC[-2]-R1C1 -> 63.838000000000001 | D592: =RC[-2]-R1C2 -> 1.3236000000000001
A593: 66.807000000000002 | B593: 1.3065 | C593: =RC[-2]-R1C1 -> 63.946000000000005 | D593: =RC[-2]-R1C2 -> 1.2894000000000001
A594: 66.914000000000001 | B594: 1.3065 | C594: =RC[-2]-R1C1 -> 64.052999999999997 | D594: =RC[-2]-R1C2 -> 1.2894000000000001
A595: 67.022000000000006 | B595: 1.2746999999999999 | C595: =RC[-2]-R1C1 -> 64.161000000000001 | D595: =RC[-2]-R1C2 -> 1.2576000000000001
A596: 67.131 | B596: 1.2746999999999999 | C596: =RC[-2]-R1C1 -> 64.27 | D596: =RC[-2]-R1C2 -> 1.2576000000000001
A597: 67.239000000000004 | B597: 1.2454000000000001 | C597: =RC[-2]-R1C1 -> 64.378 | D597: =RC[-2]-R1C2 -> 1.2283000000000002
A598: 67.346999999999994 | B598: 1.2454000000000001 | C598: =RC[-2]-R1C1 -> 64.48599999999999 | D598: =RC[-2]-R1C2 -> 1.2283000000000002
A599: 67.453999999999994 | B599: 1.2137 | C599: =RC[-2]-R1C1 -> 64.592999999999989 | D599: =RC[-2]-R1C2 -> 1.1966000000000001
A600: 67.561999999999998 | B600: 1.2137 | C600: =RC[-2]-R1C1 -> 64.700999999999993 | D600: =RC[-2]-R1C2 -> 1.1966000000000001
A601: 67.671000000000006 | B601: 1.1843999999999999 | C601: =RC[-2]-R1C1 -> 64.81 | D601: =RC[-2]-R1C2 -> 1.1673
A602: 67.778999999999996 | B602: 1.1843999999999999 | C602: =RC[-2]-R1C1 -> 64.917999999999992 | D602: =RC[-2]-R1C2 -> 1.1673
A603: 67.887 | B603: 1.1575 | C603: =RC[-2]-R1C1 -> 65.025999999999996 | D603: =RC[-2]-R1C2 -> 1.1404000000000001
A604: 67.994 | B604: 1.1575 | C604: =RC[-2]-R1C1 -> 65.132999999999996 | D604: =RC[-2]-R1C2 -> 1.1404000000000001
A605: 68.102000000000004 | B605: 1.1306 | C605: =RC[-2]-R1C1 -> 65.241 | D605: =RC[-2]-R1C2 -> 1.1135000000000002
A606: 68.210999999999999 | B606: 1.1282000000000001 | C606: =RC[-2]-R1C1 -> 65.35 | D606: =RC[-2]-R1C2 -> 1.1111000000000002
A607: 68.319000000000003 | B607: 1.1012999999999999 | C607: =RC[-2]-R1C1 -> 65.457999999999998 | D607: =RC[-2]-R1C2 -> 1.0842000000000001
A608: 68.427000000000007 | B608: 1.1012999999999999 | C608: =RC[-2]-R1C1 -> 65.566000000000003 | D608: =RC[-2]-R1C2 -> 1.0842000000000001
A609: 68.534000000000006 | B609: 1.0769 | C609: =RC[-2]-R1C1 -> 65.673000000000002 | D609: =RC[-2]-R1C2 -> 1.0598000000000001
A610: 68.641999999999996 | B610: 1.0745 | C610: =RC[-2]-R1C1 -> 65.780999999999992 | D610: =RC[-2]-R1C2 -> 1.0574000000000001
A611: 68.748999999999995 | B611: 1.0501 | C611: =RC[-2]-R1C1 -> 65.887999999999991 | D611: =RC[-2]-R1C2 -> 1.0330000000000001
A612: 68.856999999999999 | B612: 1.0501 | C612: =RC[-2]-R1C1 -> 65.995999999999995 | D612: =RC[-2]-R1C2 -> 1.0330000000000001
A613: 68.965999999999994 | B613: 1.0232000000000001 | C613: =RC[-2]-R1C1 -> 66.10499999999999 | D613: =RC[-2]-R1C2 -> 1.0061000000000002
A614: 69.073999999999998 | B614: 1.0232000000000001 | C614: =RC[-2]-R1C1 -> 66.212999999999994 | D614: =RC[-2]-R1C2 -> 1.0061000000000002
A615: 69.182000000000002 | B615: 0.99880000000000002 | C615: =RC[-2]-R1C1 -> 66.320999999999998 | D615: =RC[-2]-R1C2 -> 0.98170000000000002
A616: 69.289000000000001 | B616: 0.99880000000000002 | C616: =RC[-2]-R1C1 -> 66.427999999999997 | D616: =RC[-2]-R1C2 -> 0.98170000000000002
A617: 69.397000000000006 | B617: 0.9768 | C617: =RC[-2]-R1C1 -> 66.536000000000001 | D617: =RC[-2]-R1C2 -> 0.9597
A618: 69.506 | B618: 0.9768 | C618: =RC[-2]-R1C1 -> 66.644999999999996 | D618: =RC[-2]-R1C2 -> 0.9597
A619: 69.614000000000004 | B619: 0.95240000000000002 | C619: =RC[-2]-R1C1 -> 66.753 | D619: =RC[-2]-R1C2 -> 0.93530000000000002
A620: 69.721999999999994 | B620: 0.95240000000000002 | C620: =RC[-2]-R1C1 -> 66.86099999999999 | D620: =RC[-2]-R1C2 -> 0.93530000000000002
A621: 69.828999999999994 | B621: 0.9304 | C621: =RC[-2]-R1C1 -> 66.967999999999989 | D621: =RC[-2]-R1C2 -> 0.9133
A622: 69.936999999999998 | B622: 0.92800000000000005 | C622: =RC[-2]-R1C1 -> 67.075999999999993 | D622: =RC[-2]-R1C2 -> 0.91090000000000004
A623: 70.046000000000006 | B623: 0.90839999999999999 | C623: =RC[-2]-R1C1 -> 67.185000000000002 | D623: =RC[-2]-R1C2 -> 0.89129999999999998
A624: 70.153999999999996 | B624: 0.90600000000000003 | C624: =RC[-2]-R1C1 -> 67.292999999999992 | D624: =RC[-2]-R1C2 -> 0.88890000000000002
A625: 70.262 | B625: 0.88639999999999997 | C625: =RC[-2]-R1C1 -> 67.400999999999996 | D625: =RC[-2]-R1C2 -> 0.86929999999999996
A626: 70.369 | B626: 0.88639999999999997 | C626: =RC[-2]-R1C1 -> 67.507999999999996 | D626: =RC[-2]-R1C2 -> 0.86929999999999996
A627: 70.477000000000004 | B627: 0.86450000000000005 | C627: =RC[-2]-R1C1 -> 67.616 | D627: =RC[-2]-R1C2 -> 0.84740000000000004
A628: 70.585999999999999 | B628: 0.8669 | C628: =RC[-2]-R1C1 -> 67.724999999999994 | D628: =RC[-2]-R1C2 -> 0.8498
A629: 70.694000000000003 | B629: 0.84489999999999998 | C629: =RC[-2]-R1C1 -> 67.832999999999998 | D629: =RC[-2]-R1C2 -> 0.82779999999999998
A630: 70.802000000000007 | B630: 0.84489999999999998 | C630: =RC[-2]-R1C1 -> 67.941000000000003 | D630: =RC[-2]-R1C2 -> 0.82779999999999998
A631: 70.909000000000006 | B631: 0.82540000000000002 | C631: =RC[-2]-R1C1 -> 68.048000000000002 | D631: =RC[-2]-R1C2 -> 0.80830000000000002
A632: 71.016999999999996 | B632: 0.82540000000000002 | C632: =RC[-2]-R1C1 -> 68.155999999999992 | D632: =RC[-2]-R1C2 -> 0.80830000000000002
A633: 71.123999999999995 | B633: 0.80589999999999995 | C633: =RC[-2]-R1C1 -> 68.262999999999991 | D633: =RC[-2]-R1C2 -> 0.78879999999999995
A634: 71.231999999999999 | B634: 0.80589999999999995 | C634: =RC[-2]-R1C1 -> 68.370999999999995 | D634: =RC[-2]-R1C2 -> 0.78879999999999995
A635: 71.340999999999994 | B635: 0.7863 | C635: =RC[-2]-R1C1 -> 68.47999999999999 | D635: =RC[-2]-R1C2 -> 0.76919999999999999
A636: 71.448999999999998 | B636: 0.7863 | C636: =RC[-2]-R1C1 -> 68.587999999999994 | D636: =RC[-2]-R1C2 -> 0.76919999999999999
A637: 71.557000000000002 | B637: 0.76680000000000004 | C637: =RC[-2]-R1C1 -> 68.695999999999998 | D637: =RC[-2]-R1C2 -> 0.74970000000000003
A638: 71.664000000000001 | B638: 0.76680000000000004 | C638: =RC[-2]-R1C1 -> 68.802999999999997 | D638: =RC[-2]-R1C2 -> 0.74970000000000003
A639: 71.772000000000006 | B639: 0.74970000000000003 | C639: =RC[-2]-R1C1 -> 68.911000000000001 | D639: =RC[-2]-R1C2 -> 0.73260000000000003
A640: 71.881 | B640: 0.74970000000000003 | C640: =RC[-2]-R1C1 -> 69.02 | D640: =RC[-2]-R1C2 -> 0.73260000000000003
A641: 71.989000000000004 | B641: 0.73019999999999996 | C641: =RC[-2]-R1C1 -> 69.128 | D641: =RC[-2]-R1C2 -> 0.71309999999999996
A642: 72.096999999999994 | B642: 0.73019999999999996 | C642: =RC[-2]-R1C1 -> 69.23599999999999 | D642: =RC[-2]-R1C2 -> 0.71309999999999996
A643: 72.203999999999994 | B643: 0.71550000000000002 | C643: =RC[-2]-R1C1 -> 69.342999999999989 | D643: =RC[-2]-R1C2 -> 0.69840000000000002
A644: 72.311999999999998 | B644: 0.71309999999999996 | C644: =RC[-2]-R1C1 -> 69.450999999999993 | D644: =RC[-2]-R1C2 -> 0.69599999999999995
A645: 72.421000000000006 | B645: 0.69599999999999995 | C645: =RC[-2]-R1C1 -> 69.56 | D645: =RC[-2]-R1C2 -> 0.67889999999999995
A646: 72.528999999999996 | B646: 0.69840000000000002 | C646: =RC[-2]-R1C1 -> 69.667999999999992 | D646: =RC[-2]-R1C2 -> 0.68130000000000002
A647: 72.637 | B647: 0.68130000000000002 | C647: =RC[-2]-R1C1 -> 69.775999999999996 | D647: =RC[-2]-R1C2 -> 0.66420000000000001
A648: 72.744 | B648: 0.68130000000000002 | C648: =RC[-2]-R1C1 -> 69.882999999999996 | D648: =RC[-2]-R1C2 -> 0.66420000000000001
A649: 72.852000000000004 | B649: 0.66420000000000001 | C649: =RC[-2]-R1C1 -> 69.991 | D649: =RC[-2]-R1C2 -> 0.64710000000000001
A650: 72.960999999999999 | B650: 0.66420000000000001 | C650: =RC[-2]-R1C1 -> 70.1 | D650: =RC[-2]-R1C2 -> 0.64710000000000001
A651: 73.069000000000003 | B651: 0.64959999999999996 | C651: =RC[-2]-R1C1 -> 70.207999999999998 | D651: =RC[-2]-R1C2 -> 0.63249999999999995
A652: 73.177000000000007 | B652: 0.64959999999999996 | C652: =RC[-2]-R1C1 -> 70.316000000000003 | D652: =RC[-2]-R1C2 -> 0.63249999999999995
A653: 73.284000000000006 | B653: 0.63249999999999995 | C653: =RC[-2]-R1C1 -> 70.423000000000002 | D653: =RC[-2]-R1C2 -> 0.61539999999999995
A654: 73.391999999999996 | B654: 0.63249999999999995 | C654: =RC[-2]-R1C1 -> 70.530999999999992 | D654: =RC[-2]-R1C2 -> 0.61539999999999995
A655: 73.498999999999995 | B655: 0.61780000000000002 | C655: =RC[-2]-R1C1 -> 70.637999999999991 | D655: =RC[-2]-R1C2 -> 0.60070000000000001
A656: 73.606999999999999 | B656: 0.61780000000000002 | C656: =RC[-2]-R1C1 -> 70.745999999999995 | D656: =RC[-2]-R1C2 -> 0.60070000000000001
A657: 73.715999999999994 | B657: 0.60560000000000003 | C657: =RC[-2]-R1C1 -> 70.85499999999999 | D657: =RC[-2]-R1C2 -> 0.58850000000000002
A658: 73.823999999999998 | B658: 0.60319999999999996 | C658: =RC[-2]-R1C1 -> 70.962999999999994 | D658: =RC[-2]-R1C2 -> 0.58609999999999995
A659: 73.932000000000002 | B659: 0.58850000000000002 | C659: =RC[-2]-R1C1 -> 71.070999999999998 | D659: =RC[-2]-R1C2 -> 0.57140000000000002
A660: 74.039000000000001 | B660: 0.58850000000000002 | C660: =RC[-2]-R1C1 -> 71.177999999999997 | D660: =RC[-2]-R1C2 -> 0.57140000000000002
A661: 74.147000000000006 | B661: 0.57630000000000003 | C661: =RC[-2]-R1C1 -> 71.286000000000001 | D661: =RC[-2]-R1C2 -> 0.55920000000000003
A662: 74.256 | B662: 0.57630000000000003 | C662: =RC[-2]-R1C1 -> 71.394999999999996 | D662: =RC[-2]-R1C2 -> 0.55920000000000003
A663: 74.364000000000004 | B663: 0.56169999999999998 | C663: =RC[-2]-R1C1 -> 71.503 | D663: =RC[-2]-R1C2 -> 0.54459999999999997
A664: 74.471999999999994 | B664: 0.56169999999999998 | C664: =RC[-2]-R1C1 -> 71.61099999999999 | D664: =RC[-2]-R1C2 -> 0.54459999999999997
A665: 74.578999999999994 | B665: 0.54949999999999999 | C665: =RC[-2]-R1C1 -> 71.717999999999989 | D665: =RC[-2]-R1C2 -> 0.53239999999999998
A666: 74.686999999999998 | B666: 0.54700000000000004 | C666: =RC[-2]-R1C1 -> 71.825999999999993 | D666: =RC[-2]-R1C2 -> 0.52990000000000004
A667: 74.796000000000006 | B667: 0.53480000000000005 | C667: =RC[-2]-R1C1 -> 71.935000000000002 | D667: =RC[-2]-R1C2 -> 0.51770000000000005
A668: 74.903999999999996 | B668: 0.53480000000000005 | C668: =RC[-2]-R1C1 -> 72.042999999999992 | D668: =RC[-2]-R1C2 -> 0.51770000000000005
A669: 75.012 | B669: 0.52259999999999995 | C669: =RC[-2]-R1C1 -> 72.150999999999996 | D669: =RC[-2]-R1C2 -> 0.50549999999999995
A670: 75.119 | B670: 0.52259999999999995 | C670: =RC[-2]-R1C1 -> 72.257999999999996 | D670: =RC[-2]-R1C2 -> 0.50549999999999995
A671: 75.227000000000004 | B671: 0.51039999999999996 | C671: =RC[-2]-R1C1 -> 72.366 | D671: =RC[-2]-R1C2 -> 0.49329999999999996
A672: 75.335999999999999 | B672: 0.51280000000000003 | C672: =RC[-2]-R1C1 -> 72.474999999999994 | D672: =RC[-2]-R1C2 -> 0.49570000000000003
A673: 75.444000000000003 | B673: 0.50060000000000004 | C673: =RC[-2]-R1C1 -> 72.582999999999998 | D673: =RC[-2]-R1C2 -> 0.48350000000000004
A674: 75.552000000000007 | B674: 0.49819999999999998 | C674: =RC[-2]-R1C1 -> 72.691000000000003 | D674: =RC[-2]-R1C2 -> 0.48109999999999997
A675: 75.659000000000006 | B675: 0.4884 | C675: =RC[-2]-R1C1 -> 72.798000000000002 | D675: =RC[-2]-R1C2 -> 0.4713
A676: 75.766999999999996 | B676: 0.4884 | C676: =RC[-2]-R1C1 -> 72.905999999999992 | D676: =RC[-2]-R1C2 -> 0.4713
A677: 75.873999999999995 | B677: 0.47620000000000001 | C677: =RC[-2]-R1C1 -> 73.012999999999991 | D677: =RC[-2]-R1C2 -> 0.45910000000000001
A678: 75.981999999999999 | B678: 0.47620000000000001 | C678: =RC[-2]-R1C1 -> 73.120999999999995 | D678: =RC[-2]-R1C2 -> 0.45910000000000001
A679: 76.090999999999994 | B679: 0.46400000000000002 | C679: =RC[-2]-R1C1 -> 73.22999999999999 | D679: =RC[-2]-R1C2 -> 0.44690000000000002
A680: 76.198999999999998 | B680: 0.46400000000000002 | C680: =RC[-2]-R1C1 -> 73.337999999999994 | D680: =RC[-2]-R1C2 -> 0.44690000000000002
A681: 76.307000000000002 | B681: 0.45419999999999999 | C681: =RC[-2]-R1C1 -> 73.445999999999998 | D681: =RC[-2]-R1C2 -> 0.43709999999999999
A682: 76.414000000000001 | B682: 0.45419999999999999 | C682: =RC[-2]-R1C1 -> 73.552999999999997 | D682: =RC[-2]-R1C2 -> 0.43709999999999999
A683: 76.522000000000006 | B683: 0.44440000000000002 | C683: =RC[-2]-R1C1 -> 73.661000000000001 | D683: =RC[-2]-R1C2 -> 0.42730000000000001
A684: 76.631 | B684: 0.44440000000000002 | C684: =RC[-2]-R1C1 -> 73.77 | D684: =RC[-2]-R1C2 -> 0.42730000000000001
A685: 76.739000000000004 | B685: 0.43219999999999997 | C685: =RC[-2]-R1C1 -> 73.878 | D685: =RC[-2]-R1C2 -> 0.41509999999999997
A686: 76.846999999999994 | B686: 0.43219999999999997 | C686: =RC[-2]-R1C1 -> 73.98599999999999 | D686: =RC[-2]-R1C2 -> 0.41509999999999997
A687: 76.953999999999994 | B687: 0.42249999999999999 | C687: =RC[-2]-R1C1 -> 74.092999999999989 | D687: =RC[-2]-R1C2 -> 0.40539999999999998
A688: 77.061999999999998 | B688: 0.42249999999999999 | C688: =RC[-2]-R1C1 -> 74.200999999999993 | D688: =RC[-2]-R1C2 -> 0.40539999999999998
A689: 77.171000000000006 | B689: 0.41270000000000001 | C689: =RC[-2]-R1C1 -> 74.31 | D689: =RC[-2]-R1C2 -> 0.39560000000000001
A690: 77.278999999999996 | B690: 0.41270000000000001 | C690: =RC[-2]-R1C1 -> 74.417999999999992 | D690: =RC[-2]-R1C2 -> 0.39560000000000001
A691: 77.387 | B691: 0.40539999999999998 | C691: =RC[-2]-R1C1 -> 74.525999999999996 | D691: =RC[-2]-R1C2 -> 0.38829999999999998
A692: 77.494 | B692: 0.40289999999999998 | C692: =RC[-2]-R1C1 -> 74.632999999999996 | D692: =RC[-2]-R1C2 -> 0.38579999999999998
A693: 77.602000000000004 | B693: 0.39319999999999999 | C693: =RC[-2]-R1C1 -> 74.741 | D693: =RC[-2]-R1C2 -> 0.37609999999999999
A694: 77.710999999999999 | B694: 0.39319999999999999 | C694: =RC[-2]-R1C1 -> 74.85 | D694: =RC[-2]-R1C2 -> 0.37609999999999999
A695: 77.819000000000003 | B695: 0.38579999999999998 | C695: =RC[-2]-R1C1 -> 74.957999999999998 | D695: =RC[-2]-R1C2 -> 0.36869999999999997
A696: 77.927000000000007 | B696: 0.38340000000000002 | C696: =RC[-2]-R1C1 -> 75.066000000000003 | D696: =RC[-2]-R1C2 -> 0.36630000000000001
A697: 78.034000000000006 | B697: 0.37609999999999999 | C697: =RC[-2]-R1C1 -> 75.173000000000002 | D697: =RC[-2]-R1C2 -> 0.35899999999999999
A698: 78.141999999999996 | B698: 0.37609999999999999 | C698: =RC[-2]-R1C1 -> 75.280999999999992 | D698: =RC[-2]-R1C2 -> 0.35899999999999999
A699: 78.248999999999995 | B699: 0.36630000000000001 | C699: =RC[-2]-R1C1 -> 75.387999999999991 | D699: =RC[-2]-R1C2 -> 0.34920000000000001
A700: 78.356999999999999 | B700: 0.36870000000000003 | C700: =RC[-2]-R1C1 -> 75.495999999999995 | D700: =RC[-2]-R1C2 -> 0.35160000000000002
A701: 78.465999999999994 | B701: 0.35899999999999999 | C701: =RC[-2]-R1C1 -> 75.60499999999999 | D701: =RC[-2]-R1C2 -> 0.34189999999999998
A702: 78.573999999999998 | B702: 0.35899999999999999 | C702: =RC[-2]-R1C1 -> 75.712999999999994 | D702: =RC[-2]-R1C2 -> 0.34189999999999998
A703: 78.682000000000002 | B703: 0.34920000000000001 | C703: =RC[-2]-R1C1 -> 75.820999999999998 | D703: =RC[-2]-R1C2 -> 0.33210000000000001
A704: 78.789000000000001 | B704: 0.34920000000000001 | C704: =RC[-2]-R1C1 -> 75.927999999999997 | D704: =RC[-2]-R1C2 -> 0.33210000000000001
A705: 78.897000000000006 | B705: 0.34189999999999998 | C705: =RC[-2]-R1C1 -> 76.036000000000001 | D705: =RC[-2]-R1C2 -> 0.32479999999999998
A706: 79.006 | B706: 0.34189999999999998 | C706: =RC[-2]-R1C1 -> 76.144999999999996 | D706: =RC[-2]-R1C2 -> 0.32479999999999998
A707: 79.114000000000004 | B707: 0.33460000000000001 | C707: =RC[-2]-R1C1 -> 76.253 | D707: =RC[-2]-R1C2 -> 0.3175
A708: 79.221999999999994 | B708: 0.33460000000000001 | C708: =RC[-2]-R1C1 -> 76.36099999999999 | D708: =RC[-2]-R1C2 -> 0.3175
A709: 79.328999999999994 | B709: 0.32719999999999999 | C709: =RC[-2]-R1C1 -> 76.467999999999989 | D709: =RC[-2]-R1C2 -> 0.31009999999999999
A710: 79.436999999999998 | B710: 0.32719999999999999 | C710: =RC[-2]-R1C1 -> 76.575999999999993 | D710: =RC[-2]-R1C2 -> 0.31009999999999999
A711: 79.546000000000006 | B711: 0.31990000000000002 | C711: =RC[-2]-R1C1 -> 76.685000000000002 | D711: =RC[-2]-R1C2 -> 0.30280000000000001
A712: 79.653999999999996 | B712: 0.31990000000000002 | C712: =RC[-2]-R1C1 -> 76.792999999999992 | D712: =RC[-2]-R1C2 -> 0.30280000000000001
A713: 79.762 | B713: 0.31259999999999999 | C713: =RC[-2]-R1C1 -> 76.900999999999996 | D713: =RC[-2]-R1C2 -> 0.29549999999999998
A714: 79.869 | B714: 0.31259999999999999 | C714: =RC[-2]-R1C1 -> 77.007999999999996 | D714: =RC[-2]-R1C2 -> 0.29549999999999998
A715: 79.977000000000004 | B715: 0.30530000000000002 | C715: =RC[-2]-R1C1 -> 77.116 | D715: =RC[-2]-R1C2 -> 0.28820000000000001
A716: 80.085999999999999 | B716: 0.30530000000000002 | C716: =RC[-2]-R1C1 -> 77.224999999999994 | D716: =RC[-2]-R1C2 -> 0.28820000000000001
A717: 80.194000000000003 | B717: 0.2979 | C717: =RC[-2]-R1C1 -> 77.332999999999998 | D717: =RC[-2]-R1C2 -> 0.28079999999999999
A718: 80.302000000000007 | B718: 0.3004 | C718: =RC[-2]-R1C1 -> 77.441000000000003 | D718: =RC[-2]-R1C2 -> 0.2833
A719: 80.409000000000006 | B719: 0.29299999999999998 | C719: =RC[-2]-R1C1 -> 77.548000000000002 | D719: =RC[-2]-R1C2 -> 0.27589999999999998
A720: 80.516999999999996 | B720: 0.29060000000000002 | C720: =RC[-2]-R1C1 -> 77.655999999999992 | D720: =RC[-2]-R1C2 -> 0.27350000000000002
A721: 80.623999999999995 | B721: 0.28570000000000001 | C721: =RC[-2]-R1C1 -> 77.762999999999991 | D721: =RC[-2]-R1C2 -> 0.26860000000000001
A722: 80.731999999999999 | B722: 0.28570000000000001 | C722: =RC[-2]-R1C1 -> 77.870999999999995 | D722: =RC[-2]-R1C2 -> 0.26860000000000001
A723: 80.840999999999994 | B723: 0.28079999999999999 | C723: =RC[-2]-R1C1 -> 77.97999999999999 | D723: =RC[-2]-R1C2 -> 0.26369999999999999
A724: 80.948999999999998 | B724: 0.27839999999999998 | C724: =RC[-2]-R1C1 -> 78.087999999999994 | D724: =RC[-2]-R1C2 -> 0.26129999999999998
A725: 81.057000000000002 | B725: 0.27110000000000001 | C725: =RC[-2]-R1C1 -> 78.195999999999998 | D725: =RC[-2]-R1C2 -> 0.254
A726: 81.164000000000001 | B726: 0.27350000000000002 | C726: =RC[-2]-R1C1 -> 78.302999999999997 | D726: =RC[-2]-R1C2 -> 0.25640000000000002
A727: 81.272000000000006 | B727: 0.26619999999999999 | C727: =RC[-2]-R1C1 -> 78.411000000000001 | D727: =RC[-2]-R1C2 -> 0.24909999999999999
A728: 81.381 | B728: 0.26619999999999999 | C728: =RC[-2]-R1C1 -> 78.52 | D728: =RC[-2]-R1C2 -> 0.24909999999999999
A729: 81.489000000000004 | B729: 0.26129999999999998 | C729: =RC[-2]-R1C1 -> 78.628 | D729: =RC[-2]-R1C2 -> 0.24419999999999997
A730: 81.596999999999994 | B730: 0.26129999999999998 | C730: =RC[-2]-R1C1 -> 78.73599999999999 | D730: =RC[-2]-R1C2 -> 0.24419999999999997
A731: 81.703999999999994 | B731: 0.254 | C731: =RC[-2]-R1C1 -> 78.842999999999989 | D731: =RC[-2]-R1C2 -> 0.2369
A732: 81.811999999999998 | B732: 0.254 | C732: =RC[-2]-R1C1 -> 78.950999999999993 | D732: =RC[-2]-R1C2 -> 0.2369
A733: 81.921000000000006 | B733: 0.24909999999999999 | C733: =RC[-2]-R1C1 -> 79.06 | D733: =RC[-2]-R1C2 -> 0.23199999999999998
A734: 82.028999999999996 | B734: 0.24909999999999999 | C734: =RC[-2]-R1C1 -> 79.167999999999992 | D734: =RC[-2]-R1C2 -> 0.23199999999999998
A735: 82.137 | B735: 0.2442 | C735: =RC[-2]-R1C1 -> 79.275999999999996 | D735: =RC[-2]-R1C2 -> 0.2271
A736: 82.244 | B736: 0.24179999999999999 | C736: =RC[-2]-R1C1 -> 79.382999999999996 | D736: =RC[-2]-R1C2 -> 0.22469999999999998
A737: 82.352000000000004 | B737: 0.2369 | C737: =RC[-2]-R1C1 -> 79.491 | D737: =RC[-2]-R1C2 -> 0.2198
A738: 82.460999999999999 | B738: 0.2369 | C738: =RC[-2]-R1C1 -> 79.6 | D738: =RC[-2]-R1C2 -> 0.2198
A739: 82.569000000000003 | B739: 0.23200000000000001 | C739: =RC[-2]-R1C1 -> 79.707999999999998 | D739: =RC[-2]-R1C2 -> 0.21490000000000001
A740: 82.677000000000007 | B740: 0.23200000000000001 | C740: =RC[-2]-R1C1 -> 79.816000000000003 | D740: =RC[-2]-R1C2 -> 0.21490000000000001
A741: 82.784000000000006 | B741: 0.2271 | C741: =RC[-2]-R1C1 -> 79.923000000000002 | D741: =RC[-2]-R1C2 -> 0.21
A742: 82.891999999999996 | B742: 0.2271 | C742: =RC[-2]-R1C1 -> 80.030999999999992 | D742: =RC[-2]-R1C2 -> 0.21
A743: 82.998999999999995 | B743: 0.22220000000000001 | C743: =RC[-2]-R1C1 -> 80.137999999999991 | D743: =RC[-2]-R1C2 -> 0.2051
A744: 83.106999999999999 | B744: 0.22220000000000001 | C744: =RC[-2]-R1C1 -> 80.245999999999995 | D744: =RC[-2]-R1C2 -> 0.2051
A745: 83.215999999999994 | B745: 0.21729999999999999 | C745: =RC[-2]-R1C1 -> 80.35499999999999 | D745: =RC[-2]-R1C2 -> 0.20019999999999999
A746: 83.323999999999998 | B746: 0.21729999999999999 | C746: =RC[-2]-R1C1 -> 80.462999999999994 | D746: =RC[-2]-R1C2 -> 0.20019999999999999
A747: 83.432000000000002 | B747: 0.21249999999999999 | C747: =RC[-2]-R1C1 -> 80.570999999999998 | D747: =RC[-2]-R1C2 -> 0.19539999999999999
A748: 83.539000000000001 | B748: 0.21249999999999999 | C748: =RC[-2]-R1C1 -> 80.677999999999997 | D748: =RC[-2]-R1C2 -> 0.19539999999999999
A749: 83.647000000000006 | B749: 0.20760000000000001 | C749: =RC[-2]-R1C1 -> 80.786000000000001 | D749: =RC[-2]-R1C2 -> 0.1905
A750: 83.756 | B750: 0.20760000000000001 | C750: =RC[-2]-R1C1 -> 80.894999999999996 | D750: =RC[-2]-R1C2 -> 0.1905
A751: 83.864000000000004 | B751: 0.20269999999999999 | C751: =RC[-2]-R1C1 -> 81.003 | D751: =RC[-2]-R1C2 -> 0.18559999999999999
A752: 83.971999999999994 | B752: 0.20269999999999999 | C752: =RC[-2]-R1C1 -> 81.11099999999999 | D752: =RC[-2]-R1C2 -> 0.18559999999999999
A753: 84.078999999999994 | B753: 0.1978 | C753: =RC[-2]-R1C1 -> 81.217999999999989 | D753: =RC[-2]-R1C2 -> 0.1807
A754: 84.186999999999998 | B754: 0.1978 | C754: =RC[-2]-R1C1 -> 81.325999999999993 | D754: =RC[-2]-R1C2 -> 0.1807
A755: 84.296000000000006 | B755: 0.19289999999999999 | C755: =RC[-2]-R1C1 -> 81.435000000000002 | D755: =RC[-2]-R1C2 -> 0.17579999999999998
A756: 84.403999999999996 | B756: 0.19539999999999999 | C756: =RC[-2]-R1C1 -> 81.542999999999992 | D756: =RC[-2]-R1C2 -> 0.17829999999999999
A757: 84.512 | B757: 0.1905 | C757: =RC[-2]-R1C1 -> 81.650999999999996 | D757: =RC[-2]-R1C2 -> 0.1734
A758: 84.619 | B758: 0.188 | C758: =RC[-2]-R1C1 -> 81.757999999999996 | D758: =RC[-2]-R1C2 -> 0.1709
A759: 84.727000000000004 | B759: 0.18559999999999999 | C759: =RC[-2]-R1C1 -> 81.866 | D759: =RC[-2]-R1C2 -> 0.16849999999999998
A760: 84.835999999999999 | B760: 0.18559999999999999 | C760: =RC[-2]-R1C1 -> 81.974999999999994 | D760: =RC[-2]-R1C2 -> 0.16849999999999998
A761: 84.944000000000003 | B761: 0.1807 | C761: =RC[-2]-R1C1 -> 82.082999999999998 | D761: =RC[-2]-R1C2 -> 0.1636
A762: 85.052000000000007 | B762: 0.1807 | C762: =RC[-2]-R1C1 -> 82.191000000000003 | D762: =RC[-2]-R1C2 -> 0.1636
A763: 85.159000000000006 | B763: 0.17580000000000001 | C763: =RC[-2]-R1C1 -> 82.298000000000002 | D763: =RC[-2]-R1C2 -> 0.15870000000000001
A764: 85.266999999999996 | B764: 0.17829999999999999 | C764: =RC[-2]-R1C1 -> 82.405999999999992 | D764: =RC[-2]-R1C2 -> 0.16119999999999998
A765: 85.373999999999995 | B765: 0.1734 | C765: =RC[-2]-R1C1 -> 82.512999999999991 | D765: =RC[-2]-R1C2 -> 0.15629999999999999
A766: 85.481999999999999 | B766: 0.1734 | C766: =RC[-2]-R1C1 -> 82.620999999999995 | D766: =RC[-2]-R1C2 -> 0.15629999999999999
A767: 85.590999999999994 | B767: 0.1709 | C767: =RC[-2]-R1C1 -> 82.72999999999999 | D767: =RC[-2]-R1C2 -> 0.15379999999999999
A768: 85.698999999999998 | B768: 0.16850000000000001 | C768: =RC[-2]-R1C1 -> 82.837999999999994 | D768: =RC[-2]-R1C2 -> 0.15140000000000001
A769: 85.807000000000002 | B769: 0.1661 | C769: =RC[-2]-R1C1 -> 82.945999999999998 | D769: =RC[-2]-R1C2 -> 0.14899999999999999
A770: 85.914000000000001 | B770: 0.1636 | C770: =RC[-2]-R1C1 -> 83.052999999999997 | D770: =RC[-2]-R1C2 -> 0.14649999999999999
A771: 86.022000000000006 | B771: 0.1636 | C771: =RC[-2]-R1C1 -> 83.161000000000001 | D771: =RC[-2]-R1C2 -> 0.14649999999999999
A772: 86.131 | B772: 0.16120000000000001 | C772: =RC[-2]-R1C1 -> 83.27 | D772: =RC[-2]-R1C2 -> 0.14410000000000001
A773: 86.239000000000004 | B773: 0.15870000000000001 | C773: =RC[-2]-R1C1 -> 83.378 | D773: =RC[-2]-R1C2 -> 0.1416
A774: 86.346999999999994 | B774: 0.15870000000000001 | C774: =RC[-2]-R1C1 -> 83.48599999999999 | D774: =RC[-2]-R1C2 -> 0.1416
A775: 86.453999999999994 | B775: 0.15629999999999999 | C775: =RC[-2]-R1C1 -> 83.592999999999989 | D775: =RC[-2]-R1C2 -> 0.13919999999999999
A776: 86.561999999999998 | B776: 0.15629999999999999 | C776: =RC[-2]-R1C1 -> 83.700999999999993 | D776: =RC[-2]-R1C2 -> 0.13919999999999999
A777: 86.671000000000006 | B777: 0.15140000000000001 | C777: =RC[-2]-R1C1 -> 83.81 | D777: =RC[-2]-R1C2 -> 0.1343
A778: 86.778999999999996 | B778: 0.15140000000000001 | C778: =RC[-2]-R1C1 -> 83.917999999999992 | D778: =RC[-2]-R1C2 -> 0.1343
A779: 86.887 | B779: 0.14899999999999999 | C779: =RC[-2]-R1C1 -> 84.025999999999996 | D779: =RC[-2]-R1C2 -> 0.13189999999999999
A780: 86.994 | B780: 0.14899999999999999 | C780: =RC[-2]-R1C1 -> 84.132999999999996 | D780: =RC[-2]-R1C2 -> 0.13189999999999999
A781: 87.102000000000004 | B781: 0.14410000000000001 | C781: =RC[-2]-R1C1 -> 84.241 | D781: =RC[-2]-R1C2 -> 0.127
A782: 87.210999999999999 | B782: 0.14410000000000001 | C782: =RC[-2]-R1C1 -> 84.35 | D782: =RC[-2]-R1C2 -> 0.127
A783: 87.319000000000003 | B783: 0.1416 | C783: =RC[-2]-R1C1 -> 84.457999999999998 | D783: =RC[-2]-R1C2 -> 0.1245
A784: 87.427000000000007 | B784: 0.1416 | C784: =RC[-2]-R1C1 -> 84.566000000000003 | D784: =RC[-2]-R1C2 -> 0.1245
A785: 87.534000000000006 | B785: 0.13919999999999999 | C785: =RC[-2]-R1C1 -> 84.673000000000002 | D785: =RC[-2]-R1C2 -> 0.12209999999999999
A786: 87.641999999999996 | B786: 0.13919999999999999 | C786: =RC[-2]-R1C1 -> 84.780999999999992 | D786: =RC[-2]-R1C2 -> 0.12209999999999999
A787: 87.748999999999995 | B787: 0.1343 | C787: =RC[-2]-R1C1 -> 84.887999999999991 | D787: =RC[-2]-R1C2 -> 0.1172
A788: 87.856999999999999 | B788: 0.1368 | C788: =RC[-2]-R1C1 -> 84.995999999999995 | D788: =RC[-2]-R1C2 -> 0.1197
A789: 87.965999999999994 | B789: 0.13189999999999999 | C789: =RC[-2]-R1C1 -> 85.10499999999999 | D789: =RC[-2]-R1C2 -> 0.11479999999999999
A790: 88.073999999999998 | B790: 0.1343 | C790: =RC[-2]-R1C1 -> 85.212999999999994 | D790: =RC[-2]-R1C2 -> 0.1172
A791: 88.182000000000002 | B791: 0.12939999999999999 | C791: =RC[-2]-R1C1 -> 85.320999999999998 | D791: =RC[-2]-R1C2 -> 0.11229999999999998
A792: 88.289000000000001 | B792: 0.12939999999999999 | C792: =RC[-2]-R1C1 -> 85.427999999999997 | D792: =RC[-2]-R1C2 -> 0.11229999999999998
A793: 88.397000000000006 | B793: 0.127 | C793: =RC[-2]-R1C1 -> 85.536000000000001 | D793: =RC[-2]-R1C2 -> 0.1099
A794: 88.506 | B794: 0.127 | C794: =RC[-2]-R1C1 -> 85.644999999999996 | D794: =RC[-2]-R1C2 -> 0.1099
A795: 88.614000000000004 | B795: 0.1245 | C795: =RC[-2]-R1C1 -> 85.753 | D795: =RC[-2]-R1C2 -> 0.1074
A796: 88.721999999999994 | B796: 0.1245 | C796: =RC[-2]-R1C1 -> 85.86099999999999 | D796: =RC[-2]-R1C2 -> 0.1074
A797: 88.828999999999994 | B797: 0.1221 | C797: =RC[-2]-R1C1 -> 85.967999999999989 | D797: =RC[-2]-R1C2 -> 0.105
A798: 88.936999999999998 | B798: 0.1221 | C798: =RC[-2]-R1C1 -> 86.075999999999993 | D798: =RC[-2]-R1C2 -> 0.105
A799: 89.046000000000006 | B799: 0.1197 | C799: =RC[-2]-R1C1 -> 86.185000000000002 | D799: =RC[-2]-R1C2 -> 0.1026
A800: 89.153999999999996 | B800: 0.1197 | C800: =RC[-2]-R1C1 -> 86.292999999999992 | D800: =RC[-2]-R1C2 -> 0.1026
A801: 89.262 | B801: 0.1172 | C801: =RC[-2]-R1C1 -> 86.400999999999996 | D801: =RC[-2]-R1C2 -> 0.10009999999999999
A802: 89.369 | B802: 0.1172 | C802: =RC[-2]-R1C1 -> 86.507999999999996 | D802: =RC[-2]-R1C2 -> 0.10009999999999999
A803: 89.477000000000004 | B803: 0.1148 | C803: =RC[-2]-R1C1 -> 86.616 | D803: =RC[-2]-R1C2 -> 9.7699999999999995E-2
A804: 89.585999999999999 | B804: 0.1148 | C804: =RC[-2]-R1C1 -> 86.724999999999994 | D804: =RC[-2]-R1C2 -> 9.7699999999999995E-2
A805: 89.694000000000003 | B805: 0.1123 | C805: =RC[-2]-R1C1 -> 86.832999999999998 | D805: =RC[-2]-R1C2 -> 9.5199999999999993E-2
A806: 89.802000000000007 | B806: 0.1099 | C806: =RC[-2]-R1C1 -> 86.941000000000003 | D806: =RC[-2]-R1C2 -> 9.2799999999999994E-2
A807: 89.909000000000006 | B807: 0.1099 | C807: =RC[-2]-R1C1 -> 87.048000000000002 | D807: =RC[-2]-R1C2 -> 9.2799999999999994E-2
A808: 90.016999999999996 | B808: 0.1099 | C808: =RC[-2]-R1C1 -> 87.155999999999992 | D808: =RC[-2]-R1C2 -> 9.2799999999999994E-2
A809: 90.123999999999995 | B809: 0.1074 | C809: =RC[-2]-R1C1 -> 87.262999999999991 | D809: =RC[-2]-R1C2 -> 9.0299999999999991E-2
A810: 90.231999999999999 | B810: 0.1074 | C810: =RC[-2]-R1C1 -> 87.370999999999995 | D810: =RC[-2]-R1C2 -> 9.0299999999999991E-2
A811: 90.340999999999994 | B811: 0.105 | C811: =RC[-2]-R1C1 -> 87.47999999999999 | D811: =RC[-2]-R1C2 -> 8.7899999999999992E-2
A812: 90.448999999999998 | B812: 0.105 | C812: =RC[-2]-R1C1 -> 87.587999999999994 | D812: =RC[-2]-R1C2 -> 8.7899999999999992E-2
A813: 90.557000000000002 | B813: 0.1026 | C813: =RC[-2]-R1C1 -> 87.695999999999998 | D813: =RC[-2]-R1C2 -> 8.5499999999999993E-2
A814: 90.664000000000001 | B814: 0.1026 | C814: =RC[-2]-R1C1 -> 87.802999999999997 | D814: =RC[-2]-R1C2 -> 8.5499999999999993E-2
A815: 90.772000000000006 | B815: 0.10009999999999999 | C815: =RC[-2]-R1C1 -> 87.911000000000001 | D815: =RC[-2]-R1C2 -> 8.299999999999999E-2
A816: 90.881 | B816: 0.10009999999999999 | C816: =RC[-2]-R1C1 -> 88.02 | D816: =RC[-2]-R1C2 -> 8.299999999999999E-2
A817: 90.989000000000004 | B817: 9.7699999999999995E-2 | C817: =RC[-2]-R1C1 -> 88.128 | D817: =RC[-2]-R1C2 -> 8.0599999999999991E-2
A818: 91.096999999999994 | B818: 0.10009999999999999 | C818: =RC[-2]-R1C1 -> 88.23599999999999 | D818: =RC[-2]-R1C2 -> 8.299999999999999E-2
A819: 91.203999999999994 | B819: 9.7699999999999995E-2 | C819: =RC[-2]-R1C1 -> 88.342999999999989 | D819: =RC[-2]-R1C2 -> 8.0599999999999991E-2
A820: 91.311999999999998 | B820: 9.7699999999999995E-2 | C820: =RC[-2]-R1C1 -> 88.450999999999993 | D820: =RC[-2]-R1C2 -> 8.0599999999999991E-2
A821: 91.421000000000006 | B821: 9.5200000000000007E-2 | C821: =RC[-2]-R1C1 -> 88.56 | D821: =RC[-2]-R1C2 -> 7.8100000000000003E-2
A822: 91.528999999999996 | B822: 9.5200000000000007E-2 | C822: =RC[-2]-R1C1 -> 88.667999999999992 | D822: =RC[-2]-R1C2 -> 7.8100000000000003E-2
A823: 91.637 | B823: 9.2799999999999994E-2 | C823: =RC[-2]-R1C1 -> 88.775999999999996 | D823: =RC[-2]-R1C2 -> 7.569999999999999E-2
A824: 91.744 | B824: 9.2799999999999994E-2 | C824: =RC[-2]-R1C1 -> 88.882999999999996 | D824: =RC[-2]-R1C2 -> 7.569999999999999E-2
A825: 91.852000000000004 | B825: 9.0399999999999994E-2 | C825: =RC[-2]-R1C1 -> 88.991 | D825: =RC[-2]-R1C2 -> 7.329999999999999E-2
A826: 91.960999999999999 | B826: 9.0399999999999994E-2 | C826: =RC[-2]-R1C1 -> 89.1 | D826: =RC[-2]-R1C2 -> 7.329999999999999E-2
A827: 92.069000000000003 | B827: 9.0399999999999994E-2 | C827: =RC[-2]-R1C1 -> 89.207999999999998 | D827: =RC[-2]-R1C2 -> 7.329999999999999E-2
A828: 92.177000000000007 | B828: 8.7900000000000006E-2 | C828: =RC[-2]-R1C1 -> 89.316000000000003 | D828: =RC[-2]-R1C2 -> 7.0800000000000002E-2
A829: 92.284000000000006 | B829: 8.7900000000000006E-2 | C829: =RC[-2]-R1C1 -> 89.423000000000002 | D829: =RC[-2]-R1C2 -> 7.0800000000000002E-2
A830: 92.391999999999996 | B830: 8.7900000000000006E-2 | C830: =RC[-2]-R1C1 -> 89.530999999999992 | D830: =RC[-2]-R1C2 -> 7.0800000000000002E-2
A831: 92.498999999999995 | B831: 8.5500000000000007E-2 | C831: =RC[-2]-R1C1 -> 89.637999999999991 | D831: =RC[-2]-R1C2 -> 6.8400000000000002E-2
A832: 92.606999999999999 | B832: 8.5500000000000007E-2 | C832: =RC[-2]-R1C1 -> 89.745999999999995 | D832: =RC[-2]-R1C2 -> 6.8400000000000002E-2
A833: 92.715999999999994 | B833: 8.3000000000000004E-2 | C833: =RC[-2]-R1C1 -> 89.85499999999999 | D833: =RC[-2]-R1C2 -> 6.59E-2
A834: 92.823999999999998 | B834: 8.5500000000000007E-2 | C834: =RC[-2]-R1C1 -> 89.962999999999994 | D834: =RC[-2]-R1C2 -> 6.8400000000000002E-2
A835: 92.932000000000002 | B835: 8.0600000000000005E-2 | C835: =RC[-2]-R1C1 -> 90.070999999999998 | D835: =RC[-2]-R1C2 -> 6.3500000000000001E-2
A836: 93.039000000000001 | B836: 8.3000000000000004E-2 | C836: =RC[-2]-R1C1 -> 90.177999999999997 | D836: =RC[-2]-R1C2 -> 6.59E-2
A837: 93.147000000000006 | B837: 8.0600000000000005E-2 | C837: =RC[-2]-R1C1 -> 90.286000000000001 | D837: =RC[-2]-R1C2 -> 6.3500000000000001E-2
A838: 93.256 | B838: 8.0600000000000005E-2 | C838: =RC[-2]-R1C1 -> 90.394999999999996 | D838: =RC[-2]-R1C2 -> 6.3500000000000001E-2
A839: 93.364000000000004 | B839: 7.8100000000000003E-2 | C839: =RC[-2]-R1C1 -> 90.503 | D839: =RC[-2]-R1C2 -> 6.0999999999999999E-2
A840: 93.471999999999994 | B840: 8.0600000000000005E-2 | C840: =RC[-2]-R1C1 -> 90.61099999999999 | D840: =RC[-2]-R1C2 -> 6.3500000000000001E-2
A841: 93.578999999999994 | B841: 7.5700000000000003E-2 | C841: =RC[-2]-R1C1 -> 90.717999999999989 | D841: =RC[-2]-R1C2 -> 5.8599999999999999E-2
A842: 93.686999999999998 | B842: 7.8100000000000003E-2 | C842: =RC[-2]-R1C1 -> 90.825999999999993 | D842: =RC[-2]-R1C2 -> 6.0999999999999999E-2
A843: 93.796000000000006 | B843: 7.5700000000000003E-2 | C843: =RC[-2]-R1C1 -> 90.935000000000002 | D843: =RC[-2]-R1C2 -> 5.8599999999999999E-2
A844: 93.903999999999996 | B844: 7.5700000000000003E-2 | C844: =RC[-2]-R1C1 -> 91.042999999999992 | D844: =RC[-2]-R1C2 -> 5.8599999999999999E-2
A845: 94.012 | B845: 7.3300000000000004E-2 | C845: =RC[-2]-R1C1 -> 91.150999999999996 | D845: =RC[-2]-R1C2 -> 5.62E-2
A846: 94.119 | B846: 7.3300000000000004E-2 | C846: =RC[-2]-R1C1 -> 91.257999999999996 | D846: =RC[-2]-R1C2 -> 5.62E-2
A847: 94.227000000000004 | B847: 7.3300000000000004E-2 | C847: =RC[-2]-R1C1 -> 91.366 | D847: =RC[-2]-R1C2 -> 5.62E-2
A848: 94.335999999999999 | B848: 7.0800000000000002E-2 | C848: =RC[-2]-R1C1 -> 91.474999999999994 | D848: =RC[-2]-R1C2 -> 5.3699999999999998E-2
A849: 94.444000000000003 | B849: 7.0800000000000002E-2 | C849: =RC[-2]-R1C1 -> 91.582999999999998 | D849: =RC[-2]-R1C2 -> 5.3699999999999998E-2
A850: 94.552000000000007 | B850: 7.0800000000000002E-2 | C850: =RC[-2]-R1C1 -> 91.691000000000003 | D850: =RC[-2]-R1C2 -> 5.3699999999999998E-2
A851: 94.659000000000006 | B851: 7.0800000000000002E-2 | C851: =RC[-2]-R1C1 -> 91.798000000000002 | D851: =RC[-2]-R1C2 -> 5.3699999999999998E-2
A852: 94.766999999999996 | B852: 7.0800000000000002E-2 | C852: =RC[-2]-R1C1 -> 91.905999999999992 | D852: =RC[-2]-R1C2 -> 5.3699999999999998E-2
A853: 94.873999999999995 | B853: 6.8400000000000002E-2 | C853: =RC[-2]-R1C1 -> 92.012999999999991 | D853: =RC[-2]-R1C2 -> 5.1299999999999998E-2
A854: 94.981999999999999 | B854: 6.8400000000000002E-2 | C854: =RC[-2]-R1C1 -> 92.120999999999995 | D854: =RC[-2]-R1C2 -> 5.1299999999999998E-2
A855: 95.090999999999994 | B855: 6.59E-2 | C855: =RC[-2]-R1C1 -> 92.22999999999999 | D855: =RC[-2]-R1C2 -> 4.8799999999999996E-2
A856: 95.198999999999998 | B856: 6.59E-2 | C856: =RC[-2]-R1C1 -> 92.337999999999994 | D856: =RC[-2]-R1C2 -> 4.8799999999999996E-2
A857: 95.307000000000002 | B857: 6.59E-2 | C857: =RC[-2]-R1C1 -> 92.445999999999998 | D857: =RC[-2]-R1C2 -> 4.8799999999999996E-2
A858: 95.414000000000001 | B858: 6.59E-2 | C858: =RC[-2]-R1C1 -> 92.552999999999997 | D858: =RC[-2]-R1C2 -> 4.8799999999999996E-2
A859: 95.522000000000006 | B859: 6.59E-2 | C859: =RC[-2]-R1C1 -> 92.661000000000001 | D859: =RC[-2]-R1C2 -> 4.8799999999999996E-2
A860: 95.631 | B860: 6.3500000000000001E-2 | C860: =RC[-2]-R1C1 -> 92.77 | D860: =RC[-2]-R1C2 -> 4.6399999999999997E-2
A861: 95.739000000000004 | B861: 6.3500000000000001E-2 | C861: =RC[-2]-R1C1 -> 92.878 | D861: =RC[-2]-R1C2 -> 4.6399999999999997E-2
A862: 95.846999999999994 | B862: 6.3500000000000001E-2 | C862: =RC[-2]-R1C1 -> 92.98599999999999 | D862: =RC[-2]-R1C2 -> 4.6399999999999997E-2
A863: 95.953999999999994 | B863: 6.1100000000000002E-2 | C863: =RC[-2]-R1C1 -> 93.092999999999989 | D863: =RC[-2]-R1C2 -> 4.3999999999999997E-2
A864: 96.061999999999998 | B864: 6.1100000000000002E-2 | C864: =RC[-2]-R1C1 -> 93.200999999999993 | D864: =RC[-2]-R1C2 -> 4.3999999999999997E-2
A865: 96.171000000000006 | B865: 6.1100000000000002E-2 | C865: =RC[-2]-R1C1 -> 93.31 | D865: =RC[-2]-R1C2 -> 4.3999999999999997E-2
A866: 96.278999999999996 | B866: 6.1100000000000002E-2 | C866: =RC[-2]-R1C1 -> 93.417999999999992 | D866: =RC[-2]-R1C2 -> 4.3999999999999997E-2
A867: 96.387 | B867: 6.1100000000000002E-2 | C867: =RC[-2]-R1C1 -> 93.525999999999996 | D867: =RC[-2]-R1C2 -> 4.3999999999999997E-2
A868: 96.494 | B868: 6.1100000000000002E-2 | C868: =RC[-2]-R1C1 -> 93.632999999999996 | D868: =RC[-2]-R1C2 -> 4.3999999999999997E-2
A869: 96.602000000000004 | B869: 5.8599999999999999E-2 | C869: =RC[-2]-R1C1 -> 93.741 | D869: =RC[-2]-R1C2 -> 4.1499999999999995E-2
A870: 96.710999999999999 | B870: 5.8599999999999999E-2 | C870: =RC[-2]-R1C1 -> 93.85 | D870: =RC[-2]-R1C2 -> 4.1499999999999995E-2
A871: 96.819000000000003 | B871: 5.62E-2 | C871: =RC[-2]-R1C1 -> 93.957999999999998 | D871: =RC[-2]-R1C2 -> 3.9099999999999996E-2
A872: 96.927000000000007 | B872: 5.62E-2 | C872: =RC[-2]-R1C1 -> 94.066000000000003 | D872: =RC[-2]-R1C2 -> 3.9099999999999996E-2
A873: 97.034000000000006 | B873: 5.62E-2 | C873: =RC[-2]-R1C1 -> 94.173000000000002 | D873: =RC[-2]-R1C2 -> 3.9099999999999996E-2
A874: 97.141999999999996 | B874: 5.62E-2 | C874: =RC[-2]-R1C1 -> 94.280999999999992 | D874: =RC[-2]-R1C2 -> 3.9099999999999996E-2
A875: 97.248999999999995 | B875: 5.62E-2 | C875: =RC[-2]-R1C1 -> 94.387999999999991 | D875: =RC[-2]-R1C2 -> 3.9099999999999996E-2
A876: 97.356999999999999 | B876: 5.62E-2 | C876: =RC[-2]-R1C1 -> 94.495999999999995 | D876: =RC[-2]-R1C2 -> 3.9099999999999996E-2
A877: 97.465999999999994 | B877: 5.3699999999999998E-2 | C877: =RC[-2]-R1C1 -> 94.60499999999999 | D877: =RC[-2]-R1C2 -> 3.6599999999999994E-2
A878: 97.573999999999998 | B878: 5.3699999999999998E-2 | C878: =RC[-2]-R1C1 -> 94.712999999999994 | D878: =RC[-2]-R1C2 -> 3.6599999999999994E-2
A879: 97.682000000000002 | B879: 5.3699999999999998E-2 | C879: =RC[-2]-R1C1 -> 94.820999999999998 | D879: =RC[-2]-R1C2 -> 3.6599999999999994E-2
A880: 97.789000000000001 | B880: 5.3699999999999998E-2 | C880: =RC[-2]-R1C1 -> 94.927999999999997 | D880: =RC[-2]-R1C2 -> 3.6599999999999994E-2
A881: 97.897000000000006 | B881: 5.1299999999999998E-2 | C881: =RC[-2]-R1C1 -> 95.036000000000001 | D881: =RC[-2]-R1C2 -> 3.4199999999999994E-2
A882: 98.006 | B882: 5.1299999999999998E-2 | C882: =RC[-2]-R1C1 -> 95.144999999999996 | D882: =RC[-2]-R1C2 -> 3.4199999999999994E-2
A883: 98.114000000000004 | B883: 5.1299999999999998E-2 | C883: =RC[-2]-R1C1 -> 95.253 | D883: =RC[-2]-R1C2 -> 3.4199999999999994E-2
A884: 98.221999999999994 | B884: 5.1299999999999998E-2 | C884: =RC[-2]-R1C1 -> 95.36099999999999 | D884: =RC[-2]-R1C2 -> 3.4199999999999994E-2
A885: 98.328999999999994 | B885: 5.1299999999999998E-2 | C885: =RC[-2]-R1C1 -> 95.467999999999989 | D885: =RC[-2]-R1C2 -> 3.4199999999999994E-2
A886: 98.436999999999998 | B886: 5.1299999999999998E-2 | C886: =RC[-2]-R1C1 -> 95.575999999999993 | D886: =RC[-2]-R1C2 -> 3.4199999999999994E-2
A887: 98.546000000000006 | B887: 4.8800000000000003E-2 | C887: =RC[-2]-R1C1 -> 95.685000000000002 | D887: =RC[-2]-R1C2 -> 3.1700000000000006E-2
A888: 98.653999999999996 | B888: 4.8800000000000003E-2 | C888: =RC[-2]-R1C1 -> 95.792999999999992 | D888: =RC[-2]-R1C2 -> 3.1700000000000006E-2
A889: 98.762 | B889: 4.8800000000000003E-2 | C889: =RC[-2]-R1C1 -> 95.900999999999996 | D889: =RC[-2]-R1C2 -> 3.1700000000000006E-2
A890: 98.869 | B890: 4.8800000000000003E-2 | C890: =RC[-2]-R1C1 -> 96.007999999999996 | D890: =RC[-2]-R1C2 -> 3.1700000000000006E-2
A891: 98.977000000000004 | B891: 4.6399999999999997E-2 | C891: =RC[-2]-R1C1 -> 96.116 | D891: =RC[-2]-R1C2 -> 2.9299999999999996E-2
A892: 99.085999999999999 | B892: 4.8800000000000003E-2 | C892: =RC[-2]-R1C1 -> 96.224999999999994 | D892: =RC[-2]-R1C2 -> 3.1700000000000006E-2
A893: 99.194000000000003 | B893: 4.6399999999999997E-2 | C893: =RC[-2]-R1C1 -> 96.332999999999998 | D893: =RC[-2]-R1C2 -> 2.9299999999999996E-2
A894: 99.302000000000007 | B894: 4.6399999999999997E-2 | C894: =RC[-2]-R1C1 -> 96.441000000000003 | D894: =RC[-2]-R1C2 -> 2.9299999999999996E-2
A895: 99.409000000000006 | B895: 4.6399999999999997E-2 | C895: =RC[-2]-R1C1 -> 96.548000000000002 | D895: =RC[-2]-R1C2 -> 2.9299999999999996E-2
A896: 99.516999999999996 | B896: 4.6399999999999997E-2 | C896: =RC[-2]-R1C1 -> 96.655999999999992 | D896: =RC[-2]-R1C2 -> 2.9299999999999996E-2
A897: 99.623999999999995 | B897: 4.3999999999999997E-2 | C897: =RC[-2]-R1C1 -> 96.762999999999991 | D897: =RC[-2]-R1C2 -> 2.6899999999999997E-2
A898: 99.731999999999999 | B898: 4.3999999999999997E-2 | C898: =RC[-2]-R1C1 -> 96.870999999999995 | D898: =RC[-2]-R1C2 -> 2.6899999999999997E-2
A899: 99.840999999999994 | B899: 4.3999999999999997E-2 | C899: =RC[-2]-R1C1 -> 96.97999999999999 | D899: =RC[-2]-R1C2 -> 2.6899999999999997E-2
A900: 99.948999999999998 | B900: 4.3999999999999997E-2 | C900: =RC[-2]-R1C1 -> 97.087999999999994 | D900: =RC[-2]-R1C2 -> 2.6899999999999997E-2
A901: 100.057 | B901: 4.3999999999999997E-2 | C901: =RC[-2]-R1C1 -> 97.195999999999998 | D901: =RC[-2]-R1C2 -> 2.6899999999999997E-2
A902: 100.164 | B902: 4.3999999999999997E-2 | C902: =RC[-2]-R1C1 -> 97.302999999999997 | D902: =RC[-2]-R1C2 -> 2.6899999999999997E-2
A903: 100.27200000000001 | B903: 4.1500000000000002E-2 | C903: =RC[-2]-R1C1 -> 97.411000000000001 | D903: =RC[-2]-R1C2 -> 2.4400000000000002E-2
A904: 100.381 | B904: 4.1500000000000002E-2 | C904: =RC[-2]-R1C1 -> 97.52 | D904: =RC[-2]-R1C2 -> 2.4400000000000002E-2
A905: 100.489 | B905: 4.1500000000000002E-2 | C905: =RC[-2]-R1C1 -> 97.628 | D905: =RC[-2]-R1C2 -> 2.4400000000000002E-2
A906: 100.59699999999999 | B906: 4.1500000000000002E-2 | C906: =RC[-2]-R1C1 -> 97.73599999999999 | D906: =RC[-2]-R1C2 -> 2.4400000000000002E-2
A907: 100.70399999999999 | B907: 4.1500000000000002E-2 | C907: =RC[-2]-R1C1 -> 97.842999999999989 | D907: =RC[-2]-R1C2 -> 2.4400000000000002E-2
A908: 100.812 | B908: 4.1500000000000002E-2 | C908: =RC[-2]-R1C1 -> 97.950999999999993 | D908: =RC[-2]-R1C2 -> 2.4400000000000002E-2
A909: 100.92100000000001 | B909: 4.1500000000000002E-2 | C909: =RC[-2]-R1C1 -> 98.06 | D909: =RC[-2]-R1C2 -> 2.4400000000000002E-2
A910: 101.029 | B910: 4.1500000000000002E-2 | C910: =RC[-2]-R1C1 -> 98.167999999999992 | D910: =RC[-2]-R1C2 -> 2.4400000000000002E-2
A911: 101.137 | B911: 3.9100000000000003E-2 | C911: =RC[-2]-R1C1 -> 98.275999999999996 | D911: =RC[-2]-R1C2 -> 2.2000000000000002E-2
A912: 101.244 | B912: 3.9100000000000003E-2 | C912: =RC[-2]-R1C1 -> 98.382999999999996 | D912: =RC[-2]-R1C2 -> 2.2000000000000002E-2
A913: 101.352 | B913: 3.9100000000000003E-2 | C913: =RC[-2]-R1C1 -> 98.491 | D913: =RC[-2]-R1C2 -> 2.2000000000000002E-2
A914: 101.461 | B914: 3.9100000000000003E-2 | C914: =RC[-2]-R1C1 -> 98.6 | D914: =RC[-2]-R1C2 -> 2.2000000000000002E-2
A915: 101.569 | B915: 3.9100000000000003E-2 | C915: =RC[-2]-R1C1 -> 98.707999999999998 | D915: =RC[-2]-R1C2 -> 2.2000000000000002E-2
A916: 101.67700000000001 | B916: 3.6600000000000001E-2 | C916: =RC[-2]-R1C1 -> 98.816000000000003 | D916: =RC[-2]-R1C2 -> 1.95E-2
A917: 101.78400000000001 | B917: 3.6600000000000001E-2 | C917: =RC[-2]-R1C1 -> 98.923000000000002 | D917: =RC[-2]-R1C2 -> 1.95E-2
A918: 101.892 | B918: 3.6600000000000001E-2 | C918: =RC[-2]-R1C1 -> 99.030999999999992 | D918: =RC[-2]-R1C2 -> 1.95E-2
A919: 101.999 | B919: 3.6600000000000001E-2 | C919: =RC[-2]-R1C1 -> 99.137999999999991 | D919: =RC[-2]-R1C2 -> 1.95E-2
A920: 102.107 | B920: 3.6600000000000001E-2 | C920: =RC[-2]-R1C1 -> 99.245999999999995 | D920: =RC[-2]-R1C2 -> 1.95E-2
A921: 102.21599999999999 | B921: 3.6600000000000001E-2 | C921: =RC[-2]-R1C1 -> 99.35499999999999 | D921: =RC[-2]-R1C2 -> 1.95E-2
A922: 102.324 | B922: 3.6600000000000001E-2 | C922: =RC[-2]-R1C1 -> 99.462999999999994 | D922: =RC[-2]-R1C2 -> 1.95E-2
A923: 102.432 | B923: 3.6600000000000001E-2 | C923: =RC[-2]-R1C1 -> 99.570999999999998 | D923: =RC[-2]-R1C2 -> 1.95E-2
A924: 102.539 | B924: 3.6600000000000001E-2 | C924: =RC[-2]-R1C1 -> 99.677999999999997 | D924: =RC[-2]-R1C2 -> 1.95E-2
A925: 102.64700000000001 | B925: 3.4200000000000001E-2 | C925: =RC[-2]-R1C1 -> 99.786000000000001 | D925: =RC[-2]-R1C2 -> 1.7100000000000001E-2
A926: 102.756 | B926: 3.6600000000000001E-2 | C926: =RC[-2]-R1C1 -> 99.894999999999996 | D926: =RC[-2]-R1C2 -> 1.95E-2
A927: 102.864 | B927: 3.4200000000000001E-2 | C927: =RC[-2]-R1C1 -> 100.003 | D927: =RC[-2]-R1C2 -> 1.7100000000000001E-2
A928: 102.97199999999999 | B928: 3.4200000000000001E-2 | C928: =RC[-2]-R1C1 -> 100.11099999999999 | D928: =RC[-2]-R1C2 -> 1.7100000000000001E-2
A929: 103.07899999999999 | B929: 3.4200000000000001E-2 | C929: =RC[-2]-R1C1 -> 100.21799999999999 | D929: =RC[-2]-R1C2 -> 1.7100000000000001E-2
A930: 103.187 | B930: 3.4200000000000001E-2 | C930: =RC[-2]-R1C1 -> 100.32599999999999 | D930: =RC[-2]-R1C2 -> 1.7100000000000001E-2
A931: 103.29600000000001 | B931: 3.4200000000000001E-2 | C931: =RC[-2]-R1C1 -> 100.435 | D931: =RC[-2]-R1C2 -> 1.7100000000000001E-2
A932: 103.404 | B932: 3.4200000000000001E-2 | C932: =RC[-2]-R1C1 -> 100.54299999999999 | D932: =RC[-2]-R1C2 -> 1.7100000000000001E-2
A933: 103.512 | B933: 3.1699999999999999E-2 | C933: =RC[-2]-R1C1 -> 100.651 | D933: =RC[-2]-R1C2 -> 1.4599999999999998E-2
A934: 103.619 | B934: 3.1699999999999999E-2 | C934: =RC[-2]-R1C1 -> 100.758 | D934: =RC[-2]-R1C2 -> 1.4599999999999998E-2
A935: 103.727 | B935: 3.4200000000000001E-2 | C935: =RC[-2]-R1C1 -> 100.866 | D935: =RC[-2]-R1C2 -> 1.7100000000000001E-2
A936: 103.836 | B936: 3.1699999999999999E-2 | C936: =RC[-2]-R1C1 -> 100.97499999999999 | D936: =RC[-2]-R1C2 -> 1.4599999999999998E-2
A937: 103.944 | B937: 3.1699999999999999E-2 | C937: =RC[-2]-R1C1 -> 101.083 | D937: =RC[-2]-R1C2 -> 1.4599999999999998E-2
A938: 104.05200000000001 | B938: 3.1699999999999999E-2 | C938: =RC[-2]-R1C1 -> 101.191 | D938: =RC[-2]-R1C2 -> 1.4599999999999998E-2
A939: 104.15900000000001 | B939: 3.1699999999999999E-2 | C939: =RC[-2]-R1C1 -> 101.298 | D939: =RC[-2]-R1C2 -> 1.4599999999999998E-2
A940: 104.267 | B940: 3.1699999999999999E-2 | C940: =RC[-2]-R1C1 -> 101.40599999999999 | D940: =RC[-2]-R1C2 -> 1.4599999999999998E-2
A941: 104.374 | B941: 3.1699999999999999E-2 | C941: =RC[-2]-R1C1 -> 101.51299999999999 | D941: =RC[-2]-R1C2 -> 1.4599999999999998E-2
A942: 104.482 | B942: 2.93E-2 | C942: =RC[-2]-R1C1 -> 101.621 | D942: =RC[-2]-R1C2 -> 1.2199999999999999E-2
A943: 104.59099999999999 | B943: 2.93E-2 | C943: =RC[-2]-R1C1 -> 101.72999999999999 | D943: =RC[-2]-R1C2 -> 1.2199999999999999E-2
A944: 104.699 | B944: 2.93E-2 | C944: =RC[-2]-R1C1 -> 101.83799999999999 | D944: =RC[-2]-R1C2 -> 1.2199999999999999E-2
A945: 104.807 | B945: 2.93E-2 | C945: =RC[-2]-R1C1 -> 101.946 | D945: =RC[-2]-R1C2 -> 1.2199999999999999E-2
A946: 104.914 | B946: 2.93E-2 | C946: =RC[-2]-R1C1 -> 102.053 | D946: =RC[-2]-R1C2 -> 1.2199999999999999E-2
A947: 105.02200000000001 | B947: 2.93E-2 | C947: =RC[-2]-R1C1 -> 102.161 | D947: =RC[-2]-R1C2 -> 1.2199999999999999E-2
A948: 105.131 | B948: 2.93E-2 | C948: =RC[-2]-R1C1 -> 102.27 | D948: =RC[-2]-R1C2 -> 1.2199999999999999E-2
A949: 105.239 | B949: 2.93E-2 | C949: =RC[-2]-R1C1 -> 102.378 | D949: =RC[-2]-R1C2 -> 1.2199999999999999E-2
A950: 105.34699999999999 | B950: 2.93E-2 | C950: =RC[-2]-R1C1 -> 102.48599999999999 | D950: =RC[-2]-R1C2 -> 1.2199999999999999E-2
A951: 105.45399999999999 | B951: 2.93E-2 | C951: =RC[-2]-R1C1 -> 102.59299999999999 | D951: =RC[-2]-R1C2 -> 1.2199999999999999E-2
A952: 105.562 | B952: 2.69E-2 | C952: =RC[-2]-R1C1 -> 102.70099999999999 | D952: =RC[-2]-R1C2 -> 9.7999999999999997E-3
A953: 105.67100000000001 | B953: 2.93E-2 | C953: =RC[-2]-R1C1 -> 102.81 | D953: =RC[-2]-R1C2 -> 1.2199999999999999E-2
A954: 105.779 | B954: 2.93E-2 | C954: =RC[-2]-R1C1 -> 102.91799999999999 | D954: =RC[-2]-R1C2 -> 1.2199999999999999E-2
A955: 105.887 | B955: 2.69E-2 | C955: =RC[-2]-R1C1 -> 103.026 | D955: =RC[-2]-R1C2 -> 9.7999999999999997E-3
A956: 105.994 | B956: 2.69E-2 | C956: =RC[-2]-R1C1 -> 103.133 | D956: =RC[-2]-R1C2 -> 9.7999999999999997E-3
A957: 106.102 | B957: 2.69E-2 | C957: =RC[-2]-R1C1 -> 103.241 | D957: =RC[-2]-R1C2 -> 9.7999999999999997E-3
A958: 106.211 | B958: 2.69E-2 | C958: =RC[-2]-R1C1 -> 103.35 | D958: =RC[-2]-R1C2 -> 9.7999999999999997E-3
A959: 106.319 | B959: 2.69E-2 | C959: =RC[-2]-R1C1 -> 103.458 | D959: =RC[-2]-R1C2 -> 9.7999999999999997E-3
A960: 106.42700000000001 | B960: 2.69E-2 | C960: =RC[-2]-R1C1 -> 103.566 | D960: =RC[-2]-R1C2 -> 9.7999999999999997E-3
A961: 106.53400000000001 | B961: 2.69E-2 | C961: =RC[-2]-R1C1 -> 103.673 | D961: =RC[-2]-R1C2 -> 9.7999999999999997E-3
A962: 106.642 | B962: 2.4400000000000002E-2 | C962: =RC[-2]-R1C1 -> 103.78099999999999 | D962: =RC[-2]-R1C2 -> 7.3000000000000009E-3
A963: 106.749 | B963: 2.69E-2 | C963: =RC[-2]-R1C1 -> 103.88799999999999 | D963: =RC[-2]-R1C2 -> 9.7999999999999997E-3
A964: 106.857 | B964: 2.4400000000000002E-2 | C964: =RC[-2]-R1C1 -> 103.996 | D964: =RC[-2]-R1C2 -> 7.3000000000000009E-3
A965: 106.96599999999999 | B965: 2.69E-2 | C965: =RC[-2]-R1C1 -> 104.10499999999999 | D965: =RC[-2]-R1C2 -> 9.7999999999999997E-3
A966: 107.074 | B966: 2.69E-2 | C966: =RC[-2]-R1C1 -> 104.21299999999999 | D966: =RC[-2]-R1C2 -> 9.7999999999999997E-3
A967: 107.182 | B967: 2.69E-2 | C967: =RC[-2]-R1C1 -> 104.321 | D967: =RC[-2]-R1C2 -> 9.7999999999999997E-3
A968: 107.289 | B968: 2.69E-2 | C968: =RC[-2]-R1C1 -> 104.428 | D968: =RC[-2]-R1C2 -> 9.7999999999999997E-3
A969: 107.39700000000001 | B969: 2.4400000000000002E-2 | C969: =RC[-2]-R1C1 -> 104.536 | D969: =RC[-2]-R1C2 -> 7.3000000000000009E-3
A970: 107.506 | B970: 2.4400000000000002E-2 | C970: =RC[-2]-R1C1 -> 104.645 | D970: =RC[-2]-R1C2 -> 7.3000000000000009E-3
A971: 107.614 | B971: 2.4400000000000002E-2 | C971: =RC[-2]-R1C1 -> 104.753 | D971: =RC[-2]-R1C2 -> 7.3000000000000009E-3
A972: 107.72199999999999 | B972: 2.4400000000000002E-2 | C972: =RC[-2]-R1C1 -> 104.86099999999999 | D972: =RC[-2]-R1C2 -> 7.3000000000000009E-3
A973: 107.82899999999999 | B973: 2.4400000000000002E-2 | C973: =RC[-2]-R1C1 -> 104.96799999999999 | D973: =RC[-2]-R1C2 -> 7.3000000000000009E-3
A974: 107.937 | B974: 2.4400000000000002E-2 | C974: =RC[-2]-R1C1 -> 105.07599999999999 | D974: =RC[-2]-R1C2 -> 7.3000000000000009E-3
A975: 108.04600000000001 | B975: 2.4400000000000002E-2 | C975: =RC[-2]-R1C1 -> 105.185 | D975: =RC[-2]-R1C2 -> 7.3000000000000009E-3
A976: 108.154 | B976: 2.4400000000000002E-2 | C976: =RC[-2]-R1C1 -> 105.29299999999999 | D976: =RC[-2]-R1C2 -> 7.3000000000000009E-3
A977: 108.262 | B977: 2.1999999999999999E-2 | C977: =RC[-2]-R1C1 -> 105.401 | D977: =RC[-2]-R1C2 -> 4.8999999999999981E-3
A978: 108.369 | B978: 2.1999999999999999E-2 | C978: =RC[-2]-R1C1 -> 105.508 | D978: =RC[-2]-R1C2 -> 4.8999999999999981E-3
A979: 108.477 | B979: 2.1999999999999999E-2 | C979: =RC[-2]-R1C1 -> 105.616 | D979: =RC[-2]-R1C2 -> 4.8999999999999981E-3
A980: 108.586 | B980: 2.4400000000000002E-2 | C980: =RC[-2]-R1C1 -> 105.72499999999999 | D980: =RC[-2]-R1C2 -> 7.3000000000000009E-3
A981: 108.694 | B981: 2.1999999999999999E-2 | C981: =RC[-2]-R1C1 -> 105.833 | D981: =RC[-2]-R1C2 -> 4.8999999999999981E-3
A982: 108.80200000000001 | B982: 2.1999999999999999E-2 | C982: =RC[-2]-R1C1 -> 105.941 | D982: =RC[-2]-R1C2 -> 4.8999999999999981E-3
A983: 108.90900000000001 | B983: 2.1999999999999999E-2 | C983: =RC[-2]-R1C1 -> 106.048 | D983: =RC[-2]-R1C2 -> 4.8999999999999981E-3
A984: 109.017 | B984: 2.1999999999999999E-2 | C984: =RC[-2]-R1C1 -> 106.15599999999999 | D984: =RC[-2]-R1C2 -> 4.8999999999999981E-3
A985: 109.124 | B985: 2.1999999999999999E-2 | C985: =RC[-2]-R1C1 -> 106.26299999999999 | D985: =RC[-2]-R1C2 -> 4.8999999999999981E-3
A986: 109.232 | B986: 2.1999999999999999E-2 | C986: =RC[-2]-R1C1 -> 106.371 | D986: =RC[-2]-R1C2 -> 4.8999999999999981E-3
A987: 109.34099999999999 | B987: 2.1999999999999999E-2 | C987: =RC[-2]-R1C1 -> 106.47999999999999 | D987: =RC[-2]-R1C2 -> 4.8999999999999981E-3
A988: 109.449 | B988: 2.1999999999999999E-2 | C988: =RC[-2]-R1C1 -> 106.58799999999999 | D988: =RC[-2]-R1C2 -> 4.8999999999999981E-3
A989: 109.557 | B989: 2.1999999999999999E-2 | C989: =RC[-2]-R1C1 -> 106.696 | D989: =RC[-2]-R1C2 -> 4.8999999999999981E-3
A990: 109.664 | B990: 2.1999999999999999E-2 | C990: =RC[-2]-R1C1 -> 106.803 | D990: =RC[-2]-R1C2 -> 4.8999999999999981E-3
A991: 109.77200000000001 | B991: 2.1999999999999999E-2 | C991: =RC[-2]-R1C1 -> 106.911 | D991: =RC[-2]-R1C2 -> 4.8999999999999981E-3
A992: 109.881 | B992: 2.1999999999999999E-2 | C992: =RC[-2]-R1C1 -> 107.02 | D992: =RC[-2]-R1C2 -> 4.8999999999999981E-3
A993: 109.989 | B993: 2.1999999999999999E-2 | C993: =RC[-2]-R1C1 -> 107.128 | D993: =RC[-2]-R1C2 -> 4.8999999999999981E-3
A994: 110.09699999999999 | B994: 1.95E-2 | C994: =RC[-2]-R1C1 -> 107.23599999999999 | D994: =RC[-2]-R1C2 -> 2.3999999999999994E-3
A995: 110.20399999999999 | B995: 1.95E-2 | C995: =RC[-2]-R1C1 -> 107.34299999999999 | D995: =RC[-2]-R1C2 -> 2.3999999999999994E-3
A996: 110.312 | B996: 2.1999999999999999E-2 | C996: =RC[-2]-R1C1 -> 107.45099999999999 | D996: =RC[-2]-R1C2 -> 4.8999999999999981E-3
A997: 110.42100000000001 | B997: 1.95E-2 | C997: =RC[-2]-R1C1 -> 107.56 | D997: =RC[-2]-R1C2 -> 2.3999999999999994E-3
A998: 110.529 | B998: 2.1999999999999999E-2 | C998: =RC[-2]-R1C1 -> 107.66799999999999 | D998: =RC[-2]-R1C2 -> 4.8999999999999981E-3
A999: 110.637 | B999: 1.95E-2 | C999: =RC[-2]-R1C1 -> 107.776 | D999: =RC[-2]-R1C2 -> 2.3999999999999994E-3
A1000: 110.744 | B1000: 1.95E-2 | C1000: =RC[-2]-R1C1 -> 107.883 | D1000: =RC[-2]-R1C2 -> 2.3999999999999994E-3
A1001: 110.852 | B1001: 1.95E-2 | C1001: =RC[-2]-R1C1 -> 107.991 | D1001: =RC[-2]-R1C2 -> 2.3999999999999994E-3
A1002: 110.961 | B1002: 1.95E-2 | C1002: =RC[-2]-R1C1 -> 108.1 | D1002: =RC[-2]-R1C2 -> 2.3999999999999994E-3
A1003: 111.069 | B1003: 1.95E-2 | C1003: =RC[-2]-R1C1 -> 108.208 | D1003: =RC[-2]-R1C2 -> 2.3999999999999994E-3
A1004: 111.17700000000001 | B1004: 1.95E-2 | C1004: =RC[-2]-R1C1 -> 108.316 | D1004: =RC[-2]-R1C2 -> 2.3999999999999994E-3
A1005: 111.28400000000001 | B1005: 1.95E-2 | C1005: =RC[-2]-R1C1 -> 108.423 | D1005: =RC[-2]-R1C2 -> 2.3999999999999994E-3
A1006: 111.392 | B1006: 1.95E-2 | C1006: =RC[-2]-R1C1 -> 108.53099999999999 | D1006: =RC[-2]-R1C2 -> 2.3999999999999994E-3
A1007: 111.499 | B1007: 1.95E-2 | C1007: =RC[-2]-R1C1 -> 108.63799999999999 | D1007: =RC[-2]-R1C2 -> 2.3999999999999994E-3
A1008: 111.607 | B1008: 1.95E-2 | C1008: =RC[-2]-R1C1 -> 108.746 | D1008: =RC[-2]-R1C2 -> 2.3999999999999994E-3
A1009: 111.71599999999999 | B1009: 1.7100000000000001E-2 | C1009: =RC[-2]-R1C1 -> 108.85499999999999 | D1009: =RC[-2]-R1C2 -> 0
A1010: 111.824 | B1010: 1.7100000000000001E-2 | C1010: =RC[-2]-R1C1 -> 108.96299999999999 | D1010: =RC[-2]-R1C2 -> 0
A1011: 111.932 | B1011: 1.95E-2 | C1011: =RC[-2]-R1C1 -> 109.071 | D1011: =RC[-2]-R1C2 -> 2.3999999999999994E-3
A1012: 112.039 | B1012: 1.95E-2 | C1012: =RC[-2]-R1C1 -> 109.178 | D1012: =RC[-2]-R1C2 -> 2.3999999999999994E-3
A1013: 112.14700000000001 | B1013: 1.7100000000000001E-2 | C1013: =RC[-2]-R1C1 -> 109.286 | D1013: =RC[-2]-R1C2 -> 0
A1014: 112.256 | B1014: 1.7100000000000001E-2 | C1014: =RC[-2]-R1C1 -> 109.395 | D1014: =RC[-2]-R1C2 -> 0
A1015: 112.364 | B1015: 1.7100000000000001E-2 | C1015: =RC[-2]-R1C1 -> 109.503 | D1015: =RC[-2]-R1C2 -> 0
A1016: 112.47199999999999 | B1016: 1.95E-2 | C1016: =RC[-2]-R1C1 -> 109.61099999999999 | D1016: =RC[-2]-R1C2 -> 2.3999999999999994E-3
A1017: 112.57899999999999 | B1017: 1.7100000000000001E-2 | C1017: =RC[-2]-R1C1 -> 109.71799999999999 | D1017: =RC[-2]-R1C2 -> 0
A1018: 112.687 | B1018: 1.7100000000000001E-2 | C1018: =RC[-2]-R1C1 -> 109.82599999999999 | D1018: =RC[-2]-R1C2 -> 0
A1019: 112.79600000000001 | B1019: 1.7100000000000001E-2 | C1019: =RC[-2]-R1C1 -> 109.935 | D1019: =RC[-2]-R1C2 -> 0
A1020: 112.904 | B1020: 1.7100000000000001E-2 | C1020: =RC[-2]-R1C1 -> 110.04299999999999 | D1020: =RC[-2]-R1C2 -> 0
A1021: 113.012 | B1021: 1.7100000000000001E-2 | C1021: =RC[-2]-R1C1 -> 110.151 | D1021: =RC[-2]-R1C2 -> 0
A1022: 113.119 | B1022: 1.7100000000000001E-2 | C1022: =RC[-2]-R1C1 -> 110.258 | D1022: =RC[-2]-R1C2 -> 0
A1023: 113.227 | B1023: 1.7100000000000001E-2 | C1023: =RC[-2]-R1C1 -> 110.366 | D1023: =RC[-2]-R1C2 -> 0
A1024: 113.336 | B1024: 1.7100000000000001E-2 | C1024: =RC[-2]-R1C1 -> 110.47499999999999 | D1024: =RC[-2]-R1C2 -> 0
A1025: 113.444 | B1025: 1.7100000000000001E-2 | C1025: =RC[-2]-R1C1 -> 110.583 | D1025: =RC[-2]-R1C2 -> 0
A1026: 113.55200000000001 | B1026: 1.7100000000000001E-2 | C1026: =RC[-2]-R1C1 -> 110.691 | D1026: =RC[-2]-R1C2 -> 0
A1027: 113.65900000000001 | B1027: 1.7100000000000001E-2 | C1027: =RC[-2]-R1C1 -> 110.798 | D1027: =RC[-2]-R1C2 -> 0
A1028: 113.767 | B1028: 1.7100000000000001E-2 | C1028: =RC[-2]-R1C1 -> 110.90599999999999 | D1028: =RC[-2]-R1C2 -> 0
A1029: 113.874 | B1029: 1.7100000000000001E-2 | C1029: =RC[-2]-R1C1 -> 111.01299999999999 | D1029: =RC[-2]-R1C2 -> 0
A1030: 113.982 | B1030: 1.7100000000000001E-2 | C1030: =RC[-2]-R1C1 -> 111.121 | D1030: =RC[-2]-R1C2 -> 0
A1031: 114.09099999999999 | B1031: 1.7100000000000001E-2 | C1031: =RC[-2]-R1C1 -> 111.22999999999999 | D1031: =RC[-2]-R1C2 -> 0
A1032: 114.199 | B1032: 1.7100000000000001E-2 | C1032: =RC[-2]-R1C1 -> 111.33799999999999 | D1032: =RC[-2]-R1C2 -> 0
A1033: 114.307 | B1033: 1.7100000000000001E-2 | C1033: =RC[-2]-R1C1 -> 111.446 | D1033: =RC[-2]-R1C2 -> 0
A1034: 114.414 | B1034: 1.7100000000000001E-2 | C1034: =RC[-2]-R1C1 -> 111.553 | D1034: =RC[-2]-R1C2 -> 0
A1035: 114.52200000000001 | B1035: 1.7100000000000001E-2 | C1035: =RC[-2]-R1C1 -> 111.661 | D1035: =RC[-2]-R1C2 -> 0
A1036: 114.631 | B1036: 1.47E-2 | C1036: =RC[-2]-R1C1 -> 111.77 | D1036: =RC[-2]-R1C2 -> -2.4000000000000011E-3
A1037: 114.739 | B1037: 1.7100000000000001E-2 | C1037: =RC[-2]-R1C1 -> 111.878 | D1037: =RC[-2]-R1C2 -> 0
A1038: 114.84699999999999 | B1038: 1.7100000000000001E-2 | C1038: =RC[-2]-R1C1 -> 111.98599999999999 | D1038: =RC[-2]-R1C2 -> 0
A1039: 114.95399999999999 | B1039: 1.47E-2 | C1039: =RC[-2]-R1C1 -> 112.09299999999999 | D1039: =RC[-2]-R1C2 -> -2.4000000000000011E-3
A1040: 115.062 | B1040: 1.7100000000000001E-2 | C1040: =RC[-2]-R1C1 -> 112.20099999999999 | D1040: =RC[-2]-R1C2 -> 0
A1041: 115.17100000000001 | B1041: 1.7100000000000001E-2 | C1041: =RC[-2]-R1C1 -> 112.31 | D1041: =RC[-2]-R1C2 -> 0
A1042: 115.279 | B1042: 1.7100000000000001E-2 | C1042: =RC[-2]-R1C1 -> 112.41799999999999 | D1042: =RC[-2]-R1C2 -> 0
A1043: 115.387 | B1043: 1.47E-2 | C1043: =RC[-2]-R1C1 -> 112.526 | D1043: =RC[-2]-R1C2 -> -2.4000000000000011E-3
A1044: 115.494 | B1044: 1.47E-2 | C1044: =RC[-2]-R1C1 -> 112.633 | D1044: =RC[-2]-R1C2 -> -2.4000000000000011E-3
A1045: 115.602 | B1045: 1.7100000000000001E-2 | C1045: =RC[-2]-R1C1 -> 112.741 | D1045: =RC[-2]-R1C2 -> 0
A1046: 115.711 | B1046: 1.47E-2 | C1046: =RC[-2]-R1C1 -> 112.85 | D1046: =RC[-2]-R1C2 -> -2.4000000000000011E-3
A1047: 115.819 | B1047: 1.47E-2 | C1047: =RC[-2]-R1C1 -> 112.958 | D1047: =RC[-2]-R1C2 -> -2.4000000000000011E-3
A1048: 115.92700000000001 | B1048: 1.7100000000000001E-2 | C1048: =RC[-2]-R1C1 -> 113.066 | D1048: =RC[-2]-R1C2 -> 0
A1049: 116.03400000000001 | B1049: 1.47E-2 | C1049: =RC[-2]-R1C1 -> 113.173 | D1049: =RC[-2]-R1C2 -> -2.4000000000000011E-3
A1050: 116.142 | B1050: 1.47E-2 | C1050: =RC[-2]-R1C1 -> 113.28099999999999 | D1050: =RC[-2]-R1C2 -> -2.4000000000000011E-3
A1051: 116.249 | B1051: 1.47E-2 | C1051: =RC[-2]-R1C1 -> 113.38799999999999 | D1051: =RC[-2]-R1C2 -> -2.4000000000000011E-3
A1052: 116.357 | B1052: 1.47E-2 | C1052: =RC[-2]-R1C1 -> 113.496 | D1052: =RC[-2]-R1C2 -> -2.4000000000000011E-3
A1053: 116.46599999999999 | B1053: 1.7100000000000001E-2 | C1053: =RC[-2]-R1C1 -> 113.60499999999999 | D1053: =RC[-2]-R1C2 -> 0
A1054: 116.574 | B1054: 1.47E-2 | C1054: =RC[-2]-R1C1 -> 113.71299999999999 | D1054: =RC[-2]-R1C2 -> -2.4000000000000011E-3
A1055: 116.682 | B1055: 1.47E-2 | C1055: =RC[-2]-R1C1 -> 113.821 | D1055: =RC[-2]-R1C2 -> -2.4000000000000011E-3
A1056: 116.789 | B1056: 1.47E-2 | C1056: =RC[-2]-R1C1 -> 113.928 | D1056: =RC[-2]-R1C2 -> -2.4000000000000011E-3
A1057: 116.89700000000001 | B1057: 1.47E-2 | C1057: =RC[-2]-R1C1 -> 114.036 | D1057: =RC[-2]-R1C2 -> -2.4000000000000011E-3
A1058: 117.006 | B1058: 1.47E-2 | C1058: =RC[-2]-R1C1 -> 114.145 | D1058: =RC[-2]-R1C2 -> -2.4000000000000011E-3
A1059: 117.114 | B1059: 1.47E-2 | C1059: =RC[-2]-R1C1 -> 114.253 | D1059: =RC[-2]-R1C2 -> -2.4000000000000011E-3
A1060: 117.22199999999999 | B1060: 1.47E-2 | C1060: =RC[-2]-R1C1 -> 114.36099999999999 | D1060: =RC[-2]-R1C2 -> -2.4000000000000011E-3
A1061: 117.32899999999999 | B1061: 1.47E-2 | C1061: =RC[-2]-R1C1 -> 114.46799999999999 | D1061: =RC[-2]-R1C2 -> -2.4000000000000011E-3
A1062: 117.437 | B1062: 1.47E-2 | C1062: =RC[-2]-R1C1 -> 114.57599999999999 | D1062: =RC[-2]-R1C2 -> -2.4000000000000011E-3
A1063: 117.54600000000001 | B1063: 1.47E-2 | C1063: =RC[-2]-R1C1 -> 114.685 | D1063: =RC[-2]-R1C2 -> -2.4000000000000011E-3
A1064: 117.654 | B1064: 1.2200000000000001E-2 | C1064: =RC[-2]-R1C1 -> 114.79299999999999 | D1064: =RC[-2]-R1C2 -> -4.8999999999999998E-3
A1065: 117.762 | B1065: 1.47E-2 | C1065: =RC[-2]-R1C1 -> 114.901 | D1065: =RC[-2]-R1C2 -> -2.4000000000000011E-3
A1066: 117.869 | B1066: 1.47E-2 | C1066: =RC[-2]-R1C1 -> 115.008 | D1066: =RC[-2]-R1C2 -> -2.4000000000000011E-3
A1067: 117.977 | B1067: 1.2200000000000001E-2 | C1067: =RC[-2]-R1C1 -> 115.116 | D1067: =RC[-2]-R1C2 -> -4.8999999999999998E-3
A1068: 118.086 | B1068: 1.2200000000000001E-2 | C1068: =RC[-2]-R1C1 -> 115.22499999999999 | D1068: =RC[-2]-R1C2 -> -4.8999999999999998E-3
A1069: 118.194 | B1069: 1.47E-2 | C1069: =RC[-2]-R1C1 -> 115.333 | D1069: =RC[-2]-R1C2 -> -2.4000000000000011E-3
A1070: 118.30200000000001 | B1070: 1.2200000000000001E-2 | C1070: =RC[-2]-R1C1 -> 115.441 | D1070: =RC[-2]-R1C2 -> -4.8999999999999998E-3
A1071: 118.40900000000001 | B1071: 1.2200000000000001E-2 | C1071: =RC[-2]-R1C1 -> 115.548 | D1071: =RC[-2]-R1C2 -> -4.8999999999999998E-3
A1072: 118.517 | B1072: 1.47E-2 | C1072: =RC[-2]-R1C1 -> 115.65599999999999 | D1072: =RC[-2]-R1C2 -> -2.4000000000000011E-3
A1073: 118.624 | B1073: 1.47E-2 | C1073: =RC[-2]-R1C1 -> 115.76299999999999 | D1073: =RC[-2]-R1C2 -> -2.4000000000000011E-3
A1074: 118.732 | B1074: 1.47E-2 | C1074: =RC[-2]-R1C1 -> 115.871 | D1074: =RC[-2]-R1C2 -> -2.4000000000000011E-3
A1075: 118.84099999999999 | B1075: 1.2200000000000001E-2 | C1075: =RC[-2]-R1C1 -> 115.97999999999999 | D1075: =RC[-2]-R1C2 -> -4.8999999999999998E-3
A1076: 118.949 | B1076: 1.2200000000000001E-2 | C1076: =RC[-2]-R1C1 -> 116.08799999999999 | D1076: =RC[-2]-R1C2 -> -4.8999999999999998E-3
A1077: 119.057 | B1077: 1.47E-2 | C1077: =RC[-2]-R1C1 -> 116.196 | D1077: =RC[-2]-R1C2 -> -2.4000000000000011E-3
A1078: 119.164 | B1078: 1.2200000000000001E-2 | C1078: =RC[-2]-R1C1 -> 116.303 | D1078: =RC[-2]-R1C2 -> -4.8999999999999998E-3
A1079: 119.27200000000001 | B1079: 1.47E-2 | C1079: =RC[-2]-R1C1 -> 116.411 | D1079: =RC[-2]-R1C2 -> -2.4000000000000011E-3
A1080: 119.381 | B1080: 1.2200000000000001E-2 | C1080: =RC[-2]-R1C1 -> 116.52 | D1080: =RC[-2]-R1C2 -> -4.8999999999999998E-3
A1081: 119.489 | B1081: 1.2200000000000001E-2 | C1081: =RC[-2]-R1C1 -> 116.628 | D1081: =RC[-2]-R1C2 -> -4.8999999999999998E-3
A1082: 119.59699999999999 | B1082: 1.2200000000000001E-2 | C1082: =RC[-2]-R1C1 -> 116.73599999999999 | D1082: =RC[-2]-R1C2 -> -4.8999999999999998E-3
A1083: 119.70399999999999 | B1083: 1.2200000000000001E-2 | C1083: =RC[-2]-R1C1 -> 116.84299999999999 | D1083: =RC[-2]-R1C2 -> -4.8999999999999998E-3
A1084: 119.812 | B1084: 1.47E-2 | C1084: =RC[-2]-R1C1 -> 116.95099999999999 | D1084: =RC[-2]-R1C2 -> -2.4000000000000011E-3
A1085: 119.92100000000001 | B1085: 1.2200000000000001E-2 | C1085: =RC[-2]-R1C1 -> 117.06 | D1085: =RC[-2]-R1C2 -> -4.8999999999999998E-3
A1086: 120.029 | B1086: 1.47E-2 | C1086: =RC[-2]-R1C1 -> 117.16799999999999 | D1086: =RC[-2]-R1C2 -> -2.4000000000000011E-3
A1087: 120.137 | B1087: 1.2200000000000001E-2 | C1087: =RC[-2]-R1C1 -> 117.276 | D1087: =RC[-2]-R1C2 -> -4.8999999999999998E-3
A1088: 120.244 | B1088: 1.2200000000000001E-2 | C1088: =RC[-2]-R1C1 -> 117.383 | D1088: =RC[-2]-R1C2 -> -4.8999999999999998E-3
A1089: 120.352 | B1089: 1.2200000000000001E-2 | C1089: =RC[-2]-R1C1 -> 117.491 | D1089: =RC[-2]-R1C2 -> -4.8999999999999998E-3
A1090: 120.461 | B1090: 1.47E-2 | C1090: =RC[-2]-R1C1 -> 117.6 | D1090: =RC[-2]-R1C2 -> -2.4000000000000011E-3
A1091: 120.569 | B1091: 1.2200000000000001E-2 | C1091: =RC[-2]-R1C1 -> 117.708 | D1091: =RC[-2]-R1C2 -> -4.8999999999999998E-3
A1092: 120.67700000000001 | B1092: 1.2200000000000001E-2 | C1092: =RC[-2]-R1C1 -> 117.816 | D1092: =RC[-2]-R1C2 -> -4.8999999999999998E-3
A1093: 120.78400000000001 | B1093: 1.2200000000000001E-2 | C1093: =RC[-2]-R1C1 -> 117.923 | D1093: =RC[-2]-R1C2 -> -4.8999999999999998E-3
A1094: 120.892 | B1094: 1.2200000000000001E-2 | C1094: =RC[-2]-R1C1 -> 118.03099999999999 | D1094: =RC[-2]-R1C2 -> -4.8999999999999998E-3

Sheet: rc1-10173042
A1: 4.5999999999999999E-2 | B1: 7.3000000000000001E-3 | C1: 2.9767999999999999
A2: 0.154 | B2: 1.7100000000000001E-2 | C2: 2.9035000000000002
A3: 0.26300000000000001 | B3: 1.7100000000000001E-2 | C3: 2.9035000000000002
A4: 0.37 | B4: 9.5200000000000007E-2 | C4: 2.8277999999999999
A5: 0.47799999999999998 | B5: 9.5200000000000007E-2 | C5: 2.8302999999999998
A6: 0.58699999999999997 | B6: 0.1709 | C6: 2.7570000000000001
A7: 0.69499999999999995 | B7: 0.1734 | C7: 2.7570000000000001
A8: 0.80400000000000005 | B8: 0.2442 | C8: 2.6861999999999999
A9: 0.91100000000000003 | B9: 0.2442 | C9: 2.6861999999999999
A10: 1.0189999999999999 | B10: 0.31259999999999999 | C10: 2.6177999999999999
A11: 1.1279999999999999 | B11: 0.31259999999999999 | C11: 2.6177999999999999
A12: 1.236 | B12: 0.3785 | C12: 2.5518999999999998
A13: 1.345 | B13: 0.38100000000000001 | C13: 2.5518999999999998
A14: 1.452 | B14: 0.44690000000000002 | C14: 2.4883999999999999
A15: 1.56 | B15: 0.44690000000000002 | C15: 2.4883999999999999
A16: 1.669 | B16: 0.51039999999999996 | C16: 2.4274
A17: 1.7769999999999999 | B17: 0.51039999999999996 | C17: 2.4274
A18: 1.8859999999999999 | B18: 0.57140000000000002 | C18: 2.3687
A19: 1.9930000000000001 | B19: 0.57389999999999997 | C19: 2.3687
A20: 2.1019999999999999 | B20: 0.63249999999999995 | C20: 2.3077000000000001
A21: 2.2109999999999999 | B21: 0.63490000000000002 | C21: 2.3077000000000001
A22: 2.32 | B22: 0.69110000000000005 | C22: 2.2515000000000001
A23: 2.4289999999999998 | B23: 0.69110000000000005 | C23: 2.2515000000000001
A24: 2.536 | B24: 0.74970000000000003 | C24: 2.1953999999999998
A25: 2.6440000000000001 | B25: 0.74970000000000003 | C25: 2.1953999999999998
A26: 2.7530000000000001 | B26: 0.80589999999999995 | C26: 2.1415999999999999
A27: 2.8610000000000002 | B27: 0.80589999999999995 | C27: 2.1415999999999999
A28: 2.97 | B28: 0.85960000000000003 | C28: 2.0903999999999998
A29: 3.077 | B29: 0.86199999999999999 | C29: 2.0878999999999999
A30: 3.1859999999999999 | B30: 0.91090000000000004 | C30: 2.0366
A31: 3.2949999999999999 | B31: 0.9133 | C31: 2.0366
A32: 3.4039999999999999 | B32: 0.96460000000000001 | C32: 1.9878
A33: 3.5129999999999999 | B33: 0.96460000000000001 | C33: 1.9853000000000001
A34: 3.62 | B34: 1.0134000000000001 | C34: 1.9390000000000001
A35: 3.7280000000000002 | B35: 1.0134000000000001 | C35: 1.9390000000000001
A36: 3.8370000000000002 | B36: 1.0623 | C36: 1.8926000000000001
A37: 3.9449999999999998 | B37: 1.0623 | C37: 1.8926000000000001
A38: 4.0529999999999999 | B38: 1.1111 | C38: 1.8462000000000001
A39: 4.16 | B39: 1.1111 | C39: 1.8436999999999999
A40: 4.2690000000000001 | B40: 1.1575 | C40: 1.7998000000000001
A41: 4.3780000000000001 | B41: 1.1575 | C41: 1.7998000000000001
A42: 4.4870000000000001 | B42: 1.2015 | C42: 1.7558
A43: 4.5949999999999998 | B43: 1.2015 | C43: 1.7558
A44: 4.7030000000000003 | B44: 1.2454000000000001 | C44: 1.7118
A45: 4.8109999999999999 | B45: 1.2479 | C45: 1.7118
A46: 4.92 | B46: 1.2894000000000001 | C46: 1.6702999999999999
A47: 5.0279999999999996 | B47: 1.2918000000000001 | C47: 1.6702999999999999
A48: 5.1369999999999996 | B48: 1.3309 | C48: 1.6288
A49: 5.2439999999999998 | B49: 1.3309 | C49: 1.6313
A50: 5.3529999999999998 | B50: 1.37 | C50: 1.5896999999999999
A51: 5.4619999999999997 | B51: 1.37 | C51: 1.5896999999999999
A52: 5.5709999999999997 | B52: 1.4115 | C52: 1.5530999999999999
A53: 5.68 | B53: 1.4138999999999999 | C53: 1.5507
A54: 5.7880000000000003 | B54: 1.4480999999999999 | C54: 1.5165
A55: 5.8959999999999999 | B55: 1.4504999999999999 | C55: 1.514
A56: 6.0049999999999999 | B56: 1.4872000000000001 | C56: 1.4774
A57: 6.1130000000000004 | B57: 1.4872000000000001 | C57: 1.4774
A58: 6.2220000000000004 | B58: 1.5238 | C58: 1.4432
A59: 6.3289999999999997 | B59: 1.5238 | C59: 1.4432
A60: 6.4379999999999997 | B60: 1.5604 | C60: 1.409
A61: 6.5469999999999997 | B61: 1.5604 | C61: 1.4066000000000001
A62: 6.6559999999999997 | B62: 1.5946 | C62: 1.3748
A63: 6.7649999999999997 | B63: 1.5946 | C63: 1.3748
A64: 6.8730000000000002 | B64: 1.6288 | C64: 1.3407
A65: 6.9809999999999999 | B65: 1.6288 | C65: 1.3407
A66: 7.09 | B66: 1.663 | C66: 1.3065
A67: 7.1980000000000004 | B67: 1.663 | C67: 1.3065
A68: 7.3070000000000004 | B68: 1.6947000000000001 | C68: 1.2746999999999999
A69: 7.4139999999999997 | B69: 1.6947000000000001 | C69: 1.2746999999999999
A70: 7.5229999999999997 | B70: 1.7241 | C70: 1.2454000000000001
A71: 7.6319999999999997 | B71: 1.7264999999999999 | C71: 1.2454000000000001
A72: 7.7409999999999997 | B72: 1.7582 | C72: 1.2137
A73: 7.85 | B73: 1.7582 | C73: 1.2137
A74: 7.9569999999999999 | B74: 1.7850999999999999 | C74: 1.1843999999999999
A75: 8.0649999999999995 | B75: 1.7875000000000001 | C75: 1.1843999999999999
A76: 8.1739999999999995 | B76: 1.8144 | C76: 1.1575
A77: 8.282 | B77: 1.8144 | C77: 1.1575
A78: 8.391 | B78: 1.8436999999999999 | C78: 1.1306
A79: 8.4979999999999993 | B79: 1.8436999999999999 | C79: 1.1282000000000001
A80: 8.6069999999999993 | B80: 1.873 | C80: 1.1012999999999999
A81: 8.7159999999999993 | B81: 1.873 | C81: 1.1012999999999999
A82: 8.8249999999999993 | B82: 1.8974 | C82: 1.0769
A83: 8.9339999999999993 | B83: 1.8998999999999999 | C83: 1.0745
A84: 9.0410000000000004 | B84: 1.9242999999999999 | C84: 1.0501
A85: 9.1489999999999991 | B85: 1.9267000000000001 | C85: 1.0501
A86: 9.2579999999999991 | B86: 1.9512 | C86: 1.0232000000000001
A87: 9.3659999999999997 | B87: 1.9512 | C87: 1.0232000000000001
A88: 9.4749999999999996 | B88: 1.9756 | C88: 0.99880000000000002
A89: 9.5820000000000007 | B89: 1.9756 | C89: 0.99880000000000002
A90: 9.6910000000000007 | B90: 2 | C90: 0.9768
A91: 9.8 | B91: 2 | C91: 0.9768
A92: 9.9090000000000007 | B92: 2.0244 | C92: 0.95240000000000002
A93: 10.018000000000001 | B93: 2.0244 | C93: 0.95240000000000002
A94: 10.127000000000001 | B94: 2.0464000000000002 | C94: 0.9304
A95: 10.234999999999999 | B95: 2.0488 | C95: 0.92800000000000005
A96: 10.343999999999999 | B96: 2.0684 | C96: 0.90839999999999999
A97: 10.451000000000001 | B97: 2.0684 | C97: 0.90600000000000003
A98: 10.56 | B98: 2.0928 | C98: 0.88639999999999997
A99: 10.669 | B99: 2.0928 | C99: 0.88639999999999997
A100: 10.776999999999999 | B100: 2.1147999999999998 | C100: 0.86450000000000005
A101: 10.885999999999999 | B101: 2.1122999999999998 | C101: 0.8669
A102: 10.994 | B102: 2.1343000000000001 | C102: 0.84489999999999998
A103: 11.102 | B103: 2.1343000000000001 | C103: 0.84489999999999998
A104: 11.211 | B104: 2.1562999999999999 | C104: 0.82540000000000002
A105: 11.319000000000001 | B105: 2.1537999999999999 | C105: 0.82540000000000002
A106: 11.427 | B106: 2.1758000000000002 | C106: 0.80589999999999995
A107: 11.534000000000001 | B107: 2.1734 | C107: 0.80589999999999995
A108: 11.641999999999999 | B108: 2.1928999999999998 | C108: 0.7863
A109: 11.749000000000001 | B109: 2.1928999999999998 | C109: 0.7863
A110: 11.856999999999999 | B110: 2.2124999999999999 | C110: 0.76680000000000004
A111: 11.965999999999999 | B111: 2.2124999999999999 | C111: 0.76680000000000004
A112: 12.074 | B112: 2.2294999999999998 | C112: 0.74970000000000003
A113: 12.182 | B113: 2.2294999999999998 | C113: 0.74970000000000003
A114: 12.289 | B114: 2.2490999999999999 | C114: 0.73019999999999996
A115: 12.397 | B115: 2.2490999999999999 | C115: 0.73019999999999996
A116: 12.506 | B116: 2.2662 | C116: 0.71550000000000002
A117: 12.614000000000001 | B117: 2.2662 | C117: 0.71309999999999996
A118: 12.722 | B118: 2.2833000000000001 | C118: 0.69599999999999995
A119: 12.829000000000001 | B119: 2.2833000000000001 | C119: 0.69840000000000002
A120: 12.936999999999999 | B120: 2.3003999999999998 | C120: 0.68130000000000002
A121: 13.045999999999999 | B121: 2.3003999999999998 | C121: 0.68130000000000002
A122: 13.154 | B122: 2.3149999999999999 | C122: 0.66420000000000001
A123: 13.262 | B123: 2.3174999999999999 | C123: 0.66420000000000001
A124: 13.369 | B124: 2.3321000000000001 | C124: 0.64959999999999996
A125: 13.477 | B125: 2.3321000000000001 | C125: 0.64959999999999996
A126: 13.586 | B126: 2.3492000000000002 | C126: 0.63249999999999995
A127: 13.694000000000001 | B127: 2.3468 | C127: 0.63249999999999995
A128: 13.802 | B128: 2.3639000000000001 | C128: 0.61780000000000002
A129: 13.909000000000001 | B129: 2.3614000000000002 | C129: 0.61780000000000002
A130: 14.016999999999999 | B130: 2.3784999999999998 | C130: 0.60560000000000003
A131: 14.124000000000001 | B131: 2.3784999999999998 | C131: 0.60319999999999996
A132: 14.231999999999999 | B132: 2.3932000000000002 | C132: 0.58850000000000002
A133: 14.340999999999999 | B133: 2.3932000000000002 | C133: 0.58850000000000002
A134: 14.449 | B134: 2.4054000000000002 | C134: 0.57630000000000003
A135: 14.557 | B135: 2.4077999999999999 | C135: 0.57630000000000003
A136: 14.664 | B136: 2.42 | C136: 0.56169999999999998
A137: 14.772 | B137: 2.42 | C137: 0.56169999999999998
A138: 14.881 | B138: 2.4346999999999999 | C138: 0.54949999999999999
A139: 14.989000000000001 | B139: 2.4346999999999999 | C139: 0.54700000000000004
A140: 15.097 | B140: 2.4493 | C140: 0.53480000000000005
A141: 15.204000000000001 | B141: 2.4493 | C141: 0.53480000000000005
A142: 15.311999999999999 | B142: 2.4590999999999998 | C142: 0.52259999999999995
A143: 15.420999999999999 | B143: 2.4590999999999998 | C143: 0.52259999999999995
A144: 15.529 | B144: 2.4712999999999998 | C144: 0.51039999999999996
A145: 15.637 | B145: 2.4712999999999998 | C145: 0.51280000000000003
A146: 15.744 | B146: 2.4834999999999998 | C146: 0.50060000000000004
A147: 15.852 | B147: 2.4834999999999998 | C147: 0.49819999999999998
A148: 15.961 | B148: 2.4982000000000002 | C148: 0.4884
A149: 16.068999999999999 | B149: 2.4956999999999998 | C149: 0.4884
A150: 16.177 | B150: 2.5078999999999998 | C150: 0.47620000000000001
A151: 16.283999999999999 | B151: 2.5078999999999998 | C151: 0.47620000000000001
A152: 16.391999999999999 | B152: 2.5177 | C152: 0.46400000000000002
A153: 16.498999999999999 | B153: 2.5177 | C153: 0.46400000000000002
A154: 16.606999999999999 | B154: 2.5299 | C154: 0.45419999999999999
A155: 16.716000000000001 | B155: 2.5274999999999999 | C155: 0.45419999999999999
A156: 16.824000000000002 | B156: 2.5421 | C156: 0.44440000000000002
A157: 16.931999999999999 | B157: 2.5421 | C157: 0.44440000000000002
A158: 17.039000000000001 | B158: 2.5518999999999998 | C158: 0.43219999999999997
A159: 17.146999999999998 | B159: 2.5518999999999998 | C159: 0.43219999999999997
A160: 17.256 | B160: 2.5617000000000001 | C160: 0.42249999999999999
A161: 17.364000000000001 | B161: 2.5617000000000001 | C161: 0.42249999999999999
A162: 17.472000000000001 | B162: 2.5714000000000001 | C162: 0.41270000000000001
A163: 17.579000000000001 | B163: 2.5739000000000001 | C163: 0.41270000000000001
A164: 17.687000000000001 | B164: 2.5811999999999999 | C164: 0.40539999999999998
A165: 17.795999999999999 | B165: 2.5811999999999999 | C165: 0.40289999999999998
A166: 17.904 | B166: 2.5910000000000002 | C166: 0.39319999999999999
A167: 18.012 | B167: 2.5910000000000002 | C167: 0.39319999999999999
A168: 18.119 | B168: 2.6006999999999998 | C168: 0.38579999999999998
A169: 18.227 | B169: 2.6006999999999998 | C169: 0.38340000000000002
A170: 18.335999999999999 | B170: 2.6080999999999999 | C170: 0.37609999999999999
A171: 18.443999999999999 | B171: 2.6105 | C171: 0.37609999999999999
A172: 18.552 | B172: 2.6177999999999999 | C172: 0.36630000000000001
A173: 18.658999999999999 | B173: 2.6177999999999999 | C173: 0.36870000000000003
A174: 18.766999999999999 | B174: 2.6252 | C174: 0.35899999999999999
A175: 18.873999999999999 | B175: 2.6252 | C175: 0.35899999999999999
A176: 18.981999999999999 | B176: 2.6349 | C176: 0.34920000000000001
A177: 19.091000000000001 | B177: 2.6349 | C177: 0.34920000000000001
A178: 19.199000000000002 | B178: 2.6421999999999999 | C178: 0.34189999999999998
A179: 19.306999999999999 | B179: 2.6446999999999998 | C179: 0.34189999999999998
A180: 19.414000000000001 | B180: 2.6496 | C180: 0.33460000000000001
A181: 19.521999999999998 | B181: 2.6496 | C181: 0.33460000000000001
A182: 19.631 | B182: 2.6593 | C182: 0.32719999999999999
A183: 19.739000000000001 | B183: 2.6568999999999998 | C183: 0.32719999999999999
A184: 19.847000000000001 | B184: 2.6667000000000001 | C184: 0.31990000000000002
A185: 19.954000000000001 | B185: 2.6667000000000001 | C185: 0.31990000000000002
A186: 20.062000000000001 | B186: 2.6739999999999999 | C186: 0.31259999999999999
A187: 20.170999999999999 | B187: 2.6739999999999999 | C187: 0.31259999999999999
A188: 20.279 | B188: 2.6812999999999998 | C188: 0.30530000000000002
A189: 20.387 | B189: 2.6812999999999998 | C189: 0.30530000000000002
A190: 20.494 | B190: 2.6886000000000001 | C190: 0.2979
A191: 20.602 | B191: 2.6886000000000001 | C191: 0.3004
A192: 20.710999999999999 | B192: 2.6934999999999998 | C192: 0.29299999999999998
A193: 20.818999999999999 | B193: 2.6934999999999998 | C193: 0.29060000000000002
A194: 20.927 | B194: 2.7008999999999999 | C194: 0.28570000000000001
A195: 21.033999999999999 | B195: 2.7008999999999999 | C195: 0.28570000000000001
A196: 21.141999999999999 | B196: 2.7082000000000002 | C196: 0.28079999999999999
A197: 21.248999999999999 | B197: 2.7082000000000002 | C197: 0.27839999999999998
A198: 21.356999999999999 | B198: 2.7155 | C198: 0.27110000000000001
A199: 21.466000000000001 | B199: 2.7155 | C199: 0.27350000000000002
A200: 21.574000000000002 | B200: 2.7204000000000002 | C200: 0.26619999999999999
A201: 21.681999999999999 | B201: 2.7204000000000002 | C201: 0.26619999999999999
A202: 21.789000000000001 | B202: 2.7277 | C202: 0.26129999999999998
A203: 21.896999999999998 | B203: 2.7277 | C203: 0.26129999999999998
A204: 22.006 | B204: 2.7326000000000001 | C204: 0.254
A205: 22.114000000000001 | B205: 2.7326000000000001 | C205: 0.254
A206: 22.222000000000001 | B206: 2.7374999999999998 | C206: 0.24909999999999999
A207: 22.329000000000001 | B207: 2.7374999999999998 | C207: 0.24909999999999999
A208: 22.437000000000001 | B208: 2.7448000000000001 | C208: 0.2442
A209: 22.545999999999999 | B209: 2.7448000000000001 | C209: 0.24179999999999999
A210: 22.654 | B210: 2.7496999999999998 | C210: 0.2369
A211: 22.762 | B211: 2.7496999999999998 | C211: 0.2369
A212: 22.869 | B212: 2.7545999999999999 | C212: 0.23200000000000001
A213: 22.977 | B213: 2.7545999999999999 | C213: 0.23200000000000001
A214: 23.085999999999999 | B214: 2.7595000000000001 | C214: 0.2271
A215: 23.193999999999999 | B215: 2.7595000000000001 | C215: 0.2271
A216: 23.302 | B216: 2.7667999999999999 | C216: 0.22220000000000001
A217: 23.408999999999999 | B217: 2.7667999999999999 | C217: 0.22220000000000001
A218: 23.516999999999999 | B218: 2.7717000000000001 | C218: 0.21729999999999999
A219: 23.623999999999999 | B219: 2.7717000000000001 | C219: 0.21729999999999999
A220: 23.731999999999999 | B220: 2.7766000000000002 | C220: 0.21249999999999999
A221: 23.841000000000001 | B221: 2.7766000000000002 | C221: 0.21249999999999999
A222: 23.949000000000002 | B222: 2.7789999999999999 | C222: 0.20760000000000001
A223: 24.056999999999999 | B223: 2.7814000000000001 | C223: 0.20760000000000001
A224: 24.164000000000001 | B224: 2.7863000000000002 | C224: 0.20269999999999999
A225: 24.271999999999998 | B225: 2.7839 | C225: 0.20269999999999999
A226: 24.381 | B226: 2.7888000000000002 | C226: 0.1978
A227: 24.489000000000001 | B227: 2.7911999999999999 | C227: 0.1978
A228: 24.597000000000001 | B228: 2.7936999999999999 | C228: 0.19289999999999999
A229: 24.704000000000001 | B229: 2.7961 | C229: 0.19539999999999999
A230: 24.812000000000001 | B230: 2.7985000000000002 | C230: 0.1905
A231: 24.920999999999999 | B231: 2.7985000000000002 | C231: 0.188
A232: 25.029 | B232: 2.8033999999999999 | C232: 0.18559999999999999
A233: 25.137 | B233: 2.8033999999999999 | C233: 0.18559999999999999
A234: 25.244 | B234: 2.8058999999999998 | C234: 0.1807
A235: 25.352 | B235: 2.8083 | C235: 0.1807
A236: 25.460999999999999 | B236: 2.8107000000000002 | C236: 0.17580000000000001
A237: 25.568999999999999 | B237: 2.8107000000000002 | C237: 0.17829999999999999
A238: 25.677 | B238: 2.8155999999999999 | C238: 0.1734
A239: 25.783999999999999 | B239: 2.8155999999999999 | C239: 0.1734
A240: 25.891999999999999 | B240: 2.8180999999999998 | C240: 0.1709
A241: 25.998999999999999 | B241: 2.8205 | C241: 0.16850000000000001
A242: 26.106999999999999 | B242: 2.8205 | C242: 0.1661
A243: 26.216000000000001 | B243: 2.8205 | C243: 0.1636
A244: 26.324000000000002 | B244: 2.8254000000000001 | C244: 0.1636
A245: 26.431999999999999 | B245: 2.8277999999999999 | C245: 0.16120000000000001
A246: 26.539000000000001 | B246: 2.8302999999999998 | C246: 0.15870000000000001
A247: 26.646999999999998 | B247: 2.8302999999999998 | C247: 0.15870000000000001
A248: 26.756 | B248: 2.8327 | C248: 0.15629999999999999
A249: 26.864000000000001 | B249: 2.8327 | C249: 0.15629999999999999
A250: 26.972000000000001 | B250: 2.8376000000000001 | C250: 0.15140000000000001
A251: 27.079000000000001 | B251: 2.8376000000000001 | C251: 0.15140000000000001
A252: 27.187000000000001 | B252: 2.84 | C252: 0.14899999999999999
A253: 27.295999999999999 | B253: 2.84 | C253: 0.14899999999999999
A254: 27.404 | B254: 2.8424999999999998 | C254: 0.14410000000000001
A255: 27.512 | B255: 2.8449 | C255: 0.14410000000000001
A256: 27.619 | B256: 2.8449 | C256: 0.1416
A257: 27.727 | B257: 2.8449 | C257: 0.1416
A258: 27.835999999999999 | B258: 2.8498000000000001 | C258: 0.13919999999999999
A259: 27.943999999999999 | B259: 2.8498000000000001 | C259: 0.13919999999999999
A260: 28.052 | B260: 2.8546999999999998 | C260: 0.1343
A261: 28.158999999999999 | B261: 2.8498000000000001 | C261: 0.1368
A262: 28.266999999999999 | B262: 2.8546999999999998 | C262: 0.13189999999999999
A263: 28.373999999999999 | B263: 2.8546999999999998 | C263: 0.1343
A264: 28.481999999999999 | B264: 2.8595999999999999 | C264: 0.12939999999999999
A265: 28.591000000000001 | B265: 2.8595999999999999 | C265: 0.12939999999999999
A266: 28.699000000000002 | B266: 2.8645 | C266: 0.127
A267: 28.806999999999999 | B267: 2.8595999999999999 | C267: 0.127
A268: 28.914000000000001 | B268: 2.8645 | C268: 0.1245
A269: 29.021999999999998 | B269: 2.8645 | C269: 0.1245
A270: 29.131 | B270: 2.8668999999999998 | C270: 0.1221
A271: 29.239000000000001 | B271: 2.8668999999999998 | C271: 0.1221
A272: 29.347000000000001 | B272: 2.8694000000000002 | C272: 0.1197
A273: 29.454000000000001 | B273: 2.8694000000000002 | C273: 0.1197
A274: 29.562000000000001 | B274: 2.8717999999999999 | C274: 0.1172
A275: 29.670999999999999 | B275: 2.8717999999999999 | C275: 0.1172
A276: 29.779 | B276: 2.8742000000000001 | C276: 0.1148
A277: 29.887 | B277: 2.8742000000000001 | C277: 0.1148
A278: 29.994 | B278: 2.8791000000000002 | C278: 0.1123
A279: 30.102 | B279: 2.8767 | C279: 0.1099
A280: 30.210999999999999 | B280: 2.8791000000000002 | C280: 0.1099
A281: 30.318999999999999 | B281: 2.8791000000000002 | C281: 0.1099
A282: 30.427 | B282: 2.8816000000000002 | C282: 0.1074
A283: 30.533999999999999 | B283: 2.8816000000000002 | C283: 0.1074
A284: 30.641999999999999 | B284: 2.8839999999999999 | C284: 0.105
A285: 30.748999999999999 | B285: 2.8839999999999999 | C285: 0.105
A286: 30.856999999999999 | B286: 2.8864000000000001 | C286: 0.1026
A287: 30.966000000000001 | B287: 2.8864000000000001 | C287: 0.1026
A288: 31.074000000000002 | B288: 2.8889 | C288: 0.10009999999999999
A289: 31.181999999999999 | B289: 2.8889 | C289: 0.10009999999999999
A290: 31.289000000000001 | B290: 2.8889 | C290: 9.7699999999999995E-2
A291: 31.396999999999998 | B291: 2.8889 | C291: 0.10009999999999999
A292: 31.506 | B292: 2.8938000000000001 | C292: 9.7699999999999995E-2
A293: 31.614000000000001 | B293: 2.8913000000000002 | C293: 9.7699999999999995E-2
A294: 31.722000000000001 | B294: 2.8938000000000001 | C294: 9.5200000000000007E-2
A295: 31.829000000000001 | B295: 2.8961999999999999 | C295: 9.5200000000000007E-2
A296: 31.937000000000001 | B296: 2.8961999999999999 | C296: 9.2799999999999994E-2
A297: 32.045999999999999 | B297: 2.8961999999999999 | C297: 9.2799999999999994E-2
A298: 32.154000000000003 | B298: 2.8986999999999998 | C298: 9.0399999999999994E-2
A299: 32.262 | B299: 2.8986999999999998 | C299: 9.0399999999999994E-2
A300: 32.369 | B300: 2.9011 | C300: 9.0399999999999994E-2
A301: 32.476999999999997 | B301: 2.8986999999999998 | C301: 8.7900000000000006E-2
A302: 32.585999999999999 | B302: 2.9011 | C302: 8.7900000000000006E-2
A303: 32.694000000000003 | B303: 2.9035000000000002 | C303: 8.7900000000000006E-2
A304: 32.802 | B304: 2.9035000000000002 | C304: 8.5500000000000007E-2
A305: 32.908999999999999 | B305: 2.9035000000000002 | C305: 8.5500000000000007E-2
A306: 33.017000000000003 | B306: 2.9060000000000001 | C306: 8.3000000000000004E-2
A307: 33.124000000000002 | B307: 2.9060000000000001 | C307: 8.5500000000000007E-2
A308: 33.231999999999999 | B308: 2.9083999999999999 | C308: 8.0600000000000005E-2
A309: 33.341000000000001 | B309: 2.9083999999999999 | C309: 8.3000000000000004E-2
A310: 33.448999999999998 | B310: 2.9083999999999999 | C310: 8.0600000000000005E-2
A311: 33.557000000000002 | B311: 2.9083999999999999 | C311: 8.0600000000000005E-2
A312: 33.664000000000001 | B312: 2.9108999999999998 | C312: 7.8100000000000003E-2
A313: 33.771999999999998 | B313: 2.9108999999999998 | C313: 8.0600000000000005E-2
A314: 33.881 | B314: 2.9133 | C314: 7.5700000000000003E-2
A315: 33.988999999999997 | B315: 2.9133 | C315: 7.8100000000000003E-2
A316: 34.097000000000001 | B316: 2.9133 | C316: 7.5700000000000003E-2
A317: 34.204000000000001 | B317: 2.9133 | C317: 7.5700000000000003E-2
A318: 34.311999999999998 | B318: 2.9157999999999999 | C318: 7.3300000000000004E-2
A319: 34.420999999999999 | B319: 2.9157999999999999 | C319: 7.3300000000000004E-2
A320: 34.529000000000003 | B320: 2.9182000000000001 | C320: 7.3300000000000004E-2
A321: 34.637 | B321: 2.9182000000000001 | C321: 7.0800000000000002E-2
A322: 34.744 | B322: 2.9182000000000001 | C322: 7.0800000000000002E-2
A323: 34.851999999999997 | B323: 2.9205999999999999 | C323: 7.0800000000000002E-2
A324: 34.960999999999999 | B324: 2.9205999999999999 | C324: 7.0800000000000002E-2
A325: 35.069000000000003 | B325: 2.9182000000000001 | C325: 7.0800000000000002E-2
A326: 35.177 | B326: 2.9205999999999999 | C326: 6.8400000000000002E-2
A327: 35.283999999999999 | B327: 2.9205999999999999 | C327: 6.8400000000000002E-2
A328: 35.392000000000003 | B328: 2.9230999999999998 | C328: 6.59E-2
A329: 35.499000000000002 | B329: 2.9230999999999998 | C329: 6.59E-2
A330: 35.606999999999999 | B330: 2.9230999999999998 | C330: 6.59E-2
A331: 35.716000000000001 | B331: 2.9255 | C331: 6.59E-2
A332: 35.823999999999998 | B332: 2.9255 | C332: 6.59E-2
A333: 35.932000000000002 | B333: 2.9255 | C333: 6.3500000000000001E-2
A334: 36.039000000000001 | B334: 2.9279999999999999 | C334: 6.3500000000000001E-2
A335: 36.146999999999998 | B335: 2.9279999999999999 | C335: 6.3500000000000001E-2
A336: 36.256 | B336: 2.9279999999999999 | C336: 6.1100000000000002E-2
A337: 36.363999999999997 | B337: 2.9279999999999999 | C337: 6.1100000000000002E-2
A338: 36.472000000000001 | B338: 2.9279999999999999 | C338: 6.1100000000000002E-2
A339: 36.579000000000001 | B339: 2.9279999999999999 | C339: 6.1100000000000002E-2
A340: 36.686999999999998 | B340: 2.9304000000000001 | C340: 6.1100000000000002E-2
A341: 36.795999999999999 | B341: 2.9304000000000001 | C341: 6.1100000000000002E-2
A342: 36.904000000000003 | B342: 2.9304000000000001 | C342: 5.8599999999999999E-2
A343: 37.012 | B343: 2.9304000000000001 | C343: 5.8599999999999999E-2
A344: 37.119 | B344: 2.9327999999999999 | C344: 5.62E-2
A345: 37.226999999999997 | B345: 2.9327999999999999 | C345: 5.62E-2
A346: 37.335999999999999 | B346: 2.9327999999999999 | C346: 5.62E-2
A347: 37.444000000000003 | B347: 2.9327999999999999 | C347: 5.62E-2
A348: 37.552 | B348: 2.9327999999999999 | C348: 5.62E-2
A349: 37.658999999999999 | B349: 2.9327999999999999 | C349: 5.62E-2
A350: 37.767000000000003 | B350: 2.9377 | C350: 5.3699999999999998E-2
A351: 37.874000000000002 | B351: 2.9352999999999998 | C351: 5.3699999999999998E-2
A352: 37.981999999999999 | B352: 2.9377 | C352: 5.3699999999999998E-2
A353: 38.091000000000001 | B353: 2.9377 | C353: 5.3699999999999998E-2
A354: 38.198999999999998 | B354: 2.9377 | C354: 5.1299999999999998E-2
A355: 38.307000000000002 | B355: 2.9377 | C355: 5.1299999999999998E-2
A356: 38.414000000000001 | B356: 2.9377 | C356: 5.1299999999999998E-2
A357: 38.521999999999998 | B357: 2.9377 | C357: 5.1299999999999998E-2
A358: 38.631 | B358: 2.9426000000000001 | C358: 5.1299999999999998E-2
A359: 38.738999999999997 | B359: 2.9401999999999999 | C359: 5.1299999999999998E-2
A360: 38.847000000000001 | B360: 2.9426000000000001 | C360: 4.8800000000000003E-2
A361: 38.954000000000001 | B361: 2.9401999999999999 | C361: 4.8800000000000003E-2
A362: 39.061999999999998 | B362: 2.9426000000000001 | C362: 4.8800000000000003E-2
A363: 39.170999999999999 | B363: 2.9426000000000001 | C363: 4.8800000000000003E-2
A364: 39.279000000000003 | B364: 2.9426000000000001 | C364: 4.6399999999999997E-2
A365: 39.387 | B365: 2.9426000000000001 | C365: 4.8800000000000003E-2
A366: 39.494 | B366: 2.9426000000000001 | C366: 4.6399999999999997E-2
A367: 39.601999999999997 | B367: 2.9426000000000001 | C367: 4.6399999999999997E-2
A368: 39.710999999999999 | B368: 2.9426000000000001 | C368: 4.6399999999999997E-2
A369: 39.819000000000003 | B369: 2.9426000000000001 | C369: 4.6399999999999997E-2
A370: 39.927 | B370: 2.9451000000000001 | C370: 4.3999999999999997E-2
A371: 40.033999999999999 | B371: 2.9451000000000001 | C371: 4.3999999999999997E-2
A372: 40.142000000000003 | B372: 2.9474999999999998 | C372: 4.3999999999999997E-2
A373: 40.249000000000002 | B373: 2.9474999999999998 | C373: 4.3999999999999997E-2
A374: 40.356999999999999 | B374: 2.9474999999999998 | C374: 4.3999999999999997E-2
A375: 40.466000000000001 | B375: 2.9474999999999998 | C375: 4.3999999999999997E-2
A376: 40.573999999999998 | B376: 2.9474999999999998 | C376: 4.1500000000000002E-2
A377: 40.682000000000002 | B377: 2.9474999999999998 | C377: 4.1500000000000002E-2
A378: 40.789000000000001 | B378: 2.9474999999999998 | C378: 4.1500000000000002E-2
A379: 40.896999999999998 | B379: 2.9499 | C379: 4.1500000000000002E-2
A380: 41.006 | B380: 2.9474999999999998 | C380: 4.1500000000000002E-2
A381: 41.113999999999997 | B381: 2.9499 | C381: 4.1500000000000002E-2
A382: 41.222000000000001 | B382: 2.9499 | C382: 4.1500000000000002E-2
A383: 41.329000000000001 | B383: 2.9523999999999999 | C383: 4.1500000000000002E-2
A384: 41.436999999999998 | B384: 2.9499 | C384: 3.9100000000000003E-2
A385: 41.545999999999999 | B385: 2.9523999999999999 | C385: 3.9100000000000003E-2
A386: 41.654000000000003 | B386: 2.9523999999999999 | C386: 3.9100000000000003E-2
A387: 41.762 | B387: 2.9523999999999999 | C387: 3.9100000000000003E-2
A388: 41.869 | B388: 2.9523999999999999 | C388: 3.9100000000000003E-2
A389: 41.976999999999997 | B389: 2.9523999999999999 | C389: 3.6600000000000001E-2
A390: 42.085999999999999 | B390: 2.9523999999999999 | C390: 3.6600000000000001E-2
A391: 42.194000000000003 | B391: 2.9523999999999999 | C391: 3.6600000000000001E-2
A392: 42.302 | B392: 2.9523999999999999 | C392: 3.6600000000000001E-2
A393: 42.408999999999999 | B393: 2.9523999999999999 | C393: 3.6600000000000001E-2
A394: 42.517000000000003 | B394: 2.9523999999999999 | C394: 3.6600000000000001E-2
A395: 42.624000000000002 | B395: 2.9548000000000001 | C395: 3.6600000000000001E-2
A396: 42.731999999999999 | B396: 2.9548000000000001 | C396: 3.6600000000000001E-2
A397: 42.841000000000001 | B397: 2.9523999999999999 | C397: 3.6600000000000001E-2
A398: 42.948999999999998 | B398: 2.9548000000000001 | C398: 3.4200000000000001E-2
A399: 43.057000000000002 | B399: 2.9548000000000001 | C399: 3.6600000000000001E-2
A400: 43.164000000000001 | B400: 2.9573 | C400: 3.4200000000000001E-2
A401: 43.271999999999998 | B401: 2.9548000000000001 | C401: 3.4200000000000001E-2
A402: 43.381 | B402: 2.9573 | C402: 3.4200000000000001E-2
A403: 43.488999999999997 | B403: 2.9548000000000001 | C403: 3.4200000000000001E-2
A404: 43.597000000000001 | B404: 2.9573 | C404: 3.4200000000000001E-2
A405: 43.704000000000001 | B405: 2.9573 | C405: 3.4200000000000001E-2
A406: 43.811999999999998 | B406: 2.9597000000000002 | C406: 3.1699999999999999E-2
A407: 43.920999999999999 | B407: 2.9573 | C407: 3.1699999999999999E-2
A408: 44.029000000000003 | B408: 2.9573 | C408: 3.4200000000000001E-2
A409: 44.137 | B409: 2.9573 | C409: 3.1699999999999999E-2
A410: 44.244 | B410: 2.9573 | C410: 3.1699999999999999E-2
A411: 44.351999999999997 | B411: 2.9597000000000002 | C411: 3.1699999999999999E-2
A412: 44.460999999999999 | B412: 2.9573 | C412: 3.1699999999999999E-2
A413: 44.569000000000003 | B413: 2.9573 | C413: 3.1699999999999999E-2
A414: 44.677 | B414: 2.9597000000000002 | C414: 3.1699999999999999E-2
A415: 44.783999999999999 | B415: 2.9597000000000002 | C415: 2.93E-2
A416: 44.892000000000003 | B416: 2.9597000000000002 | C416: 2.93E-2
A417: 44.999000000000002 | B417: 2.9621 | C417: 2.93E-2
A418: 45.106999999999999 | B418: 2.9621 | C418: 2.93E-2
A419: 45.216000000000001 | B419: 2.9597000000000002 | C419: 2.93E-2
A420: 45.323999999999998 | B420: 2.9621 | C420: 2.93E-2
A421: 45.432000000000002 | B421: 2.9597000000000002 | C421: 2.93E-2
A422: 45.539000000000001 | B422: 2.9621 | C422: 2.93E-2
A423: 45.646999999999998 | B423: 2.9621 | C423: 2.93E-2
A424: 45.756 | B424: 2.9621 | C424: 2.93E-2
A425: 45.863999999999997 | B425: 2.9621 | C425: 2.69E-2
A426: 45.972000000000001 | B426: 2.9621 | C426: 2.93E-2
A427: 46.079000000000001 | B427: 2.9621 | C427: 2.93E-2
A428: 46.186999999999998 | B428: 2.9645999999999999 | C428: 2.69E-2
A429: 46.295999999999999 | B429: 2.9645999999999999 | C429: 2.69E-2
A430: 46.404000000000003 | B430: 2.9621 | C430: 2.69E-2
A431: 46.512 | B431: 2.9645999999999999 | C431: 2.69E-2
A432: 46.619 | B432: 2.9645999999999999 | C432: 2.69E-2
A433: 46.726999999999997 | B433: 2.9621 | C433: 2.69E-2
A434: 46.835999999999999 | B434: 2.9645999999999999 | C434: 2.69E-2
A435: 46.944000000000003 | B435: 2.9645999999999999 | C435: 2.4400000000000002E-2
A436: 47.052 | B436: 2.9645999999999999 | C436: 2.69E-2
A437: 47.158999999999999 | B437: 2.9645999999999999 | C437: 2.4400000000000002E-2
A438: 47.267000000000003 | B438: 2.9645999999999999 | C438: 2.69E-2
A439: 47.374000000000002 | B439: 2.9645999999999999 | C439: 2.69E-2
A440: 47.481999999999999 | B440: 2.9645999999999999 | C440: 2.69E-2
A441: 47.591000000000001 | B441: 2.9645999999999999 | C441: 2.69E-2
A442: 47.698999999999998 | B442: 2.9645999999999999 | C442: 2.4400000000000002E-2
A443: 47.807000000000002 | B443: 2.9670000000000001 | C443: 2.4400000000000002E-2
A444: 47.914000000000001 | B444: 2.9670000000000001 | C444: 2.4400000000000002E-2
A445: 48.021999999999998 | B445: 2.9645999999999999 | C445: 2.4400000000000002E-2
A446: 48.131 | B446: 2.9670000000000001 | C446: 2.4400000000000002E-2
A447: 48.238999999999997 | B447: 2.9670000000000001 | C447: 2.4400000000000002E-2
A448: 48.347000000000001 | B448: 2.9670000000000001 | C448: 2.4400000000000002E-2
A449: 48.454000000000001 | B449: 2.9670000000000001 | C449: 2.4400000000000002E-2
A450: 48.561999999999998 | B450: 2.9670000000000001 | C450: 2.1999999999999999E-2
A451: 48.670999999999999 | B451: 2.9670000000000001 | C451: 2.1999999999999999E-2
A452: 48.779000000000003 | B452: 2.9670000000000001 | C452: 2.1999999999999999E-2
A453: 48.887 | B453: 2.9670000000000001 | C453: 2.4400000000000002E-2
A454: 48.994 | B454: 2.9670000000000001 | C454: 2.1999999999999999E-2
A455: 49.101999999999997 | B455: 2.9695 | C455: 2.1999999999999999E-2
A456: 49.210999999999999 | B456: 2.9670000000000001 | C456: 2.1999999999999999E-2
A457: 49.319000000000003 | B457: 2.9695 | C457: 2.1999999999999999E-2
A458: 49.427 | B458: 2.9670000000000001 | C458: 2.1999999999999999E-2
A459: 49.533999999999999 | B459: 2.9670000000000001 | C459: 2.1999999999999999E-2
A460: 49.642000000000003 | B460: 2.9670000000000001 | C460: 2.1999999999999999E-2
A461: 49.749000000000002 | B461: 2.9695 | C461: 2.1999999999999999E-2
A462: 49.856999999999999 | B462: 2.9695 | C462: 2.1999999999999999E-2
A463: 49.966000000000001 | B463: 2.9695 | C463: 2.1999999999999999E-2
A464: 50.073999999999998 | B464: 2.9695 | C464: 2.1999999999999999E-2
A465: 50.182000000000002 | B465: 2.9695 | C465: 2.1999999999999999E-2
A466: 50.289000000000001 | B466: 2.9695 | C466: 2.1999999999999999E-2
A467: 50.396999999999998 | B467: 2.9719000000000002 | C467: 1.95E-2
A468: 50.506 | B468: 2.9719000000000002 | C468: 1.95E-2
A469: 50.613999999999997 | B469: 2.9695 | C469: 2.1999999999999999E-2
A470: 50.722000000000001 | B470: 2.9695 | C470: 1.95E-2
A471: 50.829000000000001 | B471: 2.9695 | C471: 2.1999999999999999E-2
A472: 50.936999999999998 | B472: 2.9695 | C472: 1.95E-2
A473: 51.045999999999999 | B473: 2.9695 | C473: 1.95E-2
A474: 51.154000000000003 | B474: 2.9719000000000002 | C474: 1.95E-2
A475: 51.262 | B475: 2.9719000000000002 | C475: 1.95E-2
A476: 51.369 | B476: 2.9719000000000002 | C476: 1.95E-2
A477: 51.476999999999997 | B477: 2.9719000000000002 | C477: 1.95E-2
A478: 51.585999999999999 | B478: 2.9719000000000002 | C478: 1.95E-2
A479: 51.694000000000003 | B479: 2.9719000000000002 | C479: 1.95E-2
A480: 51.802 | B480: 2.9719000000000002 | C480: 1.95E-2
A481: 51.908999999999999 | B481: 2.9719000000000002 | C481: 1.95E-2
A482: 52.017000000000003 | B482: 2.9719000000000002 | C482: 1.7100000000000001E-2
A483: 52.124000000000002 | B483: 2.9719000000000002 | C483: 1.7100000000000001E-2
A484: 52.231999999999999 | B484: 2.9719000000000002 | C484: 1.95E-2
A485: 52.341000000000001 | B485: 2.9719000000000002 | C485: 1.95E-2
A486: 52.448999999999998 | B486: 2.9719000000000002 | C486: 1.7100000000000001E-2
A487: 52.557000000000002 | B487: 2.9719000000000002 | C487: 1.7100000000000001E-2
A488: 52.664000000000001 | B488: 2.9719000000000002 | C488: 1.7100000000000001E-2
A489: 52.771999999999998 | B489: 2.9719000000000002 | C489: 1.95E-2
A490: 52.881 | B490: 2.9719000000000002 | C490: 1.7100000000000001E-2
A491: 52.988999999999997 | B491: 2.9719000000000002 | C491: 1.7100000000000001E-2
A492: 53.097000000000001 | B492: 2.9719000000000002 | C492: 1.7100000000000001E-2
A493: 53.204000000000001 | B493: 2.9719000000000002 | C493: 1.7100000000000001E-2
A494: 53.311999999999998 | B494: 2.9719000000000002 | C494: 1.7100000000000001E-2
A495: 53.420999999999999 | B495: 2.9744000000000002 | C495: 1.7100000000000001E-2
A496: 53.529000000000003 | B496: 2.9744000000000002 | C496: 1.7100000000000001E-2
A497: 53.637 | B497: 2.9719000000000002 | C497: 1.7100000000000001E-2
A498: 53.744 | B498: 2.9744000000000002 | C498: 1.7100000000000001E-2
A499: 53.851999999999997 | B499: 2.9744000000000002 | C499: 1.7100000000000001E-2
A500: 53.960999999999999 | B500: 2.9744000000000002 | C500: 1.7100000000000001E-2
A501: 54.069000000000003 | B501: 2.9744000000000002 | C501: 1.7100000000000001E-2
A502: 54.177 | B502: 2.9744000000000002 | C502: 1.7100000000000001E-2
A503: 54.283999999999999 | B503: 2.9744000000000002 | C503: 1.7100000000000001E-2
A504: 54.392000000000003 | B504: 2.9744000000000002 | C504: 1.7100000000000001E-2
A505: 54.499000000000002 | B505: 2.9744000000000002 | C505: 1.7100000000000001E-2
A506: 54.606999999999999 | B506: 2.9744000000000002 | C506: 1.7100000000000001E-2
A507: 54.716000000000001 | B507: 2.9744000000000002 | C507: 1.7100000000000001E-2
A508: 54.823999999999998 | B508: 2.9744000000000002 | C508: 1.7100000000000001E-2
A509: 54.932000000000002 | B509: 2.9744000000000002 | C509: 1.47E-2
A510: 55.039000000000001 | B510: 2.9744000000000002 | C510: 1.7100000000000001E-2
A511: 55.146999999999998 | B511: 2.9744000000000002 | C511: 1.7100000000000001E-2
A512: 55.256 | B512: 2.9767999999999999 | C512: 1.47E-2
A513: 55.363999999999997 | B513: 2.9767999999999999 | C513: 1.7100000000000001E-2
A514: 55.472000000000001 | B514: 2.9744000000000002 | C514: 1.7100000000000001E-2
A515: 55.579000000000001 | B515: 2.9744000000000002 | C515: 1.7100000000000001E-2
A516: 55.686999999999998 | B516: 2.9744000000000002 | C516: 1.47E-2
A517: 55.795999999999999 | B517: 2.9744000000000002 | C517: 1.47E-2
A518: 55.904000000000003 | B518: 2.9767999999999999 | C518: 1.7100000000000001E-2
A519: 56.012 | B519: 2.9744000000000002 | C519: 1.47E-2
A520: 56.119 | B520: 2.9767999999999999 | C520: 1.47E-2
A521: 56.226999999999997 | B521: 2.9767999999999999 | C521: 1.7100000000000001E-2
A522: 56.335999999999999 | B522: 2.9767999999999999 | C522: 1.47E-2
A523: 56.444000000000003 | B523: 2.9767999999999999 | C523: 1.47E-2
A524: 56.552 | B524: 2.9767999999999999 | C524: 1.47E-2
A525: 56.658999999999999 | B525: 2.9767999999999999 | C525: 1.47E-2
A526: 56.767000000000003 | B526: 2.9767999999999999 | C526: 1.7100000000000001E-2
A527: 56.874000000000002 | B527: 2.9767999999999999 | C527: 1.47E-2
A528: 56.981999999999999 | B528: 2.9767999999999999 | C528: 1.47E-2
A529: 57.091000000000001 | C529: 1.47E-2
A530: 57.198999999999998 | C530: 1.47E-2
A531: 57.307000000000002 | C531: 1.47E-2
A532: 57.414000000000001 | C532: 1.47E-2
A533: 57.521999999999998 | C533: 1.47E-2
A534: 57.631 | C534: 1.47E-2
A535: 57.738999999999997 | C535: 1.47E-2
A536: 57.847000000000001 | C536: 1.47E-2
A537: 57.954000000000001 | C537: 1.2200000000000001E-2
A538: 58.061999999999998 | C538: 1.47E-2
A539: 58.170999999999999 | C539: 1.47E-2
A540: 58.279000000000003 | C540: 1.2200000000000001E-2
A541: 58.387 | C541: 1.2200000000000001E-2
A542: 58.494 | C542: 1.47E-2
A543: 58.601999999999997 | C543: 1.2200000000000001E-2
A544: 58.710999999999999 | C544: 1.2200000000000001E-2
A545: 58.819000000000003 | C545: 1.47E-2
A546: 58.927 | C546: 1.47E-2
A547: 59.033999999999999 | C547: 1.47E-2
A548: 59.142000000000003 | C548: 1.2200000000000001E-2
A549: 59.249000000000002 | C549: 1.2200000000000001E-2
A550: 59.356999999999999 | C550: 1.47E-2
A551: 59.466000000000001 | C551: 1.2200000000000001E-2
A552: 59.573999999999998 | C552: 1.47E-2
A553: 59.682000000000002 | C553: 1.2200000000000001E-2
A554: 59.789000000000001 | C554: 1.2200000000000001E-2
A555: 59.896999999999998 | C555: 1.2200000000000001E-2
A556: 60.006 | C556: 1.2200000000000001E-2
A557: 60.113999999999997 | C557: 1.47E-2
A558: 60.222000000000001 | C558: 1.2200000000000001E-2
A559: 60.329000000000001 | C559: 1.47E-2
A560: 60.436999999999998 | C560: 1.2200000000000001E-2
A561: 60.545999999999999 | C561: 1.2200000000000001E-2
A562: 60.654000000000003 | C562: 1.2200000000000001E-2
A563: 60.762 | C563: 1.47E-2
A564: 60.869 | C564: 1.2200000000000001E-2
A565: 60.976999999999997 | C565: 1.2200000000000001E-2
A566: 61.085999999999999 | C566: 1.2200000000000001E-2
A567: 61.194000000000003 | C567: 1.2200000000000001E-2
A568: 61.302
A569: 61.408999999999999
A570: 61.517000000000003
A571: 61.624000000000002
A572: 61.731999999999999
A573: 61.841000000000001
A574: 61.948999999999998
A575: 62.057000000000002
A576: 62.164000000000001
A577: 62.271999999999998
A578: 62.381
A579: 62.488999999999997
A580: 62.597000000000001
A581: 62.704000000000001
A582: 62.811999999999998
A583: 62.920999999999999
A584: 63.029000000000003
A585: 63.137
A586: 63.244
A587: 63.351999999999997
A588: 63.460999999999999
A589: 63.569000000000003
A590: 63.677
A591: 63.783999999999999
A592: 63.892000000000003
A593: 63.999000000000002
A594: 64.106999999999999
A595: 64.215999999999994
A596: 64.323999999999998
A597: 64.432000000000002
A598: 64.539000000000001
A599: 64.647000000000006
A600: 64.756
A601: 64.864000000000004
A602: 64.971999999999994
A603: 65.078999999999994
A604: 65.186999999999998
A605: 65.296000000000006
A606: 65.403999999999996
A607: 65.512
A608: 65.619
A609: 65.727000000000004
A610: 65.835999999999999
A611: 65.944000000000003
A612: 66.052000000000007
A613: 66.159000000000006
A614: 66.266999999999996
A615: 66.373999999999995
A616: 66.481999999999999
A617: 66.590999999999994
A618: 66.698999999999998
A619: 66.807000000000002
A620: 66.914000000000001
A621: 67.022000000000006
A622: 67.131
A623: 67.239000000000004
A624: 67.346999999999994
A625: 67.453999999999994
A626: 67.561999999999998
A627: 67.671000000000006
A628: 67.778999999999996
A629: 67.887
A630: 67.994
A631: 68.102000000000004
A632: 68.210999999999999
A633: 68.319000000000003
A634: 68.427000000000007
A635: 68.534000000000006
A636: 68.641999999999996
A637: 68.748999999999995
A638: 68.856999999999999
A639: 68.965999999999994
A640: 69.073999999999998
A641: 69.182000000000002
A642: 69.289000000000001
A643: 69.397000000000006
A644: 69.506
A645: 69.614000000000004
A646: 69.721999999999994
A647: 69.828999999999994
A648: 69.936999999999998
A649: 70.046000000000006
A650: 70.153999999999996
A651: 70.262
A652: 70.369
A653: 70.477000000000004
A654: 70.585999999999999
A655: 70.694000000000003
A656: 70.802000000000007
A657: 70.909000000000006
A658: 71.016999999999996
A659: 71.123999999999995
A660: 71.231999999999999
A661: 71.340999999999994
A662: 71.448999999999998
A663: 71.557000000000002
A664: 71.664000000000001
A665: 71.772000000000006
A666: 71.881
A667: 71.989000000000004
A668: 72.096999999999994
A669: 72.203999999999994
A670: 72.311999999999998
A671: 72.421000000000006
A672: 72.528999999999996
A673: 72.637
A674: 72.744
A675: 72.852000000000004
A676: 72.960999999999999
A677: 73.069000000000003
A678: 73.177000000000007
A679: 73.284000000000006
A680: 73.391999999999996
A681: 73.498999999999995
A682: 73.606999999999999
A683: 73.715999999999994
A684: 73.823999999999998
A685: 73.932000000000002
A686: 74.039000000000001
A687: 74.147000000000006
A688: 74.256
A689: 74.364000000000004
A690: 74.471999999999994
A691: 74.578999999999994
A692: 74.686999999999998
A693: 74.796000000000006
A694: 74.903999999999996
A695: 75.012
A696: 75.119
A697: 75.227000000000004
A698: 75.335999999999999
A699: 75.444000000000003
A700: 75.552000000000007
A701: 75.659000000000006
A702: 75.766999999999996
A703: 75.873999999999995
A704: 75.981999999999999
A705: 76.090999999999994
A706: 76.198999999999998
A707: 76.307000000000002
A708: 76.414000000000001
A709: 76.522000000000006
A710: 76.631
A711: 76.739000000000004
A712: 76.846999999999994
A713: 76.953999999999994
A714: 77.061999999999998
A715: 77.171000000000006
A716: 77.278999999999996
A717: 77.387
A718: 77.494
A719: 77.602000000000004
A720: 77.710999999999999
A721: 77.819000000000003
A722: 77.927000000000007
A723: 78.034000000000006
A724: 78.141999999999996
A725: 78.248999999999995
A726: 78.356999999999999
A727: 78.465999999999994
A728: 78.573999999999998
A729: 78.682000000000002
A730: 78.789000000000001
A731: 78.897000000000006
A732: 79.006
A733: 79.114000000000004
A734: 79.221999999999994
A735: 79.328999999999994
A736: 79.436999999999998
A737: 79.546000000000006
A738: 79.653999999999996
A739: 79.762
A740: 79.869
A741: 79.977000000000004
A742: 80.085999999999999
A743: 80.194000000000003
A744: 80.302000000000007
A745: 80.409000000000006
A746: 80.516999999999996
A747: 80.623999999999995
A748: 80.731999999999999
A749: 80.840999999999994
A750: 80.948999999999998
A751: 81.057000000000002
A752: 81.164000000000001
A753: 81.272000000000006
A754: 81.381
A755: 81.489000000000004
A756: 81.596999999999994
A757: 81.703999999999994
A758: 81.811999999999998
A759: 81.921000000000006
A760: 82.028999999999996
A761: 82.137
A762: 82.244
A763: 82.352000000000004
A764: 82.460999999999999
A765: 82.569000000000003
A766: 82.677000000000007
A767: 82.784000000000006
A768: 82.891999999999996
A769: 82.998999999999995
A770: 83.106999999999999
A771: 83.215999999999994
A772: 83.323999999999998
A773: 83.432000000000002
A774: 83.539000000000001
A775: 83.647000000000006
A776: 83.756
A777: 83.864000000000004
A778: 83.971999999999994
A779: 84.078999999999994
A780: 84.186999999999998
A781: 84.296000000000006
A782: 84.403999999999996
A783: 84.512
A784: 84.619
A785: 84.727000000000004
A786: 84.835999999999999
A787: 84.944000000000003
A788: 85.052000000000007
A789: 85.159000000000006
A790: 85.266999999999996
A791: 85.373999999999995
A792: 85.481999999999999
A793: 85.590999999999994
A794: 85.698999999999998
A795: 85.807000000000002
A796: 85.914000000000001
A797: 86.022000000000006
A798: 86.131
A799: 86.239000000000004
A800: 86.346999999999994
A801: 86.453999999999994
A802: 86.561999999999998
A803: 86.671000000000006
A804: 86.778999999999996
A805: 86.887
A806: 86.994
A807: 87.102000000000004
A808: 87.210999999999999
A809: 87.319000000000003
A810: 87.427000000000007
A811: 87.534000000000006
A812: 87.641999999999996
A813: 87.748999999999995
A814: 87.856999999999999
A815: 87.965999999999994
A816: 88.073999999999998
A817: 88.182000000000002
A818: 88.289000000000001
A819: 88.397000000000006
A820: 88.506
A821: 88.614000000000004
A822: 88.721999999999994
A823: 88.828999999999994
A824: 88.936999999999998
A825: 89.046000000000006
A826: 89.153999999999996
A827: 89.262
A828: 89.369
A829: 89.477000000000004
A830: 89.585999999999999
A831: 89.694000000000003
A832: 89.802000000000007
A833: 89.909000000000006
A834: 90.016999999999996
A835: 90.123999999999995
A836: 90.231999999999999
A837: 90.340999999999994
A838: 90.448999999999998
A839: 90.557000000000002
A840: 90.664000000000001
A841: 90.772000000000006
A842: 90.881
A843: 90.989000000000004
A844: 91.096999999999994
A845: 91.203999999999994
A846: 91.311999999999998
A847: 91.421000000000006
A848: 91.528999999999996
A849: 91.637
A850: 91.744
A851: 91.852000000000004
A852: 91.960999999999999
A853: 92.069000000000003
A854: 92.177000000000007
A855: 92.284000000000006
A856: 92.391999999999996
A857: 92.498999999999995
A858: 92.606999999999999
A859: 92.715999999999994
A860: 92.823999999999998
A861: 92.932000000000002
A862: 93.039000000000001
A863: 93.147000000000006
A864: 93.256
A865: 93.364000000000004
A866: 93.471999999999994
A867: 93.578999999999994
A868: 93.686999999999998
A869: 93.796000000000006
A870: 93.903999999999996
A871: 94.012
A872: 94.119
A873: 94.227000000000004
A874: 94.335999999999999
A875: 94.444000000000003
A876: 94.552000000000007
A877: 94.659000000000006
A878: 94.766999999999996
A879: 94.873999999999995
A880: 94.981999999999999
A881: 95.090999999999994
A882: 95.198999999999998
A883: 95.307000000000002
A884: 95.414000000000001
A885: 95.522000000000006
A886: 95.631
A887: 95.739000000000004
A888: 95.846999999999994
A889: 95.953999999999994
A890: 96.061999999999998
A891: 96.171000000000006
A892: 96.278999999999996
A893: 96.387
A894: 96.494
A895: 96.602000000000004
A896: 96.710999999999999
A897: 96.819000000000003
A898: 96.927000000000007
A899: 97.034000000000006
A900: 97.141999999999996
A901: 97.248999999999995
A902: 97.356999999999999
A903: 97.465999999999994
A904: 97.573999999999998
A905: 97.682000000000002
A906: 97.789000000000001
A907: 97.897000000000006
A908: 98.006
A909: 98.114000000000004
A910: 98.221999999999994
A911: 98.328999999999994
A912: 98.436999999999998
A913: 98.546000000000006
A914: 98.653999999999996
A915: 98.762
A916: 98.869
A917: 98.977000000000004
A918: 99.085999999999999
A919: 99.194000000000003
A920: 99.302000000000007
A921: 99.409000000000006
A922: 99.516999999999996
A923: 99.623999999999995
A924: 99.731999999999999
A925: 99.840999999999994
A926: 99.948999999999998
A927: 100.057
A928: 100.164
A929: 100.27200000000001
A930: 100.381
A931: 100.489
A932: 100.59699999999999
A933: 100.70399999999999
A934: 100.812
A935: 100.92100000000001
A936: 101.029
A937: 101.137
A938: 101.244
A939: 101.352
A940: 101.461
A941: 101.569
A942: 101.67700000000001
A943: 101.78400000000001
A944: 101.892
A945: 101.999
A946: 102.107
A947: 102.21599999999999
A948: 102.324
A949: 102.432
A950: 102.539
A951: 102.64700000000001
A952: 102.756
A953: 102.864
A954: 102.97199999999999
A955: 103.07899999999999
A956: 103.187
A957: 103.29600000000001
A958: 103.404
A959: 103.512
A960: 103.619
A961: 103.727
A962: 103.836
A963: 103.944
A964: 104.05200000000001
A965: 104.15900000000001
A966: 104.267
A967: 104.374
A968: 104.482
A969: 104.59099999999999
A970: 104.699
A971: 104.807
A972: 104.914
A973: 105.02200000000001
A974: 105.131
A975: 105.239
A976: 105.34699999999999
A977: 105.45399999999999
A978: 105.562
A979: 105.67100000000001
A980: 105.779
A981: 105.887
A982: 105.994
A983: 106.102
A984: 106.211
A985: 106.319
A986: 106.42700000000001
A987: 106.53400000000001
A988: 106.642
A989: 106.749
A990: 106.857
A991: 106.96599999999999
A992: 107.074
A993: 107.182
A994: 107.289
A995: 107.39700000000001
A996: 107.506
A997: 107.614
A998: 107.72199999999999
A999: 107.82899999999999
A1000: 107.937
A1001: 108.04600000000001
A1002: 108.154
A1003: 108.262
A1004: 108.369
A1005: 108.477
A1006: 108.586
A1007: 108.694
A1008: 108.80200000000001
A1009: 108.90900000000001
A1010: 109.017
A1011: 109.124
A1012: 109.232
A1013: 109.34099999999999
A1014: 109.449
A1015: 109.557
A1016: 109.664
A1017: 109.77200000000001
A1018: 109.881
A1019: 109.989
A1020: 110.09699999999999
A1021: 110.20399999999999
A1022: 110.312
A1023: 110.42100000000001
A1024: 110.529
A1025: 110.637
A1026: 110.744
A1027: 110.852
A1028: 110.961
A1029: 111.069
A1030: 111.17700000000001
A1031: 111.28400000000001
A1032: 111.392
A1033: 111.499
A1034: 111.607
A1035: 111.71599999999999
A1036: 111.824
A1037: 111.932
A1038: 112.039
A1039: 112.14700000000001
A1040: 112.256
A1041: 112.364
A1042: 112.47199999999999
A1043: 112.57899999999999
A1044: 112.687
A1045: 112.79600000000001
A1046: 112.904
A1047: 113.012
A1048: 113.119
A1049: 113.227
A1050: 113.336
A1051: 113.444
A1052: 113.55200000000001
A1053: 113.65900000000001
A1054: 113.767
A1055: 113.874
A1056: 113.982
A1057: 114.09099999999999
A1058: 114.199
A1059: 114.307
A1060: 114.414
A1061: 114.52200000000001
A1062: 114.631
A1063: 114.739
A1064: 114.84699999999999
A1065: 114.95399999999999
A1066: 115.062
A1067: 115.17100000000001
A1068: 115.279
A1069: 115.387
A1070: 115.494
A1071: 115.602
A1072: 115.711
A1073: 115.819
A1074: 115.92700000000001
A1075: 116.03400000000001
A1076: 116.142
A1077: 116.249
A1078: 116.357
A1079: 116.46599999999999
A1080: 116.574
A1081: 116.682
A1082: 116.789
A1083: 116.89700000000001
A1084: 117.006
A1085: 117.114
A1086: 117.22199999999999
A1087: 117.32899999999999
A1088: 117.437
A1089: 117.54600000000001
A1090: 117.654
A1091: 117.762
A1092: 117.869
A1093: 117.977
A1094: 118.086
A1095: 118.194
A1096: 118.30200000000001
A1097: 118.40900000000001
A1098: 118.517
A1099: 118.624
A1100: 118.732
A1101: 118.84099999999999
A1102: 118.949
A1103: 119.057
A1104: 119.164
A1105: 119.27200000000001
A1106: 119.381
A1107: 119.489
A1108: 119.59699999999999
A1109: 119.70399999999999
A1110: 119.812
A1111: 119.92100000000001
A1112: 120.029
A1113: 120.137
A1114: 120.244
A1115: 120.352
A1116: 120.461
A1117: 120.569
A1118: 120.67700000000001
A1119: 120.78400000000001
A1120: 120.892